Rank,Publication ID,DOI,PMID,PMCID,Title,Abstract,Acknowledgements,Funding,Source title,Anthology title,Book editors,MeSH terms,Publication date,PubYear,Publication date (online),Publication date (print),Volume,Issue,Pagination,Open Access,Publication Type,Authors,Authors (Raw Affiliation),Corresponding Authors,Authors Affiliations,Times cited,Recent citations,RCR,FCR,Source Linkout,Dimensions URL,Fields of Research (ANZSRC 2020),Sustainable Development Goals;;;;;;;;;;;;;;;;;;;;;;;;;;;;;;;;;;;;;;;;;;;;;;;;;;;;;;;;;;;;;;;;;;;;;;;;;;;;;;;;;;;;;;;;;;;;;;;;;;;;;;;;;;;;;;;;;;;
"8656,pub.1143460380,10.1536/ihj.21-388,34853231,,Detection of Profound Myocardial Damage by Cardiac MRI in a Patient with Severe Cardiotoxicity Induced by Anti-HER2 Therapy,""Anti-HER2 therapy has greatly improved the long-term prognosis of patients with HER2-positive breast cancer. Meanwhile, by interfering with the protective effects of neuregulin-1/HER2 signaling on stressed cardiomyocytes, anti-HER2 therapy occasionally induces reversible cancer therapeutics-related cardiac dysfunction (CTRCD). Cardiac magnetic resonance (CMR) parametric mapping or myocardial feature-tracking, in combination with late gadolinium enhancement (LGE) imaging, has the potential to detect changes in the myocardium in anti-HER2 therapy-related cardiac dysfunction. Here we report a breast cancer patient who experienced life-threatening CTRCD after treatment with trastuzumab plus pertuzumab. This case showed multiple transmural LGE-positive myocardial lesions in CMR imaging and high native T1 and T2 values in CMR parametric mapping, which was apparently more extensive than those observed in most patients with anti-HER2 therapy-related cardiac dysfunction. Consistent with profound myocardial damage indicated by CMR, her cardiac function was not fully restored despite intensive care and cardioprotective drug therapy. These findings suggest the potential usefulness of LGE imaging and parametric mapping by CMR for the assessment of myocardial injury to determine the clinical severity of anti-HER2 therapy-related cardiac dysfunction."",,,International Heart Journal,,,""Adult"; Antibodies, Monoclonal, Humanized; Antineoplastic Agents, Immunological; Breast Neoplasms; Cardiac Output, Low; Female; Heart; Heart Ventricles; Humans; Magnetic Resonance Imaging, Cine; Shock, Cardiogenic; Stroke Volume; Trastuzumab;" Ventricular Dysfunction, Left"",2021-11-29,2021,,2021-11-29,62,6,1436-1441,All OA";" Gold,Article,""Kadowaki, Hiroshi"; Ishida, Junichi; Uehara, Masae; Ishizuka, Masato; Kiyosue, Arihiro; Hatano, Masaru; Shimada, Shogo; Ono, Minoru; Akazawa, Hiroshi;" Komuro, Issei"",""Kadowaki, Hiroshi (Department of Cardiovascular Medicine, The University of Tokyo.)"; Ishida, Junichi (Department of Cardiovascular Medicine, The University of Tokyo.); Uehara, Masae (Department of Cardiovascular Medicine, The University of Tokyo.); Ishizuka, Masato (Department of Cardiovascular Medicine, The University of Tokyo.); Kiyosue, Arihiro (Department of Cardiovascular Medicine, The University of Tokyo.); Hatano, Masaru (Department of Cardiovascular Medicine, The University of Tokyo.); Shimada, Shogo (Department of Cardiac Surgery, Graduate School of Medicine, The University of Tokyo.); Ono, Minoru (Department of Cardiac Surgery, Graduate School of Medicine, The University of Tokyo.); Akazawa, Hiroshi (Department of Cardiovascular Medicine, The University of Tokyo.);" Komuro, Issei (Department of Cardiovascular Medicine, The University of Tokyo.)"",,""Kadowaki, Hiroshi (University of Tokyo)"; Ishida, Junichi (University of Tokyo); Uehara, Masae (University of Tokyo); Ishizuka, Masato (University of Tokyo); Kiyosue, Arihiro (University of Tokyo); Hatano, Masaru (University of Tokyo); Shimada, Shogo (University of Tokyo); Ono, Minoru (University of Tokyo); Akazawa, Hiroshi (University of Tokyo);" Komuro, Issei (University of Tokyo)"",2,2,,0.83,https://www.jstage.jst.go.jp/article/ihj/62/6/62_21-388/_pdf,https://app.dimensions.ai/details/publication/pub.1143460380,32 Biomedical and Clinical Sciences"; 3211 Oncology and Carcinogenesis,;;;;;;;;;;;;;;;;;;;;;;;;;;;;;;;;;;;;;;;;;;;;;;;;;;;;;;;;;;;;;;;;;;;;;;;;;
"8607,pub.1134365649,10.1007/s10741-020-10072-8,33405000,,Cardiotoxicity in HER2-positive breast cancer patients,""Due to the recent advances in diagnosis and management of patients with HER2-positive breast cancer, especially through novel HER2-targeted agents, cardiotoxicity becomes an emerging problem. Although chemotherapy significantly increases survival, the risk of cardiovascular disease development is high and still underestimated and could imply treatment discontinuation. Frequently, due to lack of rigorous diagnosis strategies, cardiotoxicity assessment is delayed, and, moreover, the efficacy of current therapy options in restoring heart function is questionable. For a comprehensive risk assessment, it is vital to characterize the clinical spectrum of HER2-targeted agents and anthracyclines, as well as their pathogenic pathways involved in cardiotoxicity. Advanced cardiovascular multimodal imaging and circulating biomarkers plays primary roles in early assessing cardiotoxicity and also in guiding specific preventive measures. Even though the knowledge in this field is rapidly expanding, there are still questions that arise regarding the optimal approach in terms of timing and methods. The aim of the current review aims to providean overview of currently available data."",The authors wish to acknowledge the contribution of Andrei Tomeci for graphical support.,,Heart Failure Reviews,,,""Anthracyclines"; Breast Neoplasms; Cardiotoxicity; Female; Humans; Receptor, ErbB-2;" Trastuzumab"",2021-01-06,2021,2021-01-06,2021-07,26,4,919-935,Closed,Article,""Gonciar, Diana"; Mocan, Lucian; Zlibut, Alexandru; Mocan, Teodora;" Agoston-Coldea, Lucia"",""Gonciar, Diana (2nd Department of Internal Medicine, Iuliu Hațieganu University of Medicine and Pharmacy, Cluj-Napoca, Romania)"; Mocan, Lucian (3rd Surgery Department, Iuliu Hațieganu University of Medicine and Pharmacy, Cluj-Napoca, Romania; Department of Nanomedicine, Regional Institute of Gastroenterology and Hepatology, Cluj-Napoca, Romania); Zlibut, Alexandru (2nd Department of Internal Medicine, Iuliu Hațieganu University of Medicine and Pharmacy, Cluj-Napoca, Romania); Mocan, Teodora (Physiology Department, Iuliu Hațieganu” University of Medicine and Pharmacy, Cluj-Napoca, Romania; Department of Nanomedicine, Regional Institute of Gastroenterology and Hepatology, Cluj-Napoca, Romania);" Agoston-Coldea, Lucia (2nd Department of Internal Medicine, Iuliu Hațieganu University of Medicine and Pharmacy, Cluj-Napoca, Romania)"",""Agoston-Coldea, Lucia (Iuliu Hațieganu University of Medicine and Pharmacy)"",""Gonciar, Diana (Iuliu Hațieganu University of Medicine and Pharmacy)"; Mocan, Lucian (Iuliu Hațieganu University of Medicine and Pharmacy; Department of Nanomedicine, Regional Institute of Gastroenterology and Hepatology, Cluj-Napoca, Romania); Zlibut, Alexandru (Iuliu Hațieganu University of Medicine and Pharmacy); Mocan, Teodora (Iuliu Hațieganu University of Medicine and Pharmacy; Department of Nanomedicine, Regional Institute of Gastroenterology and Hepatology, Cluj-Napoca, Romania);" Agoston-Coldea, Lucia (Iuliu Hațieganu University of Medicine and Pharmacy)"",10,10,0.85,4.17,,https://app.dimensions.ai/details/publication/pub.1134365649,32 Biomedical and Clinical Sciences"; 3211 Oncology and Carcinogenesis,3 Good Health and Well Being;;;;;;;;;;;;;;;;;;;;;;;;;;;;;;;;;;;;;;;;;;;;;;;;;;;;;;;;;;;;;;;;;;;;;;;;;;;;;;;;;;;;;;;;;;;;
"8593,pub.1158036129,10.1186/s41747-023-00338-9,37183212,PMC10183380,Longitudinal assessment of cardiac parameters through MRI in breast cancer patients treated with anti-HER2 therapy,""BackgroundWe evaluated the early changes in left ventricular (LV) volumetric, functional, and tissue characteristics in human epidermal growth factor receptor 2 (HER2)-positive breast cancer patients treated with trastuzumab and/or pertuzumab at cardiac magnetic resonance imaging (MRI).MethodsHER2-positive breast cancer patients undergoing planned anti-HER2 therapy and nonanthracycline-based chemotherapy were enrolled and subdivided into dual anti-HER2 (trastuzumab plus pertuzumab) group and trastuzumab group. Cardiac MRI was performed before treatment and three months after starting, covering ventricular volumes, cardiac function, systolic myocardial strain, myocardial oedema, and T1 and T2 relaxation times. Cardiac dysfunction was primarily defined as a > 10% reduction in LV ejection fraction (LVEF) to < 55% and/or a > 15% global longitudinal strain (GLS) change at the follow-up MRI examination.ResultsTwenty-four HER2-positive patients were evaluated (16 in the dual anti-HER2 group, 8 in the trastuzumab group). Six patients developed cardiac dysfunction at follow-up, five of them in the dual anti-HER2 group. One patient developed symptomatic heart failure, and five patients developed asymptomatic cardiac dysfunction. Patients displayed significantly decreased systolic function and increased T1 and T2 relaxation time at follow-up (p ≤ 0.031). Systolic dysfunction remained significant in the dual anti-HER2 group. The decrease in GLS in the trastuzumab group was not significant (p = 0.169). T1 and T2 relaxation times tended to increase, but this was not significant at subgroup analysis.ConclusionsCardiac MRI scans showed frequent signs of subclinical cardiotoxicity after short-term anti-HER2 therapy and nonanthracycline-based chemotherapy";" the effect was slightly stronger in patients treated with dual therapy.Key points• A frequent subclinical cardiotoxicity was detected by cardiac magnetic resonance imaging after short-term anti-human epidermal growth factor receptor 2 (HER2) therapy.• The change in myocardial strain was more marked in patients treated with dual (trastuzumab plus pertuzumab) than with trastuzumab only anti-HER2 therapy.• Cardiotoxicity surveillance through MRI is an interesting option particularly in patients treated with dual anti-HER2 therapy."",,""This work was supported by the National Natural Science Foundation of China (81971616), the Medical and Health Science and Technology Innovation Project of the Chinese Academy of Medical Sciences (2021-I2M-C&T-B-065), and the Beijing Hope Run Special Fund of Cancer Foundation of China (LC2020B19)."",European Radiology Experimental,,,""Female"; Humans; Breast Neoplasms; Cardiotoxicity; Heart Diseases; Magnetic Resonance Imaging; Trastuzumab;" Antibodies, Monoclonal, Humanized"",2023-05-15,2023,2023-05-15,,7,1,22,All OA";" Gold,Article,""Cheng, Sainan"; Wang, Jianwei; Wang, Yawen; Qi, Linlin; Li, Fenglan; Liu, Jianing; Chen, Jiaqi; Fan, Yang;" Xie, Lizhi"",""Cheng, Sainan (Department of Diagnostic Radiology, National Cancer Center / Cancer Hospital, Chinese Academy of Medical Sciences and Peking Union Medical College, #17 Panjiayuan Nanli, Chaoyang District, 100021, Beijing, China)"; Wang, Jianwei (Department of Diagnostic Radiology, National Cancer Center / Cancer Hospital, Chinese Academy of Medical Sciences and Peking Union Medical College, #17 Panjiayuan Nanli, Chaoyang District, 100021, Beijing, China); Wang, Yawen (Department of Diagnostic Radiology, National Cancer Center / Cancer Hospital, Chinese Academy of Medical Sciences and Peking Union Medical College, #17 Panjiayuan Nanli, Chaoyang District, 100021, Beijing, China); Qi, Linlin (Department of Diagnostic Radiology, National Cancer Center / Cancer Hospital, Chinese Academy of Medical Sciences and Peking Union Medical College, #17 Panjiayuan Nanli, Chaoyang District, 100021, Beijing, China); Li, Fenglan (Department of Diagnostic Radiology, National Cancer Center / Cancer Hospital, Chinese Academy of Medical Sciences and Peking Union Medical College, #17 Panjiayuan Nanli, Chaoyang District, 100021, Beijing, China); Liu, Jianing (Department of Diagnostic Radiology, National Cancer Center / Cancer Hospital, Chinese Academy of Medical Sciences and Peking Union Medical College, #17 Panjiayuan Nanli, Chaoyang District, 100021, Beijing, China); Chen, Jiaqi (Department of Diagnostic Radiology, National Cancer Center / Cancer Hospital, Chinese Academy of Medical Sciences and Peking Union Medical College, #17 Panjiayuan Nanli, Chaoyang District, 100021, Beijing, China); Fan, Yang (MR Research China, GE Healthcare, Beijing, China);" Xie, Lizhi (MR Research China, GE Healthcare, Beijing, China)"",""Wang, Jianwei (Chinese Academy of Medical Sciences & Peking Union Medical College)"",""Cheng, Sainan (Chinese Academy of Medical Sciences & Peking Union Medical College)"; Wang, Jianwei (Chinese Academy of Medical Sciences & Peking Union Medical College); Wang, Yawen (Chinese Academy of Medical Sciences & Peking Union Medical College); Qi, Linlin (Chinese Academy of Medical Sciences & Peking Union Medical College); Li, Fenglan (Chinese Academy of Medical Sciences & Peking Union Medical College); Liu, Jianing (Chinese Academy of Medical Sciences & Peking Union Medical College); Chen, Jiaqi (Chinese Academy of Medical Sciences & Peking Union Medical College); Fan, Yang (MR Research China, GE Healthcare, Beijing, China);" Xie, Lizhi (MR Research China, GE Healthcare, Beijing, China)"",1,1,,,https://eurradiolexp.springeropen.com/counter/pdf/10.1186/s41747-023-00338-9,https://app.dimensions.ai/details/publication/pub.1158036129,32 Biomedical and Clinical Sciences"; 3211 Oncology and Carcinogenesis,;;;;;;;;;;;;;;;;;;;;;;;;;;;;;;;;;;;;;;;;;;;;;;;;;;;;;;;;;;;;;;;;;;;;;;;;;;;;;;;;;
"8123,pub.1164561220,10.3390/jcm12196295,37834939,PMC10573256,Multimodal Imaging of Cancer Therapy-Related Cardiac Dysfunction in Breast Cancer—A State-of-the-Art Review,""BACKGROUND: This review focuses on multimodality imaging of cardiotoxicity in cancer patients, with the aim of evaluating the effectiveness of different techniques in detecting and monitoring cardiac changes associated with cancer therapy.";;;;;;;;;;;;;;;;;;;;;;;;;;;;;;;;;;;;;;;;;;;;;;;;;;;;;;;;;;;;;;;;;;;;;;;;;;;;;;;;;;;;;;;;;;;;;;;;;;;;;;;;;;;;;;;;;;;
METHODS: Eight studies were included in the review, covering various imaging modalities such as cardiac magnetic resonance imaging, echocardiography, and multigated acquisition scanning.;;;;;;;;;;;;;;;;;;;;;;;;;;;;;;;;;;;;;;;;;;;;;;;;;;;;;;;;;;;;;;;;;;;;;;;;;;;;;;;;;;;;;;;;;;;;;;;;;;;;;;;;;;;;;;;;;;;
RESULTS: Cardiac magnetic resonance imaging emerged as the most definitive modality, offering real-time detection, comprehensive assessment of cardiac function, the ability to detect early myocardial changes, and superior detection of cardiotoxicity when compared to the other imaging modalities. The studies also emphasize the importance of parameters such as left ventricular ejection fraction and global longitudinal strain in assessing cardiac function and predicting cardiotoxicity.;;;;;;;;;;;;;;;;;;;;;;;;;;;;;;;;;;;;;;;;;;;;;;;;;;;;;;;;;;;;;;;;;;;;;;;;;;;;;;;;;;;;;;;;;;;;;;;;;;;;;;;;;;;;;;;;;;;
CONCLUSION: Due to the common use of HER2 agents and anthracyclines within the breast cancer population, the LVEF as a critical prognostic measurement for assessing heart health and estimating the severity of left-sided cardiac malfunction is a commonly used endpoint. CTRCD rates differed between imaging modalities, with cardiac MRI the most sensitive. The use of multimodal cardiac imaging remains a nuanced area, influenced by local availability, the clinical question at hand, body habits, and medical comorbidities. All of the imaging modalities listed have a role to play in current care;" however, focus should be given to increasing the provision of cardiac MRI for breast cancer patients in the future to optimize the detection of CTRCD and patient outcomes thereafter."",No grants or awards require declaration.,This research received no external funding.,Journal of Clinical Medicine,,,,2023-09-29,2023,2023-09-29,,12,19,6295,All OA";" Gold,Article,""Cronin, Michael"; Seher, Mehreen; Arsang-Jang, Shahram; Lowery, Aoife; Kerin, Michael; Wijns, William;" Soliman, Osama"",""Cronin, Michael (CORRIB Core Laboratory, University of Galway, H91 TK33 Galway, Ireland, m.--2@nuigalway.ie, (M.S.)";); Seher, Mehreen (CORRIB Core Laboratory, University of Galway, H91 TK33 Galway, Ireland, m.--2@nuigalway.ie, (M.S.);); Arsang-Jang, Shahram (CORRIB Core Laboratory, University of Galway, H91 TK33 Galway, Ireland, m.--2@nuigalway.ie, (M.S.);); Lowery, Aoife (Precision Cardio-Oncology Research Enterprise (P-CORE), H91 TK33 Galway, Ireland; CURAM Centre for Medical Devices, H91 TK33 Galway, Ireland); Kerin, Michael (Precision Cardio-Oncology Research Enterprise (P-CORE), H91 TK33 Galway, Ireland; Discipline of Surgery, Lambe Institute for Translational Research, University of Galway, H91 TK33 Galway, Ireland); Wijns, William (CORRIB Core Laboratory, University of Galway, H91 TK33 Galway, Ireland, m.--2@nuigalway.ie, (M.S.);; Precision Cardio-Oncology Research Enterprise (P-CORE), H91 TK33 Galway, Ireland; CURAM Centre for Medical Devices, H91 TK33 Galway, Ireland); Soliman, Osama (CORRIB Core Laboratory, University of Galway, H91 TK33 Galway, Ireland, m.--2@nuigalway.ie, (M.S.);; Precision Cardio-Oncology Research Enterprise (P-CORE), H91 TK33 Galway, Ireland; CURAM Centre for Medical Devices, H91 TK33 Galway, Ireland;" Discipline of Cardiology, Saolta Group, Galway University Hospital, Health Service Executive and CORRIB Core Laboratory, National University of Ireland Galway (NUIG), H91 TK33 Galway, Ireland)"",""Soliman, Osama (University of Galway"; Precision Cardio-Oncology Research Enterprise (P-CORE), H91 TK33 Galway, Ireland; CURAM Centre for Medical Devices, H91 TK33 Galway, Ireland; University Hospital Galway;" University of Galway)"",""Cronin, Michael (University of Galway)"; Seher, Mehreen (University of Galway); Arsang-Jang, Shahram (University of Galway); Lowery, Aoife (Precision Cardio-Oncology Research Enterprise (P-CORE), H91 TK33 Galway, Ireland; CURAM Centre for Medical Devices, H91 TK33 Galway, Ireland); Kerin, Michael (Precision Cardio-Oncology Research Enterprise (P-CORE), H91 TK33 Galway, Ireland; University of Galway); Wijns, William (University of Galway; Precision Cardio-Oncology Research Enterprise (P-CORE), H91 TK33 Galway, Ireland; CURAM Centre for Medical Devices, H91 TK33 Galway, Ireland); Soliman, Osama (University of Galway; Precision Cardio-Oncology Research Enterprise (P-CORE), H91 TK33 Galway, Ireland; CURAM Centre for Medical Devices, H91 TK33 Galway, Ireland; University Hospital Galway;" University of Galway)"",0,0,,,https://www.mdpi.com/2077-0383/12/19/6295/pdf?version=1695993299,https://app.dimensions.ai/details/publication/pub.1164561220,32 Biomedical and Clinical Sciences"; 3202 Clinical Sciences; 3211 Oncology and Carcinogenesis,;;;;;;;;;;;;;;;;;;;;;;;;;;;;;;;;;;;;;;;;;;;;;;;;;;;;;;;;;;;;;;;;;;;;;
"8107,pub.1164106610,10.1186/s12872-023-03495-2,37715125,PMC10504696,Value of Echocardiography and Cardiac Magnetic resonance in assessing left ventricular function in breast and gastric cancer patients after Anthracycline Chemotherapy,""BackgroundEchocardiography (ECHO) and cardiac magnetic resonance imaging (MRI) are used to observe changes in the left ventricular structure in patients with breast and gastric cancer after 6 cycles of chemotherapy. Based on the observed values, we aimed to evaluate the cardiotoxicity of anthracyclines in cancer patients and to analyze the consistency of the two examination methods in assessing left ventricular function after chemotherapy.MethodsFrom January 2020 to January 2022, the data of 80 patients with malignant tumors who received anthracycline chemotherapy (breast cancer, n = 40";" gastric cancer, n = 40) and 40 healthy volunteers (Control group) were retrospectively collected. Serum high-sensitivity cardiac troponin T (hs-cTnT) levels were detected by an automatic immunoassay analyzer. Left ventricular end-systolic volume (LVESV), left ventricular end-diastolic volume (LVEDV) and left ventricular ejection fraction (LVEF) were measured by cardiac MRI and 2-dimensional ECHO using the biplane Simpson’s method.ResultsCompared with baseline values, serum high-sensitivity cardiac troponin T (hs-cTnT) levels were significantly increased in patients with breast cancer and gastric cancer after 6 cycles of chemotherapy (P < 0.05). In addition, LVEDV, LVESV and LVEF measured with MRI were higher than those detected by ECHO in cancer patients after 6 cycles of chemotherapy (P < 0.05). And the Bland-Altman plot analysis showed that LVEDV, LVESV and LVEF measured by the two examination methods were in good agreement.ConclusionBreast and gastric cancer patients exhibited elevated levels of hs-cTnT after 6 cycles of chemotherapy, indicating potential cardiotoxicity. Additionally, cardiac MRI and 2-dimensional ECHO showed good agreement in assessing left ventricular function, with ECHO tending to underestimate volume measurements compared to MRI."",Not applicable.,This study did not receive any funding in any form.,BMC Cardiovascular Disorders,,,""Humans"; Female; Stomach Neoplasms; Ventricular Function, Left; Stroke Volume; Anthracyclines; Cardiotoxicity; Retrospective Studies; Troponin T; Magnetic Resonance Imaging; Breast Neoplasms; Echocardiography; Antibiotics, Antineoplastic; Polyketides;" Magnetic Resonance Spectroscopy"",2023-09-15,2023,2023-09-15,,23,1,465,All OA";" Gold,Article,""Jin, Chao-long"; Shi, Xue-gong; Wang, Ting-ting; Li, Hong-wen; Zhang, Ding-Xin; Sheng, Zhe; Xiao, Jie;" Yu, Yong-Qiang"",""Jin, Chao-long (Cardiac Imaging Center, The First Affiliated Hospital of Anhui Medical University, 230022, Hefei, Anhui, China)"; Shi, Xue-gong (Cardiac Imaging Center, The First Affiliated Hospital of Anhui Medical University, 230022, Hefei, Anhui, China); Wang, Ting-ting (Cardiac Imaging Center, The First Affiliated Hospital of Anhui Medical University, 230022, Hefei, Anhui, China); Li, Hong-wen (MRI Room, The First Affiliated Hospital of Anhui Medical University, 230022, Hefei, Anhui, China); Zhang, Ding-Xin (Cardiac Imaging Center, The First Affiliated Hospital of Anhui Medical University, 230022, Hefei, Anhui, China); Sheng, Zhe (Cardiac Imaging Center, The First Affiliated Hospital of Anhui Medical University, 230022, Hefei, Anhui, China); Xiao, Jie (Cardiac Imaging Center, The First Affiliated Hospital of Anhui Medical University, 230022, Hefei, Anhui, China);" Yu, Yong-Qiang (Department of Radiology, The First Affiliated Hospital of Anhui Medical University, 230022, Hefei, Anhui, China)"",""Yu, Yong-Qiang (First Affiliated Hospital of Anhui Medical University)"",""Jin, Chao-long (First Affiliated Hospital of Anhui Medical University)"; Shi, Xue-gong (First Affiliated Hospital of Anhui Medical University); Wang, Ting-ting (First Affiliated Hospital of Anhui Medical University); Li, Hong-wen (First Affiliated Hospital of Anhui Medical University); Zhang, Ding-Xin (First Affiliated Hospital of Anhui Medical University); Sheng, Zhe (First Affiliated Hospital of Anhui Medical University); Xiao, Jie (First Affiliated Hospital of Anhui Medical University);" Yu, Yong-Qiang (First Affiliated Hospital of Anhui Medical University)"",0,0,,,https://bmccardiovascdisord.biomedcentral.com/counter/pdf/10.1186/s12872-023-03495-2,https://app.dimensions.ai/details/publication/pub.1164106610,32 Biomedical and Clinical Sciences"; 3211 Oncology and Carcinogenesis,;;;;;;;;;;;;;;;;;;;;;;;;;;;;;;;;;;;;;;;;;;;;;;;;;;;;;;;;;;;;;;;;;;;;;;;;;;;;;
