"CONCLUSIONS: Results from the statistical analysis reveal the likelihood of LV remodeling in this patient subpopulation otherwise not indicated by LVEF measurements."",""Acknowledgments We are very appreciative of staff at the Imaging Center, Children&#x27";s and Women&#x27;s Hospital, University of South Alabama toward helping us acquire the MRI data. We thank Dr. Clive Woods for his help with proof reading and statistical analysis for this study. We greatly appreciate Dr. Fredrick Epstein&#x27;"s insight toward acquiring functional DENSE data in this specific patient subpopulation. We are also extremely appreciative of Dr. Michael Pasque for his clinical insight on the condition of cardiotoxicity. Availability of data Data related to this project can be obtained from the Open Science Framework repository at URL: https://osf.io/76y8t/ DOI: 10.17605/OSF.IO/76Y8T or upon request to the corresponding author, Julia Kar, PhD, email: jkar@southalabama.edu Funding This study was funded by University of South Alabama Award Number: A19-0028-001|Recipient: Julia Kar."",This study was funded by University of South Alabama Award Number: A19-0028-001|Recipient: Julia Kar.,Magnetic Resonance Imaging,,,""Adult"; Aged; Antineoplastic Agents; Breast Neoplasms; Cardiotoxicity; Female; Heart Ventricles; Humans; Image Interpretation, Computer-Assisted; Imaging, Three-Dimensional; Magnetic Resonance Imaging; Middle Aged; Muscle Contraction; Survivors; Ventricular Dysfunction, Left; Ventricular Function, Left;" Ventricular Remodeling"",2019-06-27,2019,2019-06-27,2019-10,62,,94-103,All OA";" Green,Article,""Kar, Julia"; Cohen, Michael V; McQuiston, Samuel A; Figarola, Maria S;" Malozzi, Christopher M"",""Kar, Julia (Departments of Mechanical Engineering and Pharmacology, University of South Alabama, 150 Jaguar Drive, Mobile, AL 36688, United States of America. Electronic address: jkar@southalabama.edu.)"; Cohen, Michael V (Department of Cardiology, College of Medicine, University of South Alabama, 1700 Center Street, Mobile, AL 36604, United States of America.); McQuiston, Samuel A (Department of Radiology, University of South Alabama, 2451 USA Medical Center Drive, Mobile, AL 36617, United States of America.); Figarola, Maria S (Department of Radiology, University of South Alabama, 2451 USA Medical Center Drive, Mobile, AL 36617, United States of America.);" Malozzi, Christopher M (Department of Cardiology, College of Medicine, University of South Alabama, 1700 Center Street, Mobile, AL 36604, United States of America.)"",""Kar, Julia (University of South Alabama)"",""Kar, Julia (University of South Alabama)"; Cohen, Michael V (University of South Alabama); McQuiston, Samuel A (University of South Alabama); Figarola, Maria S (University of South Alabama);" Malozzi, Christopher M (University of South Alabama)"",6,1,0.37,1.58,https://europepmc.org/articles/pmc7170178?pdf=render,https://app.dimensions.ai/details/publication/pub.1117503711,32 Biomedical and Clinical Sciences"; 3211 Oncology and Carcinogenesis,;;;;;;;;;;;;;;;;;;;;;;;;;;;;;;;;;;;;;;;;;;;;;;;;;;;;;;;;;;;;;;;;;;;;;;;;;;;;;;;;;;
"4918,pub.1084777717,10.1186/s12968-017-0356-4,28395671,PMC5387372,Longitudinal assessment of right ventricular structure and function by cardiovascular magnetic resonance in breast cancer patients treated with trastuzumab: a prospective observational study,""BackgroundThere are limited data on the effects of trastuzumab on the right ventricle (RV). Therefore, we sought to evaluate the temporal changes in right ventricular (RV) structure and function as measured by cardiovascular magnetic resonance (CMR), and their relationship with left ventricular (LV) structure and function in breast cancer patients treated with trastuzumab.MethodsProspective, longitudinal, observational study involving 41 women with HER2+ breast cancer who underwent serial CMR at baseline, 6, 12, and 18 months after initiation of trastuzumab. A single blinded observer measured RV parameters on de-identified CMRs in a random order. Linear mixed models were used to investigate temporal changes in RV parameters.ResultsOf the 41 women (age 52 ± 11 years), only one patient experienced trastuzumab-induced cardiotoxicity. Compared to baseline, there were small but significant increases in the RV end-diastolic volume at 6 months (p = 0.002) and RV end-systolic volume at 6 and 12 months (p < 0.001 for both), but not at 18 months (p = 0.82 and 0.13 respectively). RV ejection fraction (RVEF), when compared to baseline (58.3%, 95% CI 57.1–59.5%), showed corresponding decreases at 6 months (53.9%, 95% CI 52.5–55.4%, p < 0.001) and 12 months (55%, 95% CI 53.8–56.2%, p < 0.001) that recovered at 18 months (56.6%, 95% CI 55.1–58.0%, p = 0.08). Although the temporal pattern of changes in LVEF and RVEF were similar, there was no significant correlation between RVEF and LVEF at baseline (r = 0.29, p = 0.07) or between their changes at 6 months (r = 0.24, p = 0.17).ConclusionIn patients receiving trastuzumab without overt cardiotoxicity, there is a subtle but significant deleterious effect on RV structure and function that recover at 18 months, which can be detected by CMR. Furthermore, monitoring of LVEF alone may not be sufficient in detecting early RV injury. These novel findings provide further support for CMR in monitoring early cardiotoxicity.Trial registrationClinicalTrials.gov Identifier: NCT01022086. Date of registration: November 27, 2009."",""We thank all the study coordinators and patients who participated in this study, and Rosane Nisenbaum who assisted in data management."",""This study was supported by an operating grant from the Canadian Institutes of Health Research and an industry partnered grant from Roche Canada. The study sponsors had no role in the study design, data collection or analysis, interpretation of the findings, writing the manuscript or the decision to submit the manuscript for publication."",Journal of Cardiovascular Magnetic Resonance,,,""Adult"; Analysis of Variance; Antineoplastic Agents, Immunological; Breast Neoplasms; Cardiotoxicity; Early Diagnosis; Female; Heart Ventricles; Humans; Linear Models; Longitudinal Studies; Magnetic Resonance Imaging, Cine; Middle Aged; Ontario; Predictive Value of Tests; Prospective Studies; Recovery of Function; Single-Blind Method; Stroke Volume; Time Factors; Trastuzumab; Treatment Outcome; Ventricular Dysfunction, Right; Ventricular Function, Left;" Ventricular Function, Right"",2017-04-10,2017,2017-04-10,2017-12,19,1,44,All OA";" Gold,Article,""Barthur, Ashita"; Brezden-Masley, Christine; Connelly, Kim A.; Dhir, Vinita; Chan, Kelvin K. W.; Haq, Rashida; Kirpalani, Anish; Barfett, Joseph J.; Jimenez-Juan, Laura; Karur, Gauri R.; Deva, Djeven P.;" Yan, Andrew T."",""Barthur, Ashita (Department of Medical Imaging, St. Michael’s Hospital, University of Toronto, Toronto, ON, Canada)"; Brezden-Masley, Christine (Division of Hematology/Oncology, St. Michael’s Hospital, University of Toronto, Toronto, ON, Canada; Keenan Research Centre, Li Ka Shing Knowledge Institute, St. Michael’s Hospital, University of Toronto, Toronto, ON, Canada); Connelly, Kim A. (Keenan Research Centre, Li Ka Shing Knowledge Institute, St. Michael’s Hospital, University of Toronto, Toronto, ON, Canada; Terrence Donnelly Heart Centre, St. Michael’s Hospital, University of Toronto, Toronto, ON, Canada; Division of Cardiology, St. Michael’s Hospital, University of Toronto, Toronto, ON, Canada); Dhir, Vinita (Division of Hematology/Oncology, St. Michael’s Hospital, University of Toronto, Toronto, ON, Canada); Chan, Kelvin K. W. (Sunnybrook Health Sciences Centre, University of Toronto, Cancer Care Ontario, Canadian Center for Applied Research in Cancer Control, Toronto, ON, Canada); Haq, Rashida (Division of Hematology/Oncology, St. Michael’s Hospital, University of Toronto, Toronto, ON, Canada); Kirpalani, Anish (Department of Medical Imaging, St. Michael’s Hospital, University of Toronto, Toronto, ON, Canada; Keenan Research Centre, Li Ka Shing Knowledge Institute, St. Michael’s Hospital, University of Toronto, Toronto, ON, Canada); Barfett, Joseph J. (Department of Medical Imaging, St. Michael’s Hospital, University of Toronto, Toronto, ON, Canada; Keenan Research Centre, Li Ka Shing Knowledge Institute, St. Michael’s Hospital, University of Toronto, Toronto, ON, Canada); Jimenez-Juan, Laura (Department of Medical Imaging, Sunnybrook Health Sciences Centre, University of Toronto, Toronto, ON, Canada); Karur, Gauri R. (Department of Medical Imaging, St. Michael’s Hospital, University of Toronto, Toronto, ON, Canada); Deva, Djeven P. (Department of Medical Imaging, St. Michael’s Hospital, University of Toronto, Toronto, ON, Canada; Keenan Research Centre, Li Ka Shing Knowledge Institute, St. Michael’s Hospital, University of Toronto, Toronto, ON, Canada); Yan, Andrew T. (Keenan Research Centre, Li Ka Shing Knowledge Institute, St. Michael’s Hospital, University of Toronto, Toronto, ON, Canada; Terrence Donnelly Heart Centre, St. Michael’s Hospital, University of Toronto, Toronto, ON, Canada;" Division of Cardiology, St. Michael’s Hospital, University of Toronto, Toronto, ON, Canada)"",""Deva, Djeven P. (University of Toronto"; St. Michael's Hospital; University of Toronto; St. Michael's Hospital); Yan, Andrew T. (University of Toronto; St. Michael's Hospital; University of Toronto; St. Michael's Hospital; University of Toronto;" St. Michael's Hospital)"",""Barthur, Ashita (University of Toronto"; St. Michael's Hospital); Brezden-Masley, Christine (University of Toronto; St. Michael's Hospital; University of Toronto; St. Michael's Hospital); Connelly, Kim A. (University of Toronto; St. Michael's Hospital; University of Toronto; St. Michael's Hospital; University of Toronto; St. Michael's Hospital); Dhir, Vinita (University of Toronto; St. Michael's Hospital); Chan, Kelvin K. W. (University of Toronto; Sunnybrook Health Science Centre); Haq, Rashida (University of Toronto; St. Michael's Hospital); Kirpalani, Anish (University of Toronto; St. Michael's Hospital; University of Toronto; St. Michael's Hospital); Barfett, Joseph J. (University of Toronto; St. Michael's Hospital; University of Toronto; St. Michael's Hospital); Jimenez-Juan, Laura (University of Toronto; Sunnybrook Health Science Centre); Karur, Gauri R. (University of Toronto; St. Michael's Hospital); Deva, Djeven P. (University of Toronto; St. Michael's Hospital; University of Toronto; St. Michael's Hospital); Yan, Andrew T. (University of Toronto; St. Michael's Hospital; University of Toronto; St. Michael's Hospital; University of Toronto;" St. Michael's Hospital)"",45,11,1.69,10.44,https://jcmr-online.biomedcentral.com/track/pdf/10.1186/s12968-017-0356-4,https://app.dimensions.ai/details/publication/pub.1084777717,32 Biomedical and Clinical Sciences"; 3202 Clinical Sciences; 3211 Oncology and Carcinogenesis,;;;;;;;;;;
"4883,pub.1014800790,10.1016/j.ijrobp.2015.07.2287,26530752,,Cardiac Function After Multimodal Breast Cancer Therapy Assessed With Functional Magnetic Resonance Imaging and Echocardiography Imaging,""PURPOSE: Breast intensity modulated radiation therapy (IMRT) reduces high-dose heart volumes but increases low-dose volumes. We prospectively assessed heart changes after 3D conformal RT (3DCRT) and IMRT for left-sided breast cancer. Heart dose was analyzed individually, 3DCRT patients were moderately exposed, and IMRT was performed only in patients with unacceptably high heart doses upon 3DCRT planning.";;;;;;;;;;;;;;;;;;;;;;;;;;;;;;;;;;;;;;;;;;;;;;;;;;;;;;;;;;;;;;;;;;;;;;;;;;;;;;;;;;;;;;;;;;;;;;;;;;;;;;;;;;;;;;;;;;;
METHODS AND MATERIALS: In 49 patients (38 patients received 3DCRT; 11 patients received IMRT; and 20 patients received neoadjuvant or adjuvant chemotherapy) magnetic resonance imaging (MRI) and echocardiography were performed before and at 6, 12, and 24 months after treatment.;;;;;;;;;;;;;;;;;;;;;;;;;;;;;;;;;;;;;;;;;;;;;;;;;;;;;;;;;;;;;;;;;;;;;;;;;;;;;;;;;;;;;;;;;;;;;;;;;;;;;;;;;;;;;;;;;
RESULTS: Mean heart dose for IMRT was 12.9 ± 3.9 Gy versus 4.5 ± 2.4 Gy for 3DCRT. Heart volumes receiving >40 Gy were 2.6% (3DCRT) versus 1.3% (IMRT); doses were >50 Gy only with 3DCRT. Temporary ejection fraction (EF) decrease was observed on MRI after 6 months (63%-59%, P=.005) resolving at 24 months. Only 3 patients had pronounced largely transient changes of EF and left ventricular enddiastolic diameter (LVEDD). Mitral (M) and tricuspid (T) annular plane systolic excursion (MAPSE and TAPSE) were reduced over the whole cohort (still within normal range). After 24 months left ventricular remodeling index decreased in patients receiving chemotherapy (0.80 vs 0.70, P=.028). Neither wall motion abnormalities nor late enhancements were found. On echocardiography, in addition to EF findings that were similar to those on MRI, global strain was unchanged over the whole cohort at 24 months after a transient decrease at 6 and 12 months. Longitudinal strain decreased in the whole cohort after 24 months in some segments, whereas it increased in others.;;;;;;;;;;;;;;;;;;;;;;;;;;;;;;;;;;;;;;;;;;;;;;;;;;;;;;;;;;;;;;;;;;;;;;;;;;;;;;;;;;;;;;;;;;;;;;;;;;;;;;;;;;;;;;;;;;
"CONCLUSIONS: Until 24 months after risk-adapted modern multimodal adjuvant therapy, only subclinical cardiac changes were observed in both 3DCRT patients with inclusion of small to moderate amounts of heart volume in RT tangents and in the patients treated with IMRT and reduced high-dose heart exposure."",,,International Journal of Radiation Oncology • Biology • Physics,,,""Adult"; Aged; Aged, 80 and over; Cardiotoxicity; Chemotherapy, Adjuvant; Echocardiography; Female; Heart; Humans; Magnetic Resonance Imaging; Mastectomy; Middle Aged; Organs at Risk; Prospective Studies; Radiation Dosage; Radiotherapy Dosage; Radiotherapy, Adjuvant; Radiotherapy, Conformal; Radiotherapy, Intensity-Modulated; Stroke Volume; Unilateral Breast Neoplasms;" Ventricular Function, Left"",2015-08-03,2015,2015-08-03,2015-11,93,4,836-844,Closed,Article,""Heggemann, Felix"; Grotz, Hanna; Welzel, Grit; Dösch, Christina; Hansmann, Jan; Kraus-Tiefenbacher, Uta; Attenberger, Ulrike; Schönberg, Stephan Oswald; Borggrefe, Martin; Wenz, Frederik; Papavassiliu, Theano;" Lohr, Frank"",""Heggemann, Felix (First Medical Department, University Medical Center Mannheim, University of Heidelberg, Mannheim, Germany"; German Center for Cardiovascular Research, Mannheim, Germany); Grotz, Hanna (Department of Radiation Oncology, University Medical Center Mannheim, University of Heidelberg, Mannheim, Germany); Welzel, Grit (Department of Radiation Oncology, University Medical Center Mannheim, University of Heidelberg, Mannheim, Germany); Dösch, Christina (First Medical Department, University Medical Center Mannheim, University of Heidelberg, Mannheim, Germany; German Center for Cardiovascular Research, Mannheim, Germany); Hansmann, Jan (Institute of Diagnostic Radiology and Nuclear Medicine, University Medical Center Mannheim University of Heidelberg, Mannheim, Germany); Kraus-Tiefenbacher, Uta (Department of Radiation Oncology, University Medical Center Mannheim, University of Heidelberg, Mannheim, Germany); Attenberger, Ulrike (German Center for Cardiovascular Research, Mannheim, Germany; Institute of Diagnostic Radiology and Nuclear Medicine, University Medical Center Mannheim University of Heidelberg, Mannheim, Germany); Schönberg, Stephan Oswald (German Center for Cardiovascular Research, Mannheim, Germany; Institute of Diagnostic Radiology and Nuclear Medicine, University Medical Center Mannheim University of Heidelberg, Mannheim, Germany); Borggrefe, Martin (First Medical Department, University Medical Center Mannheim, University of Heidelberg, Mannheim, Germany; German Center for Cardiovascular Research, Mannheim, Germany); Wenz, Frederik (Department of Radiation Oncology, University Medical Center Mannheim, University of Heidelberg, Mannheim, Germany); Papavassiliu, Theano (First Medical Department, University Medical Center Mannheim, University of Heidelberg, Mannheim, Germany; German Center for Cardiovascular Research, Mannheim, Germany);" Lohr, Frank (Department of Radiation Oncology, University Medical Center Mannheim, University of Heidelberg, Mannheim, Germany)"",""Heggemann, Felix (University Medical Centre Mannheim";" German Centre for Cardiovascular Research)"",""Heggemann, Felix (University Medical Centre Mannheim"; German Centre for Cardiovascular Research); Grotz, Hanna (University Medical Centre Mannheim); Welzel, Grit (University Medical Centre Mannheim); Dösch, Christina (University Medical Centre Mannheim; German Centre for Cardiovascular Research); Hansmann, Jan (Heidelberg University); Kraus-Tiefenbacher, Uta (University Medical Centre Mannheim); Attenberger, Ulrike (German Centre for Cardiovascular Research; Heidelberg University); Schönberg, Stephan Oswald (German Centre for Cardiovascular Research; Heidelberg University); Borggrefe, Martin (University Medical Centre Mannheim; German Centre for Cardiovascular Research); Wenz, Frederik (University Medical Centre Mannheim); Papavassiliu, Theano (University Medical Centre Mannheim; German Centre for Cardiovascular Research);" Lohr, Frank (University Medical Centre Mannheim)"",37,12,1.37,8.44,,https://app.dimensions.ai/details/publication/pub.1014800790,32 Biomedical and Clinical Sciences"; 3201 Cardiovascular Medicine and Haematology; 3202 Clinical Sciences; 3211 Oncology and Carcinogenesis,;;;;;;;;;;;;;;;;;;;;;;;;;;;;;;;;;;;;;;;;;;;;;
"4880,pub.1047825539,10.1093/eurheartj/ehw022,26903532,PMC4887703,""Prevention of cardiac dysfunction during adjuvant breast cancer therapy (PRADA): a 2 × 2 factorial, randomized, placebo-controlled, double-blind clinical trial of candesartan and metoprolol"",""AIMS: Contemporary adjuvant treatment for early breast cancer is associated with improved survival but at the cost of increased risk of cardiotoxicity and cardiac dysfunction. We tested the hypothesis that concomitant therapy with the angiotensin receptor blocker candesartan or the β-blocker metoprolol will alleviate the decline in left ventricular ejection fraction (LVEF) associated with adjuvant, anthracycline-containing regimens with or without trastuzumab and radiation.";;;;;;;;;;;;;;;;;;;;;;;;;;;;;;;;;;;;;;;;;;;;;;;;;;;;;;;;;;;;;;;;;;;;;;;;;;;;;;;;;;;;;;;;;;;;;;;;;;;;;;;;;;;;;;;;;;;
METHODS AND RESULTS: In a 2 × 2 factorial, randomized, placebo-controlled, double-blind trial, we assigned 130 adult women with early breast cancer and no serious co-morbidity to the angiotensin receptor blocker candesartan cilexetil, the β-blocker metoprolol succinate, or matching placebos in parallel with adjuvant anticancer therapy. The primary outcome measure was change in LVEF by cardiac magnetic resonance imaging. A priori, a change of 5 percentage points was considered clinically important. There was no interaction between candesartan and metoprolol treatments (P = 0.530). The overall decline in LVEF was 2.6 (95% CI 1.5, 3.8) percentage points in the placebo group and 0.8 (95% CI -0.4, 1.9) in the candesartan group in the intention-to-treat analysis (P-value for between-group difference: 0.026). No effect of metoprolol on the overall decline in LVEF was observed.;;;;;;;;;;;;;;;;;;;;;;;;;;;;;;;;;;;;;;;;;;;;;;;;;;;;;;;;;;;;;;;;;;;;;;;;;;;;;;;;;;;;;;;;;;;;;;;;;;;;;;;;;;;;;;;;;;;
