CONCLUSION: Temporal changes in 3D-LVEF, 2D-GLS and CMR LVEF in patients with CTRCD had the least overlap with the variability in healthy volunteers;" however, 2D-GLS appears to be the most suitable for clinical application in individual patients."",,This study was funded by an operating grant from the Canadian Institutes of Health Research (137132 and 142456). Dr Thavendiranathan (147814) is supported by the Canadian Institutes of Health Research New Investigator Award.,Heart,,,""Antibiotics, Antineoplastic"; Breast Neoplasms; Cardiotoxicity; Echocardiography; Echocardiography, Three-Dimensional; Female; Follow-Up Studies; Heart Ventricles; Humans; Magnetic Resonance Imaging, Cine; Middle Aged; Prospective Studies; Stroke Volume; Ventricular Dysfunction, Left;" Ventricular Function, Left"",2020-02-25,2020,2020-02-25,2020-06,106,11,heartjnl-2019-316297,Closed,Article,""Lambert, James"; Lamacie, Mariana; Thampinathan, Babitha; Altaha, Mustafa A; Esmaeilzadeh, Maryam; Nolan, Mark; Fresno, Camila Urzua; Somerset, Emily; Amir, Eitan; Marwick, Thomas H; Wintersperger, Bernd J;" Thavendiranathan, Paaladinesh"",""Lambert, James (Ted Rogers Program in Cardiotoxicity Prevention, Peter Munk Cardiac Center, Division of Cardiology, University Health Network, University of Toronto, Toronto, Ontario, Canada)"; Lamacie, Mariana (Ted Rogers Program in Cardiotoxicity Prevention, Peter Munk Cardiac Center, Division of Cardiology, University Health Network, University of Toronto, Toronto, Ontario, Canada); Thampinathan, Babitha (Ted Rogers Program in Cardiotoxicity Prevention, Peter Munk Cardiac Center, Division of Cardiology, University Health Network, University of Toronto, Toronto, Ontario, Canada); Altaha, Mustafa A (Ted Rogers Program in Cardiotoxicity Prevention, Peter Munk Cardiac Center, Division of Cardiology, University Health Network, University of Toronto, Toronto, Ontario, Canada); Esmaeilzadeh, Maryam (Ted Rogers Program in Cardiotoxicity Prevention, Peter Munk Cardiac Center, Division of Cardiology, University Health Network, University of Toronto, Toronto, Ontario, Canada); Nolan, Mark (Ted Rogers Program in Cardiotoxicity Prevention, Peter Munk Cardiac Center, Division of Cardiology, University Health Network, University of Toronto, Toronto, Ontario, Canada); Fresno, Camila Urzua (Ted Rogers Program in Cardiotoxicity Prevention, Peter Munk Cardiac Center, Division of Cardiology, University Health Network, University of Toronto, Toronto, Ontario, Canada); Somerset, Emily (Rogers Computational Program, Peter Munk Cardiac Center, Cardiology, University Health Network, University of Toronto, Toronto, Ontario, Canada); Amir, Eitan (Division of Medical Oncology, Princess Margaret Cancer Centre, University of Toronto, Toronto, Ontario, Canada); Marwick, Thomas H (Baker Heart Research Institute – BHRI, Melbourne, Victoria, Australia); Wintersperger, Bernd J (Department of Medical Imaging, Toronto General Hospital, University of Toronto, Toronto, Ontario, Canada); Thavendiranathan, Paaladinesh (Ted Rogers Program in Cardiotoxicity Prevention, Peter Munk Cardiac Center, Division of Cardiology, University Health Network, University of Toronto, Toronto, Ontario, Canada;" Department of Medical Imaging, Toronto General Hospital, University of Toronto, Toronto, Ontario, Canada)"",""Thavendiranathan, Paaladinesh (University Health Network"; University of Toronto;" University of Toronto)"",""Lambert, James (University Health Network"; University of Toronto); Lamacie, Mariana (University Health Network; University of Toronto); Thampinathan, Babitha (University Health Network; University of Toronto); Altaha, Mustafa A (University Health Network; University of Toronto); Esmaeilzadeh, Maryam (University Health Network; University of Toronto); Nolan, Mark (University Health Network; University of Toronto); Fresno, Camila Urzua (University Health Network; University of Toronto); Somerset, Emily (University Health Network; University of Toronto); Amir, Eitan (University of Toronto); Marwick, Thomas H (Baker IDI Heart and Diabetes Institute); Wintersperger, Bernd J (University of Toronto); Thavendiranathan, Paaladinesh (University Health Network; University of Toronto;" University of Toronto)"",50,30,3.01,17.34,,https://app.dimensions.ai/details/publication/pub.1125115785,32 Biomedical and Clinical Sciences"; 3202 Clinical Sciences; 3211 Oncology and Carcinogenesis,;;;;;;;;;;;;;;;;;;;;;;;;;;;;;;;;;;;;;;;;;;;;;;;;;;;;
"3511,pub.1124213386,10.1161/jaha.119.015400,31959033,PMC7033821,Simultaneous Left Ventricular Volume and Strain Changes During Chemotherapy Associate With 2‐Year Postchemotherapy Measures of Left Ventricular Ejection Fraction,""Background Although changes in left ventricular end-systolic volume (LVESV), left ventricular end-diastolic volume, and global circumferential strain occur during cancer treatment, the relationship of these changes to the 2-year post-cancer-treatment measures of left ventricular ejection fraction (LVEF) are unknown. Methods and Results In a prospective, continuously recruited cohort of 95 patients scheduled to receive potentially cardiotoxic chemotherapy for breast cancer, lymphoma, or soft tissue sarcoma, measures of left ventricular end-diastolic volume, LVESV, global circumferential strain, and LVEF were acquired via cardiac magnetic resonance imaging before and then 3 and 24 months after initiating treatment by individuals blinded to all patient identifiers. Participants had an average age of 54±15 years";" 68% were women, and 82% were of white race. LVEF declined from 62±7% to 58±9% over the 24 months (P<0.0001), with 42% of participants experiencing a >5% decline in LVEF at 24 months. Predictors of a 24-month >5% decline in LVEF included the following factors from baseline to 3 months into treatment: (1) >3-mL increases in LVESV (P=0.033), (2) >3-mL increases in LVESV or 10-mL declines in left ventricular end-diastolic volume with little change in LVESV (P=0.001), or (3) ≥10% deteriorations in global circumferential strain with little change in LVESV (P=0.036). Conclusion During receipt of potentially cardiotoxic chemotherapy, increases in LVESV, the absence of its deterioration during decreases of left ventricular end-diastolic volume, or the deterioration of global circumferential strain without a marked decrease in LVESV help identify those who will develop more permanent 2-year declines in LVEF."",,,Journal of the American Heart Association,,,""Adult"; Aged; Antineoplastic Agents; Cardiotoxicity; Female; Heart Disease Risk Factors; Humans; Male; Middle Aged; Neoplasms; Prospective Studies; Stroke Volume; Time Factors; Ventricular Dysfunction, Left;" Ventricular Function, Left"",2020-01-21,2020,2020-01-21,2020-01-21,9,2,e015400,All OA";" Gold,Article,""Suerken, Cynthia K."; D'Agostino, Ralph B.; Jordan, Jennifer H.; Meléndez, Giselle C.; Vasu, Sujethra; Lamar, Zanetta S.;" Hundley, W. Gregory"",""Suerken, Cynthia K. (Department of Biostatistics and Data Science, Wake Forest School of Medicine, Winston‐Salem, NC)"; D'Agostino, Ralph B. (Department of Biostatistics and Data Science, Wake Forest School of Medicine, Winston‐Salem, NC); Jordan, Jennifer H. (Department of Biomedical Engineering, Virginia Commonwealth University, Richmond, VA; Pauley Heart Center, Department of Internal Medicine at Virginia Commonwealth University Health Sciences, Richmond, VA); Meléndez, Giselle C. (Section on Cardiovascular Medicine and Pathology, Section on Comparative Medicine, Department of Internal Medicine, Wake Forest School of Medicine, Winston‐Salem, NC); Vasu, Sujethra (Section on Cardiovascular Medicine and Pathology, Section on Comparative Medicine, Department of Internal Medicine, Wake Forest School of Medicine, Winston‐Salem, NC); Lamar, Zanetta S. (Department of Hematology/Oncology, Wake Forest Baptist Medical Center, Winston‐Salem, NC); Hundley, W. Gregory (Section on Cardiovascular Medicine and Pathology, Section on Comparative Medicine, Department of Internal Medicine, Wake Forest School of Medicine, Winston‐Salem, NC;" Pauley Heart Center, Department of Internal Medicine at Virginia Commonwealth University Health Sciences, Richmond, VA)"",""Hundley, W. Gregory (Wake Forest University";" Virginia Commonwealth University)"",""Suerken, Cynthia K. (Wake Forest University)"; D'Agostino, Ralph B. (Wake Forest University); Jordan, Jennifer H. (Virginia Commonwealth University; Virginia Commonwealth University); Meléndez, Giselle C. (Wake Forest University); Vasu, Sujethra (Wake Forest University); Lamar, Zanetta S. (Wake Forest Baptist Medical Center); Hundley, W. Gregory (Wake Forest University;" Virginia Commonwealth University)"",20,14,1.85,6.93,https://www.ahajournals.org/doi/pdf/10.1161/JAHA.119.015400,https://app.dimensions.ai/details/publication/pub.1124213386,32 Biomedical and Clinical Sciences"; 3202 Clinical Sciences; 3211 Oncology and Carcinogenesis,;;;;;;;;;;;;;;;;;;;;;;;;;;;;;;;;;;;;;;;;;;;;;;;;;;;;;;;;;;;;;;;;;;;;;;;;;;
"3317,pub.1123501944,10.1016/j.jcmg.2019.10.016,31864977,,Can Quantitative CMR Tissue Characterization Adequately Identify Cardiotoxicity During Chemotherapy? Impact of Temporal and Observer Variability,""OBJECTIVES: The purpose of this study was to investigate the effect of the temporal and observer variability of cardiac magnetic resonance (CMR)-measured native T1, T2, and extracellular volume fraction (ECV) and serum biomarkers for the detection of cancer-therapeutics-related cardiac dysfunction (CTRCD).";;;;;;;;;;;;;;;;;;;;;;;;;;;;;;;;;;;;;;;;;;;;;;;;;;;;;;;;;;;;;;;;;;;;;;;;;;;;;;;;;;;;;;;;;;;;;;;;;;;;;;;;;;;;;;;;;;;
BACKGROUND: Biomarkers and serial quantitative CMR tissue characterization may help identify early myocardial changes of CTRCD, but these parameters require both accuracy and reliability.;;;;;;;;;;;;;;;;;;;;;;;;;;;;;;;;;;;;;;;;;;;;;;;;;;;;;;;;;;;;;;;;;;;;;;;;;;;;;;;;;;;;;;;;;;;;;;;;;;;;;;;;;;;;;;;;;;;
METHODS: A total of 50 participants (age 48.9 ± 12.1 years) underwent 3 CMR studies (1.5-T) and biomarker measurements (high-sensitivity troponin-I and B-type natriuretic peptide) at 3-month intervals: 20 with HER2-positive breast cancer (10 with and 10 without CTRCD), and 30 prospectively recruited healthy participants. T1 and T2 maps were obtained at 3 left ventricular short-axis locations. Temporal and observer variability were calculated as the coefficient of variation and as the standard error of the measurement (SEM) using repeated measures and 2-way analysis of variance. Minimal detected difference was defined as 2 × SEM.;;;;;;;;;;;;;;;;;;;;;;;;;;;;;;;;;;;;;;;;;;;;;;;;;;;;;;;;;;;;;;;;;;;;;;;;;;;;;;;;;;;;;;;;;;;;;;;;;;;;;;;;;;;;;;;;;;;
RESULTS: Compared with the patients without CTRCD, those with CTRCD had larger temporal change in native T1 (27.2 ms [95% confidence interval (CI): 20.8 to 39.3 ms] vs. 12.4 ms [95% CI: 9.5 to 17.9 ms]), T2 (2.0 ms [95% CI: 1.5 to 2.9 ms] vs. 1.0 ms [95% CI: 0.74 to 1.4 ms]), and ECV (2.1% [95% CI: 1.5% to 3.1%] vs. 1.0% [95% CI: 0.8% to 1.5%]). However, the temporal changes in biomarkers overlapped. The minimal detected difference for T1 (29 ms), T2 (3.0 ms), and ECV (2.2%) in healthy participants approached the mean temporal changes in patients with CTRCD. For individual patients with CTRCD, there was overlap in the temporal changes of all 3 parameters, and the variability in healthy participants with the least overlap for native T1. The interobserver/intraobserver variabilities for the CMR parameters were low (coefficient of variation 0.5% to 4.3%).;;;;;;;;;;;;;;;;;;;;;;;;;;;;;;;;;;;;;;;;;;;;;;;;;;;;;;;;;;;;;;;;;;;;;;;;;;;;;;;;;;;;;;;;;;;;;;;;;;;;;;;;;;;;;;;;;;;
"CONCLUSIONS: The temporal changes in both biomarkers and tissue characterization measures in individual patients overlap with the temporal variability in healthy participants and approach the minimal detectable temporal differences. While the accuracy of the parameters awaits further study, the temporal variability of these methods may pose challenges to routine clinical application in individual patients receiving cancer therapy."",""The authors would like to thank Ms. Yobiga Thevakumaran and Alexandria Flannery for their support in recruiting volunteers and patients for this study, and Mr. Neil Spiller and Ms. Rosanna Chan for performing all the CMR scans. They also thank senior biostatistician Steve Fan, PhD, and Dr. Z. Popovic for their support with the statistical analysis plan."",,JACC Cardiovascular Imaging,,,""Adult"; Anthracyclines; Antineoplastic Agents; Biomarkers; Breast Neoplasms; Cardiotoxicity; Case-Control Studies; Female; Heart Diseases; Humans; Magnetic Resonance Imaging, Cine; Male; Middle Aged; Natriuretic Peptide, Brain; Observer Variation; Predictive Value of Tests; Prospective Studies; Reproducibility of Results; Time Factors; Trastuzumab;" Troponin I"",2019-12-18,2019,2019-12-18,2020-04,13,4,951-962,All OA";" Hybrid,Article,""Altaha, Mustafa A"; Nolan, Mark; Marwick, Thomas H; Somerset, Emily; Houbois, Christian; Amir, Eitan; Yip, Paul; Connelly, Kim A; Michalowska, Maria; Sussman, Marshall S; Wintersperger, Bernd J;" Thavendiranathan, Paaladinesh"",""Altaha, Mustafa A (Division of Cardiology, Peter Munk Cardiac Centre, Ted Rogers Program in Cardiotoxicity Prevention and Department of Medical Imaging, University Health Network, Toronto, Ontario, Canada.)"; Nolan, Mark (Division of Cardiology, Peter Munk Cardiac Centre, Ted Rogers Program in Cardiotoxicity Prevention and Department of Medical Imaging, University Health Network, Toronto, Ontario, Canada.); Marwick, Thomas H (Baker Heart & Diabetes Institute, Melbourne, Australia.); Somerset, Emily (Rogers Computational Program, Ted Rogers Centre for Heart Research, Peter Munk Cardiac Centre, University Health Network, Toronto, Ontario, Canada.); Houbois, Christian (Department of Medical Imaging, University Health Network, University of Toronto, Toronto, Ontario, Canada.); Amir, Eitan (Division of Medical Oncology, Princess Margaret Cancer Center, University Health Network, University of Toronto, Toronto, Ontario, Canada.); Yip, Paul (Division Laboratory Medicine and Pathobiology, University Health Network, University of Toronto, Toronto, Ontario, Canada.); Connelly, Kim A (Keenan Research Centre, Li Ka Shing Knowledge Institute, St. Michael's Hospital, Toronto, Ontario, Canada.); Michalowska, Maria (Division of Cardiology, Peter Munk Cardiac Centre, Ted Rogers Program in Cardiotoxicity Prevention and Department of Medical Imaging, University Health Network, Toronto, Ontario, Canada.); Sussman, Marshall S (Department of Medical Imaging, University Health Network, University of Toronto, Toronto, Ontario, Canada.); Wintersperger, Bernd J (Department of Medical Imaging, University Health Network, University of Toronto, Toronto, Ontario, Canada.); Thavendiranathan, Paaladinesh (Division of Cardiology, Peter Munk Cardiac Centre, Ted Rogers Program in Cardiotoxicity Prevention and Department of Medical Imaging, University Health Network, Toronto, Ontario, Canada;" Department of Medical Imaging, University Health Network, University of Toronto, Toronto, Ontario, Canada. Electronic address: dinesh.thavendiranathan@uhn.ca.)"",""Thavendiranathan, Paaladinesh (University Health Network";" University of Toronto)"",""Altaha, Mustafa A (University Health Network)"; Nolan, Mark (University Health Network); Marwick, Thomas H (Baker IDI Heart and Diabetes Institute); Somerset, Emily (Ted Rogers Centre for Heart Research); Houbois, Christian (University Health Network; University of Toronto); Amir, Eitan (University Health Network; University of Toronto); Yip, Paul (University Health Network; University of Toronto); Connelly, Kim A (St. Michael's Hospital); Michalowska, Maria (University Health Network); Sussman, Marshall S (University Health Network; University of Toronto); Wintersperger, Bernd J (University Health Network; University of Toronto); Thavendiranathan, Paaladinesh (University Health Network;" University of Toronto)"",37,19,3.03,9.73,https://doi.org/10.1016/j.jcmg.2019.10.016,https://app.dimensions.ai/details/publication/pub.1123501944,32 Biomedical and Clinical Sciences"; 3211 Oncology and Carcinogenesis,;;;;;;;;;;;;;;;;;;;;;;;;;;;;;;;;;;;;;;;;;;;;;;;;;;;;
"3317,pub.1090955407,10.1186/s12968-017-0373-3,28768517,PMC5541737,Automated assessments of circumferential strain from cine CMR correlate with LVEF declines in cancer patients early after receipt of cardio-toxic chemotherapy,""BackgroundIn patients with cancer receiving potentially cardio-toxic chemotherapy, measurements of left ventricular (LV) circumferential or longitudinal strain are often used clinically to identify myocardial dysfunction. Using a new software algorithm, we sought to determine in individuals receiving treatment for cancer the association between automated assessments of LV mean mid-wall circumferential strain and conventional measures of LV ejection fraction (EF) both obtained from cardiovascular magnetic resonance (CMR) cine balanced steady-state free-precession (bSSFP) white-blood acquisitions.MethodsBefore and 3 months after initiating treatment with potentially cardio-toxic chemotherapy, 72 individuals (aged 54 ± 14 years with breast cancer [39%], lymphoma [49%], or sarcoma [12%]) underwent serial CMR cine bSSFP assessments of LV volumes and EF, and mean mid-wall circumferential strain determined from these same cine images as well as from additional tagged CMR images. On the cine images, assessments of strain were obtained using the newly developed deformation-based segmentation algorithm. Assessments of LV volumes/EF from the cine images and strain from tagged CMR were accomplished using commercially available software. All measures were analyzed in a blinded fashion independent of one another.ResultsAcceptable measures for the automated assessments of mean mid-wall circumferential strain from the cine images were obtained in 142 of 144 visits (98.6%) with an overall analysis time averaging 6:47 ± 1:06 min. The results from these automated measures averaged −18.8 ± 2.9 at baseline and −17.6 ± 3.1 at 3 months (p = 0.001). Left ventricular EF declined slightly from 65 ± 7% at baseline to 62 ± 7% at 3 months (p = 0.0002). The correlation between strain from cine imaging and LVEF was r = −0.61 (p < 0.0001). In addition, the 3-month changes in LV strain and LVEF were correlated (r = −0.49"; p < 0.0001). The correlation between cine and tagged derived assessments of strain was r = 0.23;" p = 0.01.ConclusionsAutomated measures of LV mean mid-wall circumferential strain can be obtained in 6¾ minutes from cine bSSFP LV short-axis images (used concurrently to assess LV volumes and EF) in 98.6% of patients receiving treatment for cancer with potentially cardio-toxic chemotherapy. These cine derived measures of circumferential strain correlate with early subclinical declines in LVEF."",""We would like to thank Kimberly Lane for manually analyzing the cine images with the QMass software to generate the ejection fraction and manually analyzing the tagged images with the HARP software to generate the strain measures. The Trufi Strain prototype is based on research and is not commercially available. Due to regulatory reasons, its future availability cannot be guaranteed."",This work is supported by a grant from the National Institutes of Health (NIH R01CA167821–01).,Journal of Cardiovascular Magnetic Resonance,,,""Adult"; Aged; Algorithms; Antineoplastic Agents; Automation; Biomechanical Phenomena; Cardiotoxicity; Feasibility Studies; Female; Humans; Image Interpretation, Computer-Assisted; Magnetic Resonance Imaging, Cine; Male; Middle Aged; Neoplasms; Predictive Value of Tests; Prospective Studies; Stress, Mechanical; Stroke Volume; Time Factors; Ventricular Dysfunction, Left;" Ventricular Function, Left"",2017-08-02,2017,2017-08-02,2017-12,19,1,59,All OA";" Gold,Article,""Jolly, Marie-Pierre"; Jordan, Jennifer H.; Meléndez, Giselle C.; McNeal, Gary R.; D’Agostino, Ralph B.;" Hundley, W. Gregory"",""Jolly, Marie-Pierre (Medical Imaging Technologies, Siemens Healthineers, 755 College Road East, 08540-6632, Princeton, NJ, USA)"; Jordan, Jennifer H. (Department of Internal Medicine, Section on Cardiovascular Medicine, Wake Forest University School of Medicine, Medical Center Blvd, 27157, Winston-Salem, NC, USA); Meléndez, Giselle C. (Department of Internal Medicine, Section on Cardiovascular Medicine, Wake Forest University School of Medicine, Medical Center Blvd, 27157, Winston-Salem, NC, USA; Department of Pathology, Section on Comparative Medicine, Wake Forest University School of Medicine, Winston-Salem, NC, USA); McNeal, Gary R. (Cardiovascular MR R&D, Siemens Healthineers, Chicago, IL, USA); D’Agostino, Ralph B. (Biostatistical Sciences, Wake Forest School of Medicine, Winston-Salem, NC, USA);" Hundley, W. Gregory (Department of Internal Medicine, Section on Cardiovascular Medicine, Wake Forest University School of Medicine, Medical Center Blvd, 27157, Winston-Salem, NC, USA)"",""Hundley, W. Gregory (Wake Forest University";" Wake Forest Baptist Medical Center)"",""Jolly, Marie-Pierre (Siemens Healthineers (United States))"; Jordan, Jennifer H. (Wake Forest University; Wake Forest Baptist Medical Center); Meléndez, Giselle C. (Wake Forest University; Wake Forest Baptist Medical Center; Wake Forest University); McNeal, Gary R. (Siemens Healthineers (United States)); D’Agostino, Ralph B. (Wake Forest University); Hundley, W. Gregory (Wake Forest University;" Wake Forest Baptist Medical Center)"",64,22,2.52,12.46,https://jcmr-online.biomedcentral.com/track/pdf/10.1186/s12968-017-0373-3,https://app.dimensions.ai/details/publication/pub.1090955407,32 Biomedical and Clinical Sciences"; 3211 Oncology and Carcinogenesis,;;;;;;;;;;;;;;;;;;;;;;;;;;;;;;;;;;;;;;;;;;;;;;;;;;;;;;;;;;;;;;;;;;;;;
"3306,pub.1002267390,10.1161/circimaging.114.002217,25273568,PMC4241241,Longitudinal Assessment of Concurrent Changes in Left Ventricular Ejection Fraction and Left Ventricular Myocardial Tissue Characteristics After Administration of Cardiotoxic Chemotherapies Using T1-Weighted and T2-Weighted Cardiovascular Magnetic Resonance,""BACKGROUND: In a murine anthracycline-related cardiotoxicity model, increases in cardiovascular magnetic resonance myocardial contrast-enhanced T1-weighted signal intensity are associated with myocellular injury and decreases with left ventricular ejection fraction. We sought to determine whether T1- and T2-weighted measures of signal intensity associate with decreases in left ventricular ejection fraction in human subjects receiving potentially cardiotoxic chemotherapy.";;;;;;;;;;;;;;;;;;;;;;;;;;;;;;;;;;;;;;;;;;;;;;;;;;;;;;;;;;;;;;;;;;;;;;;;;;;;;;;;;;;;;;;;;;;;;;;;;;;;;;;;;;;;;;;;;;;
METHODS AND RESULTS: In 65 individuals with breast cancer (n=51) or a hematologic malignancy (n=14), we measured left ventricular volumes, ejection fraction, and contrast-enhanced T1-weighted and T2-weighted signal intensity before and 3 months after initiating potentially cardiotoxic chemotherapy using blinded, unpaired analysis of cardiovascular magnetic resonance images. Participants were aged 51 ± 12 years, of whom 55% received an anthracycline, 38% received a monoclonal antibody, and 6% received an antimicrotubule agent. Overall, left ventricular ejection fraction decreased from 57 ± 6% to 54 ± 7% (P<0.001) because of an increase in end-systolic volume (P<0.05). T1-weighted signal intensities also increased from 14.1 ± 5.1 to 15.9 ± 6.8 (P<0.05), with baseline values trending higher among individuals who received chemotherapy before study enrollment (P=0.06). Changes in T1-weighted signal intensity did not differ within the 17 LV myocardial segments (P=0.97). Myocardial edema quantified from T2-weighted images did not change significantly after 3 months (P=0.70).;;;;;;;;;;;;;;;;;;;;;;;;;;;;;;;;;;;;;;;;;;;;;;;;;;;;;;;;;;;;;;;;;;;;;;;;;;;;;;;;;;;;;;;;;;;;;;;;;;;;;;;;;;;;;;;;;;;
