position,title,link,displayed_link,snippet,snippet_highlighted_words,about_page_link,about_page_serpapi_link,cached_page_link,source,about_this_result.source.description,about_this_result.source.source_info_link,about_this_result.source.security,about_this_result.source.icon,date
6,"Sambut Pemilu 2024, Berbagai Aspek Perlu Diperhatikan",https://polkam.go.id/sambut-pemilu-2024-berbagai-aspek-perlu-diperhatikan/,https://polkam.go.id › sambut-pemil...,"Hal ini sesuai dengan amanat pada Pasal 434 UU Nomor 7 Tahun 2017 tentang Pemilihan Umum, yang menjelaskan bahwa pemerintah wajib memberikan ...",['Pemilihan Umum'],https://www.google.com/search?q=About+https://polkam.go.id/sambut-pemilu-2024-berbagai-aspek-perlu-diperhatikan/&tbm=ilp&ilps=ADJL0ixjYkcX7G366V0rkcyCAkoBeLa1Jw,https://serpapi.com/search.json?engine=google_about_this_result&google_domain=google.com&ilps=ADJL0ixjYkcX7G366V0rkcyCAkoBeLa1Jw&q=About+https%3A%2F%2Fpolkam.go.id%2Fsambut-pemilu-2024-berbagai-aspek-perlu-diperhatikan%2F,https://webcache.googleusercontent.com/search?q=cache:OfoUXhQctJ8J:https://polkam.go.id/sambut-pemilu-2024-berbagai-aspek-perlu-diperhatikan/&cd=15&hl=en&ct=clnk&gl=us,polkam.go.id,"The Coordinating Ministry for Political, Legal, and Security Affairs is the Indonesian government ministry in charge of the planning and policy co-ordination, as well as synchronisation of policies in the affairs of politics, law, and national security.",https://polkam.go.id/sambut-pemilu-2024-berbagai-aspek-perlu-diperhatikan/,secure,https://serpapi.com/searches/64586b2a2c6878dd58daee8c/images/ab05018f01a055f60cb29e1a001bdd82600e053a31c6a25d2a41fb1f38becc9d6468726518ea7df937214d21c157af85.png,"Feb 9, 2023"
7,TAHAPAN JADWAL PEMILIHAN UMUM 2024,https://kesbangpol.jembranakab.go.id/berita-view/37,https://kesbangpol.jembranakab.go.id › ...,Dengan terbitnya peraturan Komisi Pemilihan Umum ini maka jelas sudah keputusan pemerintah tidak akan melakukan penundaan pelaksanaan Pemilu ...,"['Pemilihan Umum', 'Pemilu']",https://www.google.com/search?q=About+https://kesbangpol.jembranakab.go.id/berita-view/37&tbm=ilp&ilps=ADJL0iwUA_1MeIiezn6I_viuw9W4h_-wFw,https://serpapi.com/search.json?engine=google_about_this_result&google_domain=google.com&ilps=ADJL0iwUA_1MeIiezn6I_viuw9W4h_-wFw&q=About+https%3A%2F%2Fkesbangpol.jembranakab.go.id%2Fberita-view%2F37,https://webcache.googleusercontent.com/search?q=cache:-bmYPBWhk3EJ:https://kesbangpol.jembranakab.go.id/berita-view/37&cd=16&hl=en&ct=clnk&gl=us,jembranakab.go.id,"Jembrana Regency is a regency in the southwest of Bali, Indonesia. It has an area of 841.8 km² and had a population of 261,638 at the 2010 Census and 317,064 at the 2020 Census. Its regency seat is Negara.",https://kesbangpol.jembranakab.go.id/berita-view/37,secure,https://serpapi.com/searches/64586b2a2c6878dd58daee8c/images/ab05018f01a055f60cb29e1a001bdd820998e771144ad4d46531dc08e360580d567e8ffce2fe84f95dba1511041432e9.png,"Sep 17, 2022"
8,"Kamu Perlu Tahu, Inilah Alur Tahapan Pemilu Tahun 2024",https://putatgede.kendalkab.go.id/kabardetail/U045M0R1VTVLckJxWGt6cTNCVWpRdz09/kamu-perlu-tahu--inilah-alur-tahapan-pemilu-tahun-2024.html,https://putatgede.kendalkab.go.id › ...,Penyusunan peraturan KPU dari 14 Juni 2022 s.d. 14 Desember 2023. Pemutakhiran data pemilih dan penyusunan daftar pemilih dari 14 Oktober 2022 s.d. 21 Juni 2023 ...,"['pemilih', 'pemilih']",https://www.google.com/search?q=About+https://putatgede.kendalkab.go.id/kabardetail/U045M0R1VTVLckJxWGt6cTNCVWpRdz09/kamu-perlu-tahu--inilah-alur-tahapan-pemilu-tahun-2024.html&tbm=ilp&ilps=ADJL0iwqDmvRwR8NcLG6gkGqMwhdC48t_w,https://serpapi.com/search.json?engine=google_about_this_result&google_domain=google.com&ilps=ADJL0iwqDmvRwR8NcLG6gkGqMwhdC48t_w&q=About+https%3A%2F%2Fputatgede.kendalkab.go.id%2Fkabardetail%2FU045M0R1VTVLckJxWGt6cTNCVWpRdz09%2Fkamu-perlu-tahu--inilah-alur-tahapan-pemilu-tahun-2024.html,https://webcache.googleusercontent.com/search?q=cache:jg1tOBw2v3EJ:https://putatgede.kendalkab.go.id/kabardetail/U045M0R1VTVLckJxWGt6cTNCVWpRdz09/kamu-perlu-tahu--inilah-alur-tahapan-pemilu-tahun-2024.html&cd=17&hl=en&ct=clnk&gl=us,kendalkab.go.id,"Kendal is a regency in the northern part of Central Java province in Indonesia, west of Semarang. Its capital is Kendal. The regency is bordered by the Java Sea in the north, Semarang City and Semarang Regency in the east, Temanggung Regency in the south, and Batang Regency in the west.",https://putatgede.kendalkab.go.id/kabardetail/U045M0R1VTVLckJxWGt6cTNCVWpRdz09/kamu-perlu-tahu--inilah-alur-tahapan-pemilu-tahun-2024.html,secure,https://serpapi.com/searches/64586b2a2c6878dd58daee8c/images/ab05018f01a055f60cb29e1a001bdd82af60a08cb7fb17511554ea9d398524fc310468afab07806497d8c37a3fc29c69.png,
9,Berita dan Informasi Pemilu 2024 Terkini dan Terbaru Hari ini,https://www.detik.com/tag/pemilu-2024,https://www.detik.com › tag › pemil...,Suhu politik di Kabupaten Subang mulai menghangat menjelang Pilkada serentak 2024 mendatang. Parpol di Subang mulai siapkan jurus demi merebut kursi Bupati.,['2024'],https://www.google.com/search?q=About+https://www.detik.com/tag/pemilu-2024&tbm=ilp&ilps=ADJL0izsO37r2Lgph62YnJuvjvUqYTS4SQ,https://serpapi.com/search.json?engine=google_about_this_result&google_domain=google.com&ilps=ADJL0izsO37r2Lgph62YnJuvjvUqYTS4SQ&q=About+https%3A%2F%2Fwww.detik.com%2Ftag%2Fpemilu-2024,https://webcache.googleusercontent.com/search?q=cache:aSEw_k5NrPkJ:https://www.detik.com/tag/pemilu-2024&cd=18&hl=en&ct=clnk&gl=us,detik.com,Detikcom is an Indonesian digital media company owned by CT Corp subsidiary Trans Media. Detikcom is an online news portal and publishes breaking news. The portal is consistently ranked among Indonesia's 10 most-visited websites and is among the top 250 in the world.,https://www.detik.com/tag/pemilu-2024,secure,https://serpapi.com/searches/64586b2a2c6878dd58daee8c/images/ab05018f01a055f60cb29e1a001bdd82d3c667901071627afd651a230e21a02f75056186d00b76152f41a13e160f29ad.png,
10,Peraturan KPU No. 3 Tahun 2022 tentang Tahapan dan ...,https://peraturan.bpk.go.id/Home/Details/216617/peraturan-kpu-no-3-tahun-2022,https://peraturan.bpk.go.id › Details,Peraturan Komisi Pemilihan Umum Nomor 3 Tahun 2022. Tahapan dan Jadwal Penyelenggaraan Pemilihan Umum Tahun 2024. Detail Peraturan. Abstrak.,"['Pemilihan Umum', 'Pemilihan Umum', '2024']",https://www.google.com/search?q=About+https://peraturan.bpk.go.id/Home/Details/216617/peraturan-kpu-no-3-tahun-2022&tbm=ilp&ilps=ADJL0izVgzxnUgib4znf22q43awzv7CUuw,https://serpapi.com/search.json?engine=google_about_this_result&google_domain=google.com&ilps=ADJL0izVgzxnUgib4znf22q43awzv7CUuw&q=About+https%3A%2F%2Fperaturan.bpk.go.id%2FHome%2FDetails%2F216617%2Fperaturan-kpu-no-3-tahun-2022,https://webcache.googleusercontent.com/search?q=cache:9cPwiOtDc_4J:https://peraturan.bpk.go.id/Home/Details/216617/peraturan-kpu-no-3-tahun-2022&cd=19&hl=en&ct=clnk&gl=us,bpk.go.id,"The Audit Board of Indonesia is a high state body in Indonesia which is responsible for evaluation of management and accountability of state finances conducted by the central government, local governments, ...",https://peraturan.bpk.go.id/Home/Details/216617/peraturan-kpu-no-3-tahun-2022,secure,https://serpapi.com/searches/64586b2a2c6878dd58daee8c/images/ab05018f01a055f60cb29e1a001bdd828cb95a521e0d714df1b8c5ab28c87431ca2fd0a62a3f30f5d1d103c9d16a6f38.png,
1,"2024 ganti presiden, pakar ungkap strategi Jokowi untuk ...",https://theconversation.com/2024-ganti-presiden-pakar-ungkap-strategi-jokowi-untuk-tetap-mengamankan-ikn-187803,https://theconversation.com › 2024-...,"Rentetan peristiwa politik yang terjadi, tanpa disadari masyarakat, bisa jadi adalah strategi Jokowi untuk memastikan penggantinya akan ...",['Jokowi'],https://www.google.com/search?q=About+https://theconversation.com/2024-ganti-presiden-pakar-ungkap-strategi-jokowi-untuk-tetap-mengamankan-ikn-187803&tbm=ilp&ilps=ADJL0iy8PHrkXWEA5D4z_RjxIsS9cmy8bA,https://serpapi.com/search.json?engine=google_about_this_result&google_domain=google.com&ilps=ADJL0iy8PHrkXWEA5D4z_RjxIsS9cmy8bA&q=About+https%3A%2F%2Ftheconversation.com%2F2024-ganti-presiden-pakar-ungkap-strategi-jokowi-untuk-tetap-mengamankan-ikn-187803,https://webcache.googleusercontent.com/search?q=cache:b6lbxoMq25QJ:https://theconversation.com/2024-ganti-presiden-pakar-ungkap-strategi-jokowi-untuk-tetap-mengamankan-ikn-187803&cd=3&hl=en&ct=clnk&gl=us,The Conversation,"The Conversation is a network of not-for-profit media outlets publishing news stories and research reports online, with accompanying expert opinion and analysis. Articles are written by academics and researchers under a Creative Commons license, allowing reuse without modification.",https://theconversation.com/2024-ganti-presiden-pakar-ungkap-strategi-jokowi-untuk-tetap-mengamankan-ikn-187803,secure,https://serpapi.com/searches/64586b2d96f5d7b407955f08/images/1e37f6aeb26b05fc99bba2a1af11d20ccbac1f8dcc8d6621157fec64270f7eb2f33f7e05c91c16e02ae65846d6fca741.png,"Oct 9, 2022"
2,2024 Ganti Presiden#Fyp,https://www.youtube.com/watch?v=Kw8Gcn8EzBE,https://www.youtube.com › watch,Your browser can't play this video. Learn more. Switch camera.,,https://www.google.com/search?q=About+https://www.youtube.com/watch?v%3DKw8Gcn8EzBE&tbm=ilp&ilps=ADJL0ixskYT5dqeLn_Ec2Yd_C6Fbfo98Bg,https://serpapi.com/search.json?engine=google_about_this_result&google_domain=google.com&ilps=ADJL0ixskYT5dqeLn_Ec2Yd_C6Fbfo98Bg&q=About+https%3A%2F%2Fwww.youtube.com%2Fwatch%3Fv%3DKw8Gcn8EzBE,,YouTube,This result comes from www.youtube.com,https://www.youtube.com/watch?v=Kw8Gcn8EzBE,secure,https://serpapi.com/searches/64586b2d96f5d7b407955f08/images/1e37f6aeb26b05fc99bba2a1af11d20c801a4105e2b5270eaaaf7b6aa7078fae893a42f83d72eb470c05bc3b98713dfa.png,8 days ago
3,pak jokowi 2024 ganti presiden,https://www.capcut.com/kep/7665564931,https://www.capcut.com › kep,"capcut provide pak jokowi 2024 ganti presiden content, The goat #viral #2023 #comment #follow #dio ,1v1 Template #messi #ronaldo #1v1 #fyp #capcut,World ...",['2024 ganti presiden'],https://www.google.com/search?q=About+https://www.capcut.com/kep/7665564931&tbm=ilp&ilps=ADJL0iwY-OGAZHh1kN1FUotVPhjuhvxz5w,https://serpapi.com/search.json?engine=google_about_this_result&google_domain=google.com&ilps=ADJL0iwY-OGAZHh1kN1FUotVPhjuhvxz5w&q=About+https%3A%2F%2Fwww.capcut.com%2Fkep%2F7665564931,https://webcache.googleusercontent.com/search?q=cache:rKddHHAsNOUJ:https://www.capcut.com/kep/7665564931&cd=5&hl=en&ct=clnk&gl=us,capcut.com,capcut.com was first indexed by Google more than 10 years ago,https://www.capcut.com/kep/7665564931,secure,https://serpapi.com/searches/64586b2d96f5d7b407955f08/images/1e37f6aeb26b05fc99bba2a1af11d20c5e53ff53d73b6fb2323aa17481779f08e74c5cca65cbde7455e090d033126ee3.png,
4,Pemilihan umum Presiden Indonesia 2024,https://id.wikipedia.org/wiki/Pemilihan_umum_Presiden_Indonesia_2024,https://id.wikipedia.org › wiki › Pe...,Pasangan calon Presiden dan Wakil Presiden diusulkan oleh partai politik atau gabungan partai politik yang memperoleh sedikitnya 20% kursi Dewan Perwakilan ...,"['Presiden', 'Presiden']",https://www.google.com/search?q=About+https://id.wikipedia.org/wiki/Pemilihan_umum_Presiden_Indonesia_2024&tbm=ilp&ilps=ADJL0iwdD63UDqnFE4XqVeOQ2m25aCi3sw,https://serpapi.com/search.json?engine=google_about_this_result&google_domain=google.com&ilps=ADJL0iwdD63UDqnFE4XqVeOQ2m25aCi3sw&q=About+https%3A%2F%2Fid.wikipedia.org%2Fwiki%2FPemilihan_umum_Presiden_Indonesia_2024,https://webcache.googleusercontent.com/search?q=cache:QDDruJDY37UJ:https://id.wikipedia.org/wiki/Pemilihan_umum_Presiden_Indonesia_2024&cd=6&hl=en&ct=clnk&gl=us,Wikipedia,"Wikipedia is a multilingual, free, online encyclopedia written and maintained by a community of volunteers, known as Wikipedians, through open collaboration and using a wiki-based editing system called MediaWiki. Wikipedia is the largest and most-read reference work in history.",https://id.wikipedia.org/wiki/Pemilihan_umum_Presiden_Indonesia_2024,secure,https://serpapi.com/searches/64586b2d96f5d7b407955f08/images/1e37f6aeb26b05fc99bba2a1af11d20c173d0f7b3aa97eb9f93f24c451872b24f09319a88028331a88498ce19a91d0f6.png,
5,2024 Ganti Presiden added a new photo.,https://m.facebook.com/109283800655957/photos/a.109284150655922/109284153989255/?type=3,https://m.facebook.com › photos,"No photo description available. PreviousNext · 2024 Ganti Presiden, profile picture · 2024 Ganti Presiden · Profile pictures · Feb 16, 2020 ·.","['2024 Ganti Presiden', '2024 Ganti Presiden']",https://www.google.com/search?q=About+https://m.facebook.com/109283800655957/photos/a.109284150655922/109284153989255/?type%3D3&tbm=ilp&ilps=ADJL0izSvA6fdNsdrXB7IJvQr9dsyMkO1g,https://serpapi.com/search.json?engine=google_about_this_result&google_domain=google.com&ilps=ADJL0izSvA6fdNsdrXB7IJvQr9dsyMkO1g&q=About+https%3A%2F%2Fm.facebook.com%2F109283800655957%2Fphotos%2Fa.109284150655922%2F109284153989255%2F%3Ftype%3D3,https://webcache.googleusercontent.com/search?q=cache:b2nugt89A6YJ:https://m.facebook.com/109283800655957/photos/a.109284150655922/109284153989255/%3Ftype%3D3&cd=7&hl=en&ct=clnk&gl=us,Facebook,This result comes from m.facebook.com,https://m.facebook.com/109283800655957/photos/a.109284150655922/109284153989255/?type=3,secure,https://serpapi.com/searches/64586b2d96f5d7b407955f08/images/1e37f6aeb26b05fc99bba2a1af11d20c528d78eb3c8521291e2b34832ed21f62cf66b7366eceb4a19aac7f64765e59cc.png,
6,2024 ganti presiden,https://www.tiktok.com/discover/2024-ganti-presiden,https://www.tiktok.com › Discover,Discover videos related to 2024 ganti presiden on TikTok.,['2024 ganti presiden'],https://www.google.com/search?q=About+https://www.tiktok.com/discover/2024-ganti-presiden&tbm=ilp&ilps=ADJL0izuKbemI2ZfuWyfyKL6Coi_YdDsxw,https://serpapi.com/search.json?engine=google_about_this_result&google_domain=google.com&ilps=ADJL0izuKbemI2ZfuWyfyKL6Coi_YdDsxw&q=About+https%3A%2F%2Fwww.tiktok.com%2Fdiscover%2F2024-ganti-presiden,,tiktok.com,"TikTok, and its Chinese counterpart Douyin, is a short-form video hosting service owned by the Chinese company ByteDance. It hosts user-submitted videos, which can range in duration from 3 seconds to 10 minutes.
Since their launches, TikTok and Douyin have gained global popularity.",https://www.tiktok.com/discover/2024-ganti-presiden,secure,https://serpapi.com/searches/64586b2d96f5d7b407955f08/images/1e37f6aeb26b05fc99bba2a1af11d20cf50e5dde7e8ae3f8afcf3ce31c6e8c55b6dc40db462df8150066aaea1338d496.png,
7,2024 Ganti Presiden,https://www.tiktok.com/@wonkdardjo/video/7118403594843393307,https://www.tiktok.com › video,"46 Likes, TikTok video from _WonkDardjo_ (@wonkdardjo): ""2024 Ganti Presiden"". ANIES Lovers di manapun berada salam sehat dari Jawa Tmur suara asli ...",['2024 Ganti Presiden'],https://www.google.com/search?q=About+https://www.tiktok.com/@wonkdardjo/video/7118403594843393307&tbm=ilp&ilps=ADJL0izzKmpDKjjOxse9alVfD8XNTnZ3ig,https://serpapi.com/search.json?engine=google_about_this_result&google_domain=google.com&ilps=ADJL0izzKmpDKjjOxse9alVfD8XNTnZ3ig&q=About+https%3A%2F%2Fwww.tiktok.com%2F%40wonkdardjo%2Fvideo%2F7118403594843393307,https://webcache.googleusercontent.com/search?q=cache:jqSG7HdY5IcJ:https://www.tiktok.com/%40wonkdardjo/video/7118403594843393307&cd=20&hl=en&ct=clnk&gl=us,TikTok,"TikTok, and its Chinese counterpart Douyin, is a short-form video hosting service owned by the Chinese company ByteDance. It hosts user-submitted videos, which can range in duration from 3 seconds to 10 minutes.
Since their launches, TikTok and Douyin have gained global popularity.",https://www.tiktok.com/@wonkdardjo/video/7118403594843393307,secure,https://serpapi.com/searches/64586b2d96f5d7b407955f08/images/1e37f6aeb26b05fc99bba2a1af11d20c16b5bc1889ca49c71348bd91d3a15568a8e8e52847afbef061e50f87786ecf91.png,
1,Demokrat Siap Menang.2024,https://www.twibbonize.com/19k,https://www.twibbonize.com › ...,Demokrat Siap Menang.2024. supports. 0 Supporters. time. 3 Months Ago. ANIES FOR PRESIDEN 2024. twb.nz/19k. share. frame-module.,"['Siap Menang', '2024', '2024']",https://www.google.com/search?q=About+https://www.twibbonize.com/19k&tbm=ilp&ilps=ADJL0iwO4oDSLpeas6rZvx7X-3KFOEsJUg,https://serpapi.com/search.json?engine=google_about_this_result&google_domain=google.com&ilps=ADJL0iwO4oDSLpeas6rZvx7X-3KFOEsJUg&q=About+https%3A%2F%2Fwww.twibbonize.com%2F19k,https://webcache.googleusercontent.com/search?q=cache:bJQQOQKCnBgJ:https://www.twibbonize.com/19k&cd=11&hl=en&ct=clnk&gl=us,twibbonize.com,twibbonize.com was first indexed by Google in March 2019,https://www.twibbonize.com/19k,secure,https://serpapi.com/searches/64586b31216a9d5b58df721c/images/2e4111e3043f0d0e296df0202ce50919127cc25acf845e18e33531146808d855f75912a049b53b350fa755e630308918.png,
2,"Lepas Fungsionaris, Golkar Jabar Siap Menang Pemilu 2024 ...",https://www.youtube.com/watch?v=zg_4LFC1aKI,https://www.youtube.com › watch,Your browser can't play this video. Learn more. Switch camera.,,https://www.google.com/search?q=About+https://www.youtube.com/watch?v%3Dzg_4LFC1aKI&tbm=ilp&ilps=ADJL0iyvIMCg4vb05vaSqhEYuBb4Q-v1rA,https://serpapi.com/search.json?engine=google_about_this_result&google_domain=google.com&ilps=ADJL0iyvIMCg4vb05vaSqhEYuBb4Q-v1rA&q=About+https%3A%2F%2Fwww.youtube.com%2Fwatch%3Fv%3Dzg_4LFC1aKI,,YouTube,This result comes from www.youtube.com,https://www.youtube.com/watch?v=zg_4LFC1aKI,secure,https://serpapi.com/searches/64586b31216a9d5b58df721c/images/2e4111e3043f0d0e296df0202ce509192eb3197ac2cce535ab1bdc808c7521a416a2115d52710993ce742bd0a0f92ae8.png,
3,"Pemilu 2024, Parta Demokrat Siap Menang",https://www.youtube.com/watch?v=CvoZoF3Rncc,https://www.youtube.com › watch,"Pemilu 2024, Parta Demokrat Siap Menang. 3 views 7 minutes ago. Jurnal Today. Jurnal Today. 3 subscribers. Subscribe. 0. I like this. I dislike this.","['2024', 'Siap Menang']",https://www.google.com/search?q=About+https://www.youtube.com/watch?v%3DCvoZoF3Rncc&tbm=ilp&ilps=ADJL0iwr7gh7aGrJ8yK5mzf3qOIuz5WvfA,https://serpapi.com/search.json?engine=google_about_this_result&google_domain=google.com&ilps=ADJL0iwr7gh7aGrJ8yK5mzf3qOIuz5WvfA&q=About+https%3A%2F%2Fwww.youtube.com%2Fwatch%3Fv%3DCvoZoF3Rncc,,YouTube,"YouTube is an American global online video sharing and social media platform headquartered in San Bruno, California, United States. It was launched on February 14, 2005, by Steve Chen, Chad Hurley, and Jawed Karim. It is owned by Google and is the second most visited website, after Google Search.",https://www.youtube.com/watch?v=CvoZoF3Rncc,secure,https://serpapi.com/searches/64586b31216a9d5b58df721c/images/2e4111e3043f0d0e296df0202ce50919d085ec9d7d719ce9bdb664203120be1ecfd8851b7151ff0c27b38e31e9a43786.png,
4,Dapil 9 DPR RI saya siap menang 2024,https://www.instagram.com/p/CrnW02VyUfu/,https://www.instagram.com › ...,"0 likes, 0 comments - @zezen (@zezen_mohamad_zaelani_84) on Instagram: ""Dapil 9 DPR RI saya siap menang 2024""",['siap menang 2024'],https://www.google.com/search?q=About+https://www.instagram.com/p/CrnW02VyUfu/&tbm=ilp&ilps=ADJL0iwmFF1vHqbsdPGF8dVEhms82jYhag,https://serpapi.com/search.json?engine=google_about_this_result&google_domain=google.com&ilps=ADJL0iwmFF1vHqbsdPGF8dVEhms82jYhag&q=About+https%3A%2F%2Fwww.instagram.com%2Fp%2FCrnW02VyUfu%2F,,Instagram,This result comes from www.instagram.com,https://www.instagram.com/p/CrnW02VyUfu/,secure,https://serpapi.com/searches/64586b31216a9d5b58df721c/images/2e4111e3043f0d0e296df0202ce50919857b6d56ddc46e12297726a7db960df5fa0b77093c0ef468fe51f0902272f609.png,
5,"Formas NU Deklarasikan Anies Capres 2024, Siap Menang di ...",https://brebes.inews.id/read/281881/formas-nu-deklarasikan-anies-capres-2024-siap-menang-di-kandang-banteng,https://brebes.inews.id › News,Sekelompok masyarakat dari kalangan santri di Brebes mendeklarasikan dukungan kepada Anies Baswedan sebagai bakal calon presiden di Pilpres ...,,https://www.google.com/search?q=About+https://brebes.inews.id/read/281881/formas-nu-deklarasikan-anies-capres-2024-siap-menang-di-kandang-banteng&tbm=ilp&ilps=ADJL0iymZXhNpYYBg1KU03kfSrFJia4Xrg,https://serpapi.com/search.json?engine=google_about_this_result&google_domain=google.com&ilps=ADJL0iymZXhNpYYBg1KU03kfSrFJia4Xrg&q=About+https%3A%2F%2Fbrebes.inews.id%2Fread%2F281881%2Fformas-nu-deklarasikan-anies-capres-2024-siap-menang-di-kandang-banteng,https://webcache.googleusercontent.com/search?q=cache:ICifXAFBAX8J:https://brebes.inews.id/read/281881/formas-nu-deklarasikan-anies-capres-2024-siap-menang-di-kandang-banteng&cd=25&hl=en&ct=clnk&gl=us,inews.id,"iNews is an Indonesian free-to-air television network founded by Media Nusantara Citra, a subsidiary of Global Mediacom unit of MNC Asia Holding. It broadcasting 24 hours a day and 7 days a week.",https://brebes.inews.id/read/281881/formas-nu-deklarasikan-anies-capres-2024-siap-menang-di-kandang-banteng,secure,https://serpapi.com/searches/64586b31216a9d5b58df721c/images/2e4111e3043f0d0e296df0202ce50919dbbf64503442fff52f6045a87f60c708a9adb5df60424ff503972f3dabf84504.png,"Apr 10, 2023"
6,Sukarelawan Ganjar: Kami Siap Menang di Pilpres 2024,https://jateng.jpnn.com/politik/7176/sukarelawan-ganjar-kami-siap-menang-di-pilpres-2024,https://jateng.jpnn.com › Politik,JPNN.com Jateng : Sukarelawan Ganjar Pranowo rapatkan barisan untuk menang pada Pemilihan Presiden (Pilpres) 2024.,"['menang', '2024']",https://www.google.com/search?q=About+https://jateng.jpnn.com/politik/7176/sukarelawan-ganjar-kami-siap-menang-di-pilpres-2024&tbm=ilp&ilps=ADJL0iw44KigQcfTAz83B4K6Kfq_eas3wQ,https://serpapi.com/search.json?engine=google_about_this_result&google_domain=google.com&ilps=ADJL0iw44KigQcfTAz83B4K6Kfq_eas3wQ&q=About+https%3A%2F%2Fjateng.jpnn.com%2Fpolitik%2F7176%2Fsukarelawan-ganjar-kami-siap-menang-di-pilpres-2024,https://webcache.googleusercontent.com/search?q=cache:i1I9YIFoM_QJ:https://jateng.jpnn.com/politik/7176/sukarelawan-ganjar-kami-siap-menang-di-pilpres-2024&cd=26&hl=en&ct=clnk&gl=us,jpnn.com,jateng.jpnn.com was first indexed by Google in December 2021,https://jateng.jpnn.com/politik/7176/sukarelawan-ganjar-kami-siap-menang-di-pilpres-2024,secure,https://serpapi.com/searches/64586b31216a9d5b58df721c/images/2e4111e3043f0d0e296df0202ce50919a4272e508161b173165bcf37cb729c00d6defbe9b26541c365e1328114c36ced.png,"Apr 24, 2023"
7,Adinata: Gerindra Kabupaten Way Kanan Siap Menang ...,https://www.putrawayka.com/2023/05/tommy-hiqmah-st-gerindra-kabupaten-way.html,https://www.putrawayka.com › tom...,"Way Kanan, PWK- Dewan Pimpinan Cabang (DPC) Partai Gerindra Kabupaten Way Kanan, Provinsi Lampung, telah menyiapkan bakal calon legislatif ...",,https://www.google.com/search?q=About+https://www.putrawayka.com/2023/05/tommy-hiqmah-st-gerindra-kabupaten-way.html&tbm=ilp&ilps=ADJL0iyrq0vxmJTgjBcdfs20PdnNlAetJQ,https://serpapi.com/search.json?engine=google_about_this_result&google_domain=google.com&ilps=ADJL0iyrq0vxmJTgjBcdfs20PdnNlAetJQ&q=About+https%3A%2F%2Fwww.putrawayka.com%2F2023%2F05%2Ftommy-hiqmah-st-gerindra-kabupaten-way.html,https://webcache.googleusercontent.com/search?q=cache:eSrdEqGl2rsJ:https://www.putrawayka.com/2023/05/tommy-hiqmah-st-gerindra-kabupaten-way.html&cd=28&hl=en&ct=clnk&gl=us,putrawayka.com,putrawayka.com was first indexed by Google in June 2021,https://www.putrawayka.com/2023/05/tommy-hiqmah-st-gerindra-kabupaten-way.html,secure,https://serpapi.com/searches/64586b31216a9d5b58df721c/images/2e4111e3043f0d0e296df0202ce50919ba9735aec8a6122b87f569c171a76c6643deea57109ba323d743f24bf5fff7f1.png,2 days ago
8,Wujudkan Pemilu 2024 Damai dan Anti Hoax - SohIB,https://sohib.indonesiabaik.id/article/wujudkan-pemilu-2024-damai-dan-anti-hoax-ju3RM,https://sohib.indonesiabaik.id › article,"Pemilihan Umum atau Pemilu merupakan kegiatan yang lazim diadakan pada negara penganut asas demokrasi seperti halnya di negara kita, Indonesia.",,https://www.google.com/search?q=About+https://sohib.indonesiabaik.id/article/wujudkan-pemilu-2024-damai-dan-anti-hoax-ju3RM&tbm=ilp&ilps=ADJL0izpX_I062fVO5eHO006hxC0jV24NQ,https://serpapi.com/search.json?engine=google_about_this_result&google_domain=google.com&ilps=ADJL0izpX_I062fVO5eHO006hxC0jV24NQ&q=About+https%3A%2F%2Fsohib.indonesiabaik.id%2Farticle%2Fwujudkan-pemilu-2024-damai-dan-anti-hoax-ju3RM,https://webcache.googleusercontent.com/search?q=cache:b-1I5vexsY4J:https://sohib.indonesiabaik.id/article/wujudkan-pemilu-2024-damai-dan-anti-hoax-ju3RM&cd=29&hl=en&ct=clnk&gl=us,indonesiabaik.id,sohib.indonesiabaik.id was first indexed by Google in June 2022,https://sohib.indonesiabaik.id/article/wujudkan-pemilu-2024-damai-dan-anti-hoax-ju3RM,secure,https://serpapi.com/searches/64586b31216a9d5b58df721c/images/2e4111e3043f0d0e296df0202ce509191c6f53acd6265884750bcd181de0464afee51e99371acc1f8e62ed4e88679870.png,"Apr 28, 2023"
