position,title,link,displayed_link,snippet,snippet_highlighted_words,about_page_link,about_page_serpapi_link,cached_page_link,source,about_this_result.source.description,about_this_result.source.source_info_link,about_this_result.source.security,about_this_result.source.icon,date
3,"Sah, Pemilu 14 Februari 2024 Disepakati DPR, Pemerintah ...",https://pekalongankab.bawaslu.go.id/berita/detail/sah-pemilu-14-februari-2024-disepakati-dpr-pemerintah-dan-penyelenggara-pemilu,https://pekalongankab.bawaslu.go.id › ...,"SahabatBawaslu, Bawaslu menghadiri rapat dengar pendapat (RDP) Komisi II DPR RI bersama KPU dan Kementerian Dalam Negeri (Kemendagri) untuk ...",,https://www.google.com/search?q=About+https://pekalongankab.bawaslu.go.id/berita/detail/sah-pemilu-14-februari-2024-disepakati-dpr-pemerintah-dan-penyelenggara-pemilu&tbm=ilp&ilps=ADJL0iycLcLI3XGbAZft-ab8L8OC26rkGg,https://serpapi.com/search.json?engine=google_about_this_result&google_domain=google.com&ilps=ADJL0iycLcLI3XGbAZft-ab8L8OC26rkGg&q=About+https%3A%2F%2Fpekalongankab.bawaslu.go.id%2Fberita%2Fdetail%2Fsah-pemilu-14-februari-2024-disepakati-dpr-pemerintah-dan-penyelenggara-pemilu,https://webcache.googleusercontent.com/search?q=cache:J14CG-H6vbAJ:https://pekalongankab.bawaslu.go.id/berita/detail/sah-pemilu-14-februari-2024-disepakati-dpr-pemerintah-dan-penyelenggara-pemilu&cd=9&hl=en&ct=clnk&gl=us,bawaslu.go.id,The General Election Supervisory Agency is an independent supervisory agency tasked with oversight the administration of general elections throughout Indonesia.,https://pekalongankab.bawaslu.go.id/berita/detail/sah-pemilu-14-februari-2024-disepakati-dpr-pemerintah-dan-penyelenggara-pemilu,secure,https://serpapi.com/searches/64586b2237b24a761da8915e/images/2c01f2720a1110b66100d88e4ee6a5c86920a088bc2ba5e1170a8bd22412fe500e0713bde4cd59f73699f671de493290.png,"Feb 14, 2024"
4,SiCaleg - Aplikasi Pileg 2024 - Manajemen Relawan ...,https://www.sicaleg.com/,https://www.sicaleg.com,"SiCaleg / Aplikasi Caleg adalah Sistem Informasi Pemenangan Calon Anggota Legislatif untuk mengelola relawan, tim sukses, data pendukung, hingga tabulasi ...",,https://www.google.com/search?q=About+https://www.sicaleg.com/&tbm=ilp&ilps=ADJL0ixKJ2kvt2o0A9ReXEHYjcKPEWNRUw,https://serpapi.com/search.json?engine=google_about_this_result&google_domain=google.com&ilps=ADJL0ixKJ2kvt2o0A9ReXEHYjcKPEWNRUw&q=About+https%3A%2F%2Fwww.sicaleg.com%2F,https://webcache.googleusercontent.com/search?q=cache:cHB0UIvobZAJ:https://www.sicaleg.com/&cd=10&hl=en&ct=clnk&gl=us,sicaleg.com,sicaleg.com was first indexed by Google in March 2019,https://www.sicaleg.com/,secure,https://serpapi.com/searches/64586b2237b24a761da8915e/images/2c01f2720a1110b66100d88e4ee6a5c82815423e77b9407a1034d1531684d5be26d260f5ea0d44ec93afdd6bf685c9ad.png,
5,Berita Pileg 2024 Terkini dan Terbaru Hari Ini,https://www.sindonews.com/topic/105004/pileg-2024,https://www.sindonews.com › topic,"Berita Pileg 2024 terkini - Bacaleg DPR Partai Perindo Sururi Al Faruq Komitmen Wujudkan Kesejahteraan Masyarakat. Antisipasi Eks Napi Korupsi, ...",['Pileg 2024'],https://www.google.com/search?q=About+https://www.sindonews.com/topic/105004/pileg-2024&tbm=ilp&ilps=ADJL0izoHolHZh08GDs5TMKD5Zy69HwT1A,https://serpapi.com/search.json?engine=google_about_this_result&google_domain=google.com&ilps=ADJL0izoHolHZh08GDs5TMKD5Zy69HwT1A&q=About+https%3A%2F%2Fwww.sindonews.com%2Ftopic%2F105004%2Fpileg-2024,https://webcache.googleusercontent.com/search?q=cache:hcdJjM6CpmkJ:https://www.sindonews.com/topic/105004/pileg-2024&cd=11&hl=en&ct=clnk&gl=us,sindonews.com,sindonews.com was first indexed by Google more than 10 years ago,https://www.sindonews.com/topic/105004/pileg-2024,secure,https://serpapi.com/searches/64586b2237b24a761da8915e/images/2c01f2720a1110b66100d88e4ee6a5c8c830b6605791433ec134e454ab86b8916b72fd64234e95cca50c30e02a2df04e.png,
6,KPU Buka Pengajuan Bacaleg DPRDPRD Untuk Pileg 2024,https://www.youtube.com/watch?v=ncm2Di1SVdM,https://www.youtube.com › watch,"MetroTV, Komisi Pemilihan Umum atau KPU membuka penerimaan pengajuan untuk bakal calon anggota DPR, DPRD provinsi, dan DPRD kabupaten/kota ...",,https://www.google.com/search?q=About+https://www.youtube.com/watch?v%3Dncm2Di1SVdM&tbm=ilp&ilps=ADJL0iwIIceCww5233mQSvdzz-F0iRYTPQ,https://serpapi.com/search.json?engine=google_about_this_result&google_domain=google.com&ilps=ADJL0iwIIceCww5233mQSvdzz-F0iRYTPQ&q=About+https%3A%2F%2Fwww.youtube.com%2Fwatch%3Fv%3Dncm2Di1SVdM,,YouTube,This result comes from www.youtube.com,https://www.youtube.com/watch?v=ncm2Di1SVdM,secure,https://serpapi.com/searches/64586b2237b24a761da8915e/images/2c01f2720a1110b66100d88e4ee6a5c86a9f700bf423cf4c5a9ef0b091caf51116abca8d4e73561b4e56bf293c664d20.png,
7,Ada Pergeseran Jumlah Kursi Pada Pileg 2024,https://kominfo.kaurkab.go.id/berita/detail/ada-pergeseran-jumlah-kursi-pada-pileg-2024-,https://kominfo.kaurkab.go.id › detail,"Kominfo- Ketua Komisi Pemilihan Umum (KPU) Kabupaten Kaur Yuhardi S.Ip.,M.H membuka kegiatan Sosialisasi dan Evaluasi Tahapan Penyusunan ...",,https://www.google.com/search?q=About+https://kominfo.kaurkab.go.id/berita/detail/ada-pergeseran-jumlah-kursi-pada-pileg-2024-&tbm=ilp&ilps=ADJL0iz5VbrIsu-DSm6f8zxvnz6kQA80GQ,https://serpapi.com/search.json?engine=google_about_this_result&google_domain=google.com&ilps=ADJL0iz5VbrIsu-DSm6f8zxvnz6kQA80GQ&q=About+https%3A%2F%2Fkominfo.kaurkab.go.id%2Fberita%2Fdetail%2Fada-pergeseran-jumlah-kursi-pada-pileg-2024-,https://webcache.googleusercontent.com/search?q=cache:A_pvMm47m80J:https://kominfo.kaurkab.go.id/berita/detail/ada-pergeseran-jumlah-kursi-pada-pileg-2024-&cd=13&hl=en&ct=clnk&gl=us,kaurkab.go.id,"Kaur is the most southern regency of Bengkulu Province, Indonesia, on the island of Sumatra. It has an area of 2,365.00 km² and had a population of 107,899 at the 2020 Census and 126,551 at the 2020 Census. The regency seat is at the town of Bintuhan.",https://kominfo.kaurkab.go.id/berita/detail/ada-pergeseran-jumlah-kursi-pada-pileg-2024-,secure,https://serpapi.com/searches/64586b2237b24a761da8915e/images/2c01f2720a1110b66100d88e4ee6a5c88514e63a2793e58be9c3bc8ddbecd87e4b8abd0536c8f0e449000fe03b4365fc.jpeg,"Apr 14, 2023"
8,Berita Pileg 2024 Terbaru dan Terkini Hari ini,https://www.medcom.id/tag/16180/pileg-2024,https://www.medcom.id › tag › pile...,"Pemilihan Legislatif 2024 terdiri dari pemilihan umum untuk Anggota Dewan Perwakilan Rakyat, Dewan Perwakilan Daerah, dan Dewan Perwakilan Rakyat Daerah.",['2024'],https://www.google.com/search?q=About+https://www.medcom.id/tag/16180/pileg-2024&tbm=ilp&ilps=ADJL0iwqMag4q1TpoeyJNojdwazRJd7IWg,https://serpapi.com/search.json?engine=google_about_this_result&google_domain=google.com&ilps=ADJL0iwqMag4q1TpoeyJNojdwazRJd7IWg&q=About+https%3A%2F%2Fwww.medcom.id%2Ftag%2F16180%2Fpileg-2024,https://webcache.googleusercontent.com/search?q=cache:6Ihvk_jnL78J:https://www.medcom.id/tag/16180/pileg-2024&cd=14&hl=en&ct=clnk&gl=us,medcom.id,medcom.id was first indexed by Google in July 2016,https://www.medcom.id/tag/16180/pileg-2024,secure,https://serpapi.com/searches/64586b2237b24a761da8915e/images/2c01f2720a1110b66100d88e4ee6a5c80156308a11dffef9f628a04ca90586e5a246fcad7cdf8a7ec3683846f9bb4154.png,
9,"Resmi, Pilpres-Pileg Digelar 14 Februari 2024, Pilkada ...",https://nasional.kompas.com/read/2022/01/24/18261321/resmi-pilpres-pileg-digelar-14-februari-2024-pilkada-serentak-27-november,https://nasional.kompas.com › read,"Jadwal penyelenggaraan pemilihan umum (Pemilu) Presiden, Legislatif, dan Kepala Daerah tahun 2024 akhirnya disepakati. Ini rinciannya.",['2024'],https://www.google.com/search?q=About+https://nasional.kompas.com/read/2022/01/24/18261321/resmi-pilpres-pileg-digelar-14-februari-2024-pilkada-serentak-27-november&tbm=ilp&ilps=ADJL0izdSQPzd319l5nmttqM8zLcCVoFkg,https://serpapi.com/search.json?engine=google_about_this_result&google_domain=google.com&ilps=ADJL0izdSQPzd319l5nmttqM8zLcCVoFkg&q=About+https%3A%2F%2Fnasional.kompas.com%2Fread%2F2022%2F01%2F24%2F18261321%2Fresmi-pilpres-pileg-digelar-14-februari-2024-pilkada-serentak-27-november,https://webcache.googleusercontent.com/search?q=cache:gZB2wb3go0IJ:https://nasional.kompas.com/read/2022/01/24/18261321/resmi-pilpres-pileg-digelar-14-februari-2024-pilkada-serentak-27-november&cd=15&hl=en&ct=clnk&gl=us,kompas.com,"Kompas is an Indonesian national newspaper from Jakarta which was founded on 28 June 1965. The paper is published by PT Kompas Media Nusantara, which is a part of Kompas Gramedia Group. Its head office is located at the Kompas Multimedia Towers, Tanah Abang, Central Jakarta.",https://nasional.kompas.com/read/2022/01/24/18261321/resmi-pilpres-pileg-digelar-14-februari-2024-pilkada-serentak-27-november,secure,https://serpapi.com/searches/64586b2237b24a761da8915e/images/2c01f2720a1110b66100d88e4ee6a5c899a6cb60211801bdabda742d56477513735690baff58d9c437f7b09522da0cb5.png,"Jan 24, 2022"
10,Berita dan Informasi Pileg 2024 Terkini dan Terbaru Hari ini,https://www.detik.com/tag/pileg-2024,https://www.detik.com › tag › pileg...,Sebanyak 25 kader NasDem kota Parepare disiapkan bertarung di Pileg 2024 mendatang. Ke-25 kader tersebut sedang melengkapi syarat administrasi.,['Pileg 2024'],https://www.google.com/search?q=About+https://www.detik.com/tag/pileg-2024&tbm=ilp&ilps=ADJL0ixzD1o9LS6HMIt1LH4Y2qkDbATyyg,https://serpapi.com/search.json?engine=google_about_this_result&google_domain=google.com&ilps=ADJL0ixzD1o9LS6HMIt1LH4Y2qkDbATyyg&q=About+https%3A%2F%2Fwww.detik.com%2Ftag%2Fpileg-2024,https://webcache.googleusercontent.com/search?q=cache:EhdCLYRgSrkJ:https://www.detik.com/tag/pileg-2024&cd=16&hl=en&ct=clnk&gl=us,detik.com,Detikcom is an Indonesian digital media company owned by CT Corp subsidiary Trans Media. Detikcom is an online news portal and publishes breaking news. The portal is consistently ranked among Indonesia's 10 most-visited websites and is among the top 250 in the world.,https://www.detik.com/tag/pileg-2024,secure,https://serpapi.com/searches/64586b2237b24a761da8915e/images/2c01f2720a1110b66100d88e4ee6a5c81ef05dafabd5de35369d14c865bd70d7ff3482319a0eda2de6e82428ea8feb13.png,
1,Indonesia Memilih - Apps on Google Play,https://play.google.com/store/apps/details?id=id.imo.indonesiamemilih,https://play.google.com › store › apps › details › id=id...,"Indonesia Voting Application. Updated on. Apr 18, 2023. News & Magazines. Data safety. arrow_forward. Safety starts with understanding how developers ...",['Indonesia'],https://www.google.com/search?q=About+https://play.google.com/store/apps/details?id%3Did.imo.indonesiamemilih&tbm=ilp&ilps=ADJL0ixdcLufGJyB3uw74ctXsQjqlHUrFQ,https://serpapi.com/search.json?engine=google_about_this_result&google_domain=google.com&ilps=ADJL0ixdcLufGJyB3uw74ctXsQjqlHUrFQ&q=About+https%3A%2F%2Fplay.google.com%2Fstore%2Fapps%2Fdetails%3Fid%3Did.imo.indonesiamemilih,https://webcache.googleusercontent.com/search?q=cache:lO-yUbGZ8nIJ:https://play.google.com/store/apps/details%3Fid%3Did.imo.indonesiamemilih&cd=11&hl=en&ct=clnk&gl=us,Google,"Google Play, also known as the Google Play Store and formerly the Android Market, is a digital distribution service operated and developed by Google.",https://play.google.com/store/apps/details?id=id.imo.indonesiamemilih,secure,https://serpapi.com/searches/64586b239c449da23e74e290/images/d7f335565fc2882568ab97e3e45919d05a4c518250f04ffd90176fb4486f69e95d5a498c415491e9429f991849d77b26.png,
2,Indonesia Memilih Presidensial | Amalia,https://ejournal.politik.lipi.go.id/index.php/jpp/article/view/536,https://ejournal.politik.lipi.go.id › jpp,"Based on the Indonesian constitution (Undang-Undang Dasar 1945), Indonesia decided to undertake presidential system since this system gives large proportion ...","['Indonesian', 'Indonesia']",https://www.google.com/search?q=About+https://ejournal.politik.lipi.go.id/index.php/jpp/article/view/536&tbm=ilp&ilps=ADJL0iyTJtyYDWd6RodncWPmosx7sS6MSw,https://serpapi.com/search.json?engine=google_about_this_result&google_domain=google.com&ilps=ADJL0iyTJtyYDWd6RodncWPmosx7sS6MSw&q=About+https%3A%2F%2Fejournal.politik.lipi.go.id%2Findex.php%2Fjpp%2Farticle%2Fview%2F536,https://webcache.googleusercontent.com/search?q=cache:xm_bTRcnLxsJ:https://ejournal.politik.lipi.go.id/index.php/jpp/article/view/536&cd=12&hl=en&ct=clnk&gl=us,lipi.go.id,The Indonesian Institute of Sciences was the governmental authority for science and research in Indonesia. It consists of 47 research centers in the fields ranging from social to natural sciences.,https://ejournal.politik.lipi.go.id/index.php/jpp/article/view/536,secure,https://serpapi.com/searches/64586b239c449da23e74e290/images/d7f335565fc2882568ab97e3e45919d0e76617b32dcde578bc2edb5aabef8935038595c464ddaf25e25062534c21e8cf.png,
3,Indonesia Memilih,https://www.benarnews.org/indonesian/in-focus/election-2019/,https://www.benarnews.org › in-focus,"Ini menjadi Pemilu bersejarah di Tanah Air, karena untuk pertama kalinya rakyat Indonesia akan secara serentak memilih presiden, wakil presiden, ...","['Indonesia', 'memilih']",https://www.google.com/search?q=About+https://www.benarnews.org/indonesian/in-focus/election-2019/&tbm=ilp&ilps=ADJL0iz5TehiQ75wp5QxZQtrfA1gJoMcrw,https://serpapi.com/search.json?engine=google_about_this_result&google_domain=google.com&ilps=ADJL0iz5TehiQ75wp5QxZQtrfA1gJoMcrw&q=About+https%3A%2F%2Fwww.benarnews.org%2Findonesian%2Fin-focus%2Felection-2019%2F,https://webcache.googleusercontent.com/search?q=cache:v5edC-WmQP0J:https://www.benarnews.org/indonesian/in-focus/election-2019/&cd=13&hl=en&ct=clnk&gl=us,Benar News,benarnews.org was first indexed by Google in March 2015,https://www.benarnews.org/indonesian/in-focus/election-2019/,secure,https://serpapi.com/searches/64586b239c449da23e74e290/images/d7f335565fc2882568ab97e3e45919d04d6e6601f0cbaf829668af19136cb5a3958821f296a71ab34757f6e8a1878b40.png,
4,Indonesia memilih - Femi Adi Soempeno,https://books.google.com/books/about/Indonesia_memilih.html?id=ClIbbL-s5-4C,https://books.google.com › about,"Indonesia memilih. Front Cover. Femi Adi Soempeno. Galangpress Group, 2009 - Indonesia - 170 pages ... Indonesia Memilih Susilo Bambang Yudhoyono.","['Indonesia memilih', 'Indonesia Memilih']",https://www.google.com/search?q=About+https://books.google.com/books/about/Indonesia_memilih.html?id%3DClIbbL-s5-4C&tbm=ilp&ilps=ADJL0izmjTlPrW8GHLrr-GWoHFKSrGBYqw,https://serpapi.com/search.json?engine=google_about_this_result&google_domain=google.com&ilps=ADJL0izmjTlPrW8GHLrr-GWoHFKSrGBYqw&q=About+https%3A%2F%2Fbooks.google.com%2Fbooks%2Fabout%2FIndonesia_memilih.html%3Fid%3DClIbbL-s5-4C,https://webcache.googleusercontent.com/search?q=cache:ZBiOVzehJkMJ:https://books.google.com/books/about/Indonesia_memilih.html%3Fid%3DClIbbL-s5-4C&cd=14&hl=en&ct=clnk&gl=us,Google,"Google Books is a service from Google Inc. that searches the full text of books and magazines that Google has scanned, converted to text using optical character recognition, and stored in its digital database.",https://books.google.com/books/about/Indonesia_memilih.html?id=ClIbbL-s5-4C,secure,https://serpapi.com/searches/64586b239c449da23e74e290/images/d7f335565fc2882568ab97e3e45919d002c331ff937feb1a17e4e7c242601fbe613260fde474a0b7be592db8ba951726.png,
5,Banyak Masyarakat Indonesia Memilih Berobat ke ... - YouTube,https://www.youtube.com/watch?v=6XhokN_b3us,https://www.youtube.com › watch,"Banyak Masyarakat Indonesia Memilih Berobat ke Luar Negeri, Kenapa? | 60 Menit Special Report. Watch later. Share. Copy link.",,https://www.google.com/search?q=About+https://www.youtube.com/watch?v%3D6XhokN_b3us&tbm=ilp&ilps=ADJL0iyKsqeE3K5LyZ-PFzm9d6-j8tKvWg,https://serpapi.com/search.json?engine=google_about_this_result&google_domain=google.com&ilps=ADJL0iyKsqeE3K5LyZ-PFzm9d6-j8tKvWg&q=About+https%3A%2F%2Fwww.youtube.com%2Fwatch%3Fv%3D6XhokN_b3us,,YouTube,This result comes from www.youtube.com,https://www.youtube.com/watch?v=6XhokN_b3us,secure,https://serpapi.com/searches/64586b239c449da23e74e290/images/d7f335565fc2882568ab97e3e45919d0906c18d0fe54af3b8aa8b1c9b7ad85a7016a7d974a343bfce8b995a5d7725ba1.png,
6,Indonesia Memilih | PERPUSTAKAAN PIP SEMARANG,https://opac.pip-semarang.ac.id/index.php?p=show_detail&id=4161&keywords=,https://opac.pip-semarang.ac.id › ...,"Panggil. U 923.1 FEM i. Penerbit, Galang Press : Yogyakarta., 2009. Deskripsi Fisik. hlm.170; p 23cm; ilus. Bahasa. Indonesia. ISBN/ISSN. 978-602-8174-24-4.",['Indonesia'],https://www.google.com/search?q=About+https://opac.pip-semarang.ac.id/index.php?p%3Dshow_detail%26id%3D4161%26keywords%3D&tbm=ilp&ilps=ADJL0iy659e4mIKp3CYv951Uuot_i5l01Q,https://serpapi.com/search.json?engine=google_about_this_result&google_domain=google.com&ilps=ADJL0iy659e4mIKp3CYv951Uuot_i5l01Q&q=About+https%3A%2F%2Fopac.pip-semarang.ac.id%2Findex.php%3Fp%3Dshow_detail%26id%3D4161%26keywords%3D,https://webcache.googleusercontent.com/search?q=cache:Cx0s7FxdZuMJ:https://opac.pip-semarang.ac.id/index.php%3Fp%3Dshow_detail%26id%3D4161%26keywords%3D&cd=16&hl=en&ct=clnk&gl=us,pip-semarang.ac.id,opac.pip-semarang.ac.id was first indexed by Google in October 2018,https://opac.pip-semarang.ac.id/index.php?p=show_detail&id=4161&keywords=,secure,https://serpapi.com/searches/64586b239c449da23e74e290/images/d7f335565fc2882568ab97e3e45919d0344fb329a28062b73f10fdc393a03329c4e6bc62083e9d987706bf0cf4974931.png,
7,Lokasi: Indonesia memilih,https://onesearch.id/Record/IOS3605.JATEN-01110000001315,https://onesearch.id › Record › IOS...,"Indonesia memilih ; Main Author: Femi Adi Soempeno (-) ; Format: Serial Book ; Bahasa: ind ; Terbitan: Yogyakarta : Galang Press , 2009 ; Edition: Cet. 1.",['Indonesia memilih'],https://www.google.com/search?q=About+https://onesearch.id/Record/IOS3605.JATEN-01110000001315&tbm=ilp&ilps=ADJL0ixa9R3bmzOFiC0m2qLNuljemS0tzg,https://serpapi.com/search.json?engine=google_about_this_result&google_domain=google.com&ilps=ADJL0ixa9R3bmzOFiC0m2qLNuljemS0tzg&q=About+https%3A%2F%2Fonesearch.id%2FRecord%2FIOS3605.JATEN-01110000001315,https://webcache.googleusercontent.com/search?q=cache:NWscJ93mnxQJ:https://onesearch.id/Record/IOS3605.JATEN-01110000001315&cd=17&hl=en&ct=clnk&gl=us,onesearch.id,onesearch.id was first indexed by Google in July 2015,https://onesearch.id/Record/IOS3605.JATEN-01110000001315,secure,https://serpapi.com/searches/64586b239c449da23e74e290/images/d7f335565fc2882568ab97e3e45919d032d9fe7f6e6f4d10d943029b260a75f75c2fe7540d06b817d8626ec77da31b0c.png,
8,Indonesia memilih: pemilihan umum di Indonesia jang pertama ...,https://books.google.com/books?id=76DfWKVEJ3IC&pg=PA384&lpg=PA384&dq=Indonesia+Memilih&source=bl&ots=F-u8JRbgiB&sig=ACfU3U1mq0ooN61MxVkj93glGXLcQ57gtA&hl=en&sa=X&ved=2ahUKEwj7393G4uT-AhUkkmoFHZ1IAIUQ6AF6BAgqEAM,https://books.google.com › books,pemilihan umum di Indonesia jang pertama untuk memilih anggota Dewan Perwakilan Rakjat dan Konstituante Indonesia. Panitia Pemilihan.,"['Indonesia', 'memilih', 'Indonesia']",,,,google.com,,,,,
9,Indonesia memilih - Page 137 - Google Books Result,https://books.google.com/books?id=ClIbbL-s5-4C&pg=PA137&lpg=PA137&dq=Indonesia+Memilih&source=bl&ots=qeZhhJBqIC&sig=ACfU3U3f2F-FfWIu1OHFdG41t-JG2owLKA&hl=en&sa=X&ved=2ahUKEwj7393G4uT-AhUkkmoFHZ1IAIUQ6AF6BAgrEAM,https://books.google.com › books,"Baskoro kemudian memilih kuliah di Curtain University , Australia . ASAL TAHU saja , ketekunan SBY menggeluti bidang militer tak ... Indonesia Memilih | 137.",['Indonesia Memilih'],,,,google.com,,,,,
10,Indonesia Memilih Jokowi - Page 56 - Google Books Result,https://books.google.com/books?id=sqBLDwAAQBAJ&pg=PA56&lpg=PA56&dq=Indonesia+Memilih&source=bl&ots=mfBMBUqjqg&sig=ACfU3U3R1Cn0rzp9RsIQcZqisYIVAEi5Yg&hl=en&sa=X&ved=2ahUKEwj7393G4uT-AhUkkmoFHZ1IAIUQ6AF6BAgpEAM,https://books.google.com › books,Warga mengharap Jokowi diberi kesehatan untuk menjadi pemimpin Indonesia. ... warga di daerah yang belum punya pilihan agar memilih Jokowi sebagai presiden.,"['Indonesia', 'memilih']",,,,google.com,,,,,
1,Memahami Apa itu Demokrasi dari Sejarah dan ...,https://www.brainacademy.id/blog/sejarah-dan-penerapan-demokrasi-di-indonesia,https://www.brainacademy.id › blog,Sejarah Demokrasi di Indonesia · Demokrasi Parlementer (1945-1959) · Demokrasi Terpimpin (1959-1965) · Demokrasi Pancasila pada Era Orde Baru (1966 ...,"['Demokrasi', 'Indonesia', 'Demokrasi', 'Demokrasi', 'Demokrasi']",https://www.google.com/search?q=About+https://www.brainacademy.id/blog/sejarah-dan-penerapan-demokrasi-di-indonesia&tbm=ilp&ilps=ADJL0ixH6aCpRpfgES28xI0lhr88FfEEQg,https://serpapi.com/search.json?engine=google_about_this_result&google_domain=google.com&ilps=ADJL0ixH6aCpRpfgES28xI0lhr88FfEEQg&q=About+https%3A%2F%2Fwww.brainacademy.id%2Fblog%2Fsejarah-dan-penerapan-demokrasi-di-indonesia,https://webcache.googleusercontent.com/search?q=cache:4kUqYCOsfWsJ:https://www.brainacademy.id/blog/sejarah-dan-penerapan-demokrasi-di-indonesia&cd=2&hl=en&ct=clnk&gl=us,brainacademy.id,brainacademy.id was first indexed by Google in May 2019,https://www.brainacademy.id/blog/sejarah-dan-penerapan-demokrasi-di-indonesia,secure,https://serpapi.com/searches/64586b259b64722b988ad9f0/images/24b0afca04df73dd51c2b83fec88dd28afcf1e128f3feb130f3577563718f984a8d6153807230fbe0f838b6b8faba047.png,"Jul 27, 2022"
2,"Demokrasi Indonesia: Masa Lampau, Sekarang, Dan ...",https://pemerintahan.umm.ac.id/files/file/Demokrasi%20Indonesia.pdf,https://pemerintahan.umm.ac.id › files › file,Demokrasi di Indonesia mempunyai persyaratan. Khusus yaitu di lepaskanya semacam “bias” dan ethnosentrisme. Ethnosenrtisme membuat kita tidak meampu.,"['Demokrasi', 'Indonesia']",https://www.google.com/search?q=About+https://pemerintahan.umm.ac.id/files/file/Demokrasi%2520Indonesia.pdf&tbm=ilp&ilps=ADJL0izzIffTS26X7bHP5_bLXhyt8SjWaA,https://serpapi.com/search.json?engine=google_about_this_result&google_domain=google.com&ilps=ADJL0izzIffTS26X7bHP5_bLXhyt8SjWaA&q=About+https%3A%2F%2Fpemerintahan.umm.ac.id%2Ffiles%2Ffile%2FDemokrasi%2520Indonesia.pdf,https://webcache.googleusercontent.com/search?q=cache:JXu-uE28AYkJ:https://pemerintahan.umm.ac.id/files/file/Demokrasi%2520Indonesia.pdf&cd=7&hl=en&ct=clnk&gl=us,umm.ac.id,pemerintahan.umm.ac.id was first indexed by Google more than 10 years ago,https://pemerintahan.umm.ac.id/files/file/Demokrasi%20Indonesia.pdf,secure,https://serpapi.com/searches/64586b259b64722b988ad9f0/images/24b0afca04df73dd51c2b83fec88dd287bf6fc3a05e0f75c440052c43dc6237f55e7efcc7793ca58cfbbd5ff51a7fbdd.png,
3,DEMOKRASI INDONESIA,https://simdos.unud.ac.id/uploads/file_pendidikan_1_dir/5c38de8a798f624eab38b1fe6f7e97ff.pdf,https://simdos.unud.ac.id › file_pendidikan_1_dir,"Demokrasi mencakup kondisi social, ekonomi, dan budaya yang memungkinkan adanya praktik kebebasan politik secara bebas dan setara. Demokrasi Indonesia dipandang ...",['Demokrasi Indonesia'],https://www.google.com/search?q=About+https://simdos.unud.ac.id/uploads/file_pendidikan_1_dir/5c38de8a798f624eab38b1fe6f7e97ff.pdf&tbm=ilp&ilps=ADJL0iyo6Q8LsslmsF0c9UgmrACdvvgt1A,https://serpapi.com/search.json?engine=google_about_this_result&google_domain=google.com&ilps=ADJL0iyo6Q8LsslmsF0c9UgmrACdvvgt1A&q=About+https%3A%2F%2Fsimdos.unud.ac.id%2Fuploads%2Ffile_pendidikan_1_dir%2F5c38de8a798f624eab38b1fe6f7e97ff.pdf,https://webcache.googleusercontent.com/search?q=cache:nzrrzag7P1IJ:https://simdos.unud.ac.id/uploads/file_pendidikan_1_dir/5c38de8a798f624eab38b1fe6f7e97ff.pdf&cd=8&hl=en&ct=clnk&gl=us,unud.ac.id,"Udayana University is a for-profit public university in Denpasar, Bali, Indonesia. It was established on September 29, 1962 and it used to belong to the Airlangga University that mainly located in Surabaya. Its current rector is I Nyoman Gde Antara.",https://simdos.unud.ac.id/uploads/file_pendidikan_1_dir/5c38de8a798f624eab38b1fe6f7e97ff.pdf,secure,https://serpapi.com/searches/64586b259b64722b988ad9f0/images/24b0afca04df73dd51c2b83fec88dd28045915700e6476ad31a8f11b32169831517f2b8c7dd5c20205422ee911c84cd7.png,
4,Sejarah Demokrasi di Indonesia dan Perkembangannya ...,https://www.detik.com/edu/detikpedia/d-6243165/sejarah-demokrasi-di-indonesia-dan-perkembangannya-dari-masa-ke-masa,https://www.detik.com › detikpedia,1. Demokrasi Parlementer (1945 - 1959) · 2. Demokrasi Terpimpin (1959 - 1965) · 3. Demokrasi Pancasila era Orde Baru (1965 - 1998) · 4. Demokrasi ...,"['Demokrasi', 'Demokrasi', 'Demokrasi', 'Demokrasi']",https://www.google.com/search?q=About+https://www.detik.com/edu/detikpedia/d-6243165/sejarah-demokrasi-di-indonesia-dan-perkembangannya-dari-masa-ke-masa&tbm=ilp&ilps=ADJL0ixb---Vn1MTHa0EKzen_cjjsuKcqQ,https://serpapi.com/search.json?engine=google_about_this_result&google_domain=google.com&ilps=ADJL0ixb---Vn1MTHa0EKzen_cjjsuKcqQ&q=About+https%3A%2F%2Fwww.detik.com%2Fedu%2Fdetikpedia%2Fd-6243165%2Fsejarah-demokrasi-di-indonesia-dan-perkembangannya-dari-masa-ke-masa,https://webcache.googleusercontent.com/search?q=cache:MPChZ9XXRVoJ:https://www.detik.com/edu/detikpedia/d-6243165/sejarah-demokrasi-di-indonesia-dan-perkembangannya-dari-masa-ke-masa&cd=9&hl=en&ct=clnk&gl=us,detik.com,Detikcom is an Indonesian digital media company owned by CT Corp subsidiary Trans Media. Detikcom is an online news portal and publishes breaking news. The portal is consistently ranked among Indonesia's 10 most-visited websites and is among the top 250 in the world.,https://www.detik.com/edu/detikpedia/d-6243165/sejarah-demokrasi-di-indonesia-dan-perkembangannya-dari-masa-ke-masa,secure,https://serpapi.com/searches/64586b259b64722b988ad9f0/images/24b0afca04df73dd51c2b83fec88dd28ad05fd12353799fcb5c504b6d3e8a4d318cd745b75fd6f0b33620a880feb9934.png,"Aug 19, 2022"
