position,title,link,displayed_link,snippet,snippet_highlighted_words,about_page_link,about_page_serpapi_link,cached_page_link,source,about_this_result.source.description,about_this_result.source.source_info_link,about_this_result.source.security,about_this_result.source.icon,date
5,"Macam-macam Demokrasi di Indonesia, dari Parlementer ...",https://www.merdeka.com/jabar/macam-macam-demokrasi-di-indonesia-dari-parlementer-hingga-pancasila-kln.html,https://www.merdeka.com › jabar,Berikut ini informasi mengenai macam-macam demokrasi di Indonesia yang wajib diketahui. Dari demokrasi parlementer hingga pancasila yang ...,"['demokrasi', 'Indonesia', 'demokrasi']",https://www.google.com/search?q=About+https://www.merdeka.com/jabar/macam-macam-demokrasi-di-indonesia-dari-parlementer-hingga-pancasila-kln.html&tbm=ilp&ilps=ADJL0izwxnWjI8ePdlgdOcTssaYogaQsnA,https://serpapi.com/search.json?engine=google_about_this_result&google_domain=google.com&ilps=ADJL0izwxnWjI8ePdlgdOcTssaYogaQsnA&q=About+https%3A%2F%2Fwww.merdeka.com%2Fjabar%2Fmacam-macam-demokrasi-di-indonesia-dari-parlementer-hingga-pancasila-kln.html,https://webcache.googleusercontent.com/search?q=cache:6FxD3rN9SUwJ:https://www.merdeka.com/jabar/macam-macam-demokrasi-di-indonesia-dari-parlementer-hingga-pancasila-kln.html&cd=10&hl=en&ct=clnk&gl=us,merdeka.com,merdeka.com was first indexed by Google more than 10 years ago,https://www.merdeka.com/jabar/macam-macam-demokrasi-di-indonesia-dari-parlementer-hingga-pancasila-kln.html,secure,https://serpapi.com/searches/64586b259b64722b988ad9f0/images/24b0afca04df73dd51c2b83fec88dd282b8423884241b418642951b177cc9cffafab6fc17dd7bcfd194c4887b2ca7a66.png,"Nov 3, 2020"
6,Demokrasi di Indonesia,https://id.wikipedia.org/wiki/Demokrasi_di_Indonesia,https://id.wikipedia.org › wiki › De...,"Demokrasi di Indonesia adalah suatu proses sejarah dan politik perkembangan demokrasi di Indonesia, mulai dari pengertian dan konsepsi demokrasi menurut ...","['Demokrasi', 'Indonesia', 'demokrasi', 'Indonesia', 'demokrasi']",https://www.google.com/search?q=About+https://id.wikipedia.org/wiki/Demokrasi_di_Indonesia&tbm=ilp&ilps=ADJL0iyqgXKe-KQxzc731bcDi4iDb6dMvg,https://serpapi.com/search.json?engine=google_about_this_result&google_domain=google.com&ilps=ADJL0iyqgXKe-KQxzc731bcDi4iDb6dMvg&q=About+https%3A%2F%2Fid.wikipedia.org%2Fwiki%2FDemokrasi_di_Indonesia,https://webcache.googleusercontent.com/search?q=cache:mf2SicssL8gJ:https://id.wikipedia.org/wiki/Demokrasi_di_Indonesia&cd=11&hl=en&ct=clnk&gl=us,Wikipedia,"Wikipedia is a multilingual, free, online encyclopedia written and maintained by a community of volunteers, known as Wikipedians, through open collaboration and using a wiki-based editing system called MediaWiki. Wikipedia is the largest and most-read reference work in history.",https://id.wikipedia.org/wiki/Demokrasi_di_Indonesia,secure,https://serpapi.com/searches/64586b259b64722b988ad9f0/images/24b0afca04df73dd51c2b83fec88dd28db5c8a42e16c74381e0cfa0824be4dcc5ee02c57e4db62ab46bf6727beca72a4.png,
7,Demokrasi dan Sistem Pemerintahan,https://jurnalkonstitusi.mkri.id/index.php/jk/article/download/1027/106/204,https://jurnalkonstitusi.mkri.id › download,"demokrasi Indonesia memasuki era baru yang di sebut era reformasi, yang di awali dengan adanya perubahan UUD 1945 dengan menonjolkan kebebasan.",['demokrasi Indonesia'],https://www.google.com/search?q=About+https://jurnalkonstitusi.mkri.id/index.php/jk/article/download/1027/106/204&tbm=ilp&ilps=ADJL0iyUUnX8OuHxzhm8xi-iGfVVEe5usA,https://serpapi.com/search.json?engine=google_about_this_result&google_domain=google.com&ilps=ADJL0iyUUnX8OuHxzhm8xi-iGfVVEe5usA&q=About+https%3A%2F%2Fjurnalkonstitusi.mkri.id%2Findex.php%2Fjk%2Farticle%2Fdownload%2F1027%2F106%2F204,https://webcache.googleusercontent.com/search?q=cache:ASshrfWOv8YJ:https://jurnalkonstitusi.mkri.id/index.php/jk/article/download/1027/106/204&cd=13&hl=en&ct=clnk&gl=us,mkri.id,The Constitutional Court of the Republic of Indonesia is one of the apex courts in Indonesia along with the Indonesian Supreme Court. Its primary role is reviewing the constitutionality of statutes.,https://jurnalkonstitusi.mkri.id/index.php/jk/article/download/1027/106/204,secure,https://serpapi.com/searches/64586b259b64722b988ad9f0/images/24b0afca04df73dd51c2b83fec88dd281c18e404a9b93f8dbbf45b2bed5b628ebf671a8e81c9256c72c361e71c603705.png,
8,DEMOKRASI INDONESIA,https://dosen.unmerbaya.ac.id/file/content/2022/03/demokrasi_indonesia_yeni.pptx,https://dosen.unmerbaya.ac.id › file › 2022/03,Jadi demokrasi berarti pemerintahan rakyat. Salah satu pendapat terkenal dikemukakan oleh Abraham Lincoln di tahun 1863 yang mengatakan demokrasi adalah ...,"['demokrasi', 'demokrasi']",https://www.google.com/search?q=About+https://dosen.unmerbaya.ac.id/file/content/2022/03/demokrasi_indonesia_yeni.pptx&tbm=ilp&ilps=ADJL0iyNhkaXIDAcJRGxyBRSBZ2PlMVYfw,https://serpapi.com/search.json?engine=google_about_this_result&google_domain=google.com&ilps=ADJL0iyNhkaXIDAcJRGxyBRSBZ2PlMVYfw&q=About+https%3A%2F%2Fdosen.unmerbaya.ac.id%2Ffile%2Fcontent%2F2022%2F03%2Fdemokrasi_indonesia_yeni.pptx,https://webcache.googleusercontent.com/search?q=cache:2l8gmk8_MtkJ:https://dosen.unmerbaya.ac.id/file/content/2022/03/demokrasi_indonesia_yeni.pptx&cd=14&hl=en&ct=clnk&gl=us,unmerbaya.ac.id,dosen.unmerbaya.ac.id was first indexed by Google in April 2022,https://dosen.unmerbaya.ac.id/file/content/2022/03/demokrasi_indonesia_yeni.pptx,secure,https://serpapi.com/searches/64586b259b64722b988ad9f0/images/24b0afca04df73dd51c2b83fec88dd2840226211f92be9f8a0163baf68fa5cbdbd8871ac78038ca4e5aee9f5a4cab2ba.png,
9,Demokrasi Pancasila Bukanlah Barang Jadi,http://bandungkota.bawaslu.go.id/berita-demokrasi-pancasila-bukanlah-barang-jadi.html,http://bandungkota.bawaslu.go.id › ...,"Perkembangan demokrasi di Indonesia berlanjut pada fase demokrasi pancasila “versi orde baru,” yang menurut M. Rusli Karim demokrasi pada rezim ...","['demokrasi', 'Indonesia', 'demokrasi', 'demokrasi']",https://www.google.com/search?q=About+http://bandungkota.bawaslu.go.id/berita-demokrasi-pancasila-bukanlah-barang-jadi.html&tbm=ilp&ilps=ADJL0iyHgdvKJa34LtebI3QJllWS8D3JLQ,https://serpapi.com/search.json?engine=google_about_this_result&google_domain=google.com&ilps=ADJL0iyHgdvKJa34LtebI3QJllWS8D3JLQ&q=About+http%3A%2F%2Fbandungkota.bawaslu.go.id%2Fberita-demokrasi-pancasila-bukanlah-barang-jadi.html,http://webcache.googleusercontent.com/search?q=cache:OPo-O7Zlra4J:bandungkota.bawaslu.go.id/berita-demokrasi-pancasila-bukanlah-barang-jadi.html&cd=15&hl=en&ct=clnk&gl=us,bawaslu.go.id,The General Election Supervisory Agency is an independent supervisory agency tasked with oversight the administration of general elections throughout Indonesia.,http://bandungkota.bawaslu.go.id/berita-demokrasi-pancasila-bukanlah-barang-jadi.html,not secure,https://serpapi.com/searches/64586b259b64722b988ad9f0/images/24b0afca04df73dd51c2b83fec88dd28f716bce6b412ccf944599cfe31341463f4434b60b9b07e773655ff8422889b19.png,"Apr 7, 2020"
1,"Bangga Pilih Indonesia, Perenang Muda Masniari Wolf ...",https://www.kemenpora.go.id/detail/2173/bangga-pilih-indonesia-perenang-muda-masniari-wolf-ingin-berprestasi-di-olimpiade-paris-2024-dan-olimpiade-los-angeles-2028,https://www.kemenpora.go.id › detail,"Bangga Pilih Indonesia, Perenang Muda Masniari Wolf Ingin Berprestasi di Olimpiade Paris 2024 dan Olimpiade Namanya Masniari Wolf, usianya baru 16 tahun.",['Pilih Indonesia'],https://www.google.com/search?q=About+https://www.kemenpora.go.id/detail/2173/bangga-pilih-indonesia-perenang-muda-masniari-wolf-ingin-berprestasi-di-olimpiade-paris-2024-dan-olimpiade-los-angeles-2028&tbm=ilp&ilps=ADJL0ixzY1S2O8Jv4bNxQbPVHEKsy1V78w,https://serpapi.com/search.json?engine=google_about_this_result&google_domain=google.com&ilps=ADJL0ixzY1S2O8Jv4bNxQbPVHEKsy1V78w&q=About+https%3A%2F%2Fwww.kemenpora.go.id%2Fdetail%2F2173%2Fbangga-pilih-indonesia-perenang-muda-masniari-wolf-ingin-berprestasi-di-olimpiade-paris-2024-dan-olimpiade-los-angeles-2028,https://webcache.googleusercontent.com/search?q=cache:pUSWtqPBbmwJ:https://www.kemenpora.go.id/detail/2173/bangga-pilih-indonesia-perenang-muda-masniari-wolf-ingin-berprestasi-di-olimpiade-paris-2024-dan-olimpiade-los-angeles-2028&cd=17&hl=en&ct=clnk&gl=us,kemenpora.go.id,kemenpora.go.id was first indexed by Google more than 10 years ago,https://www.kemenpora.go.id/detail/2173/bangga-pilih-indonesia-perenang-muda-masniari-wolf-ingin-berprestasi-di-olimpiade-paris-2024-dan-olimpiade-los-angeles-2028,secure,https://serpapi.com/searches/64586b28e135083e86bd4552/images/1a0d439850472a15d3b6b8f653fc557c43596c0a91aa4a6eac94d12824cb63744e21941520d67594479f58b03cb5dd7e.png,
2,PPP dan PDIP pilih Ganjar Pranowo sebagai capres,https://www.bbc.com/indonesia/articles/ckrk2ynv9npo,https://www.bbc.com › articles,"Ketua Umum DPP PDIP, Megawati Soekarnoputri, resmi mengumumkan Ganjar Pranowo sebagai calon presiden pilihan Partai Demokrasi Indonesia ...",['Indonesia'],https://www.google.com/search?q=About+https://www.bbc.com/indonesia/articles/ckrk2ynv9npo&tbm=ilp&ilps=ADJL0ixc6N9GJNCF1N1O_P-KPsZrNghcCg,https://serpapi.com/search.json?engine=google_about_this_result&google_domain=google.com&ilps=ADJL0ixc6N9GJNCF1N1O_P-KPsZrNghcCg&q=About+https%3A%2F%2Fwww.bbc.com%2Findonesia%2Farticles%2Fckrk2ynv9npo,https://webcache.googleusercontent.com/search?q=cache:nMoK6HfanY4J:https://www.bbc.com/indonesia/articles/ckrk2ynv9npo&cd=18&hl=en&ct=clnk&gl=us,BBC,"BBC Online, formerly known as BBCi, is the BBC's online service. It is a large network of websites including such high-profile sites as BBC News and Sport, the on-demand video and radio services branded ...",https://www.bbc.com/indonesia/articles/ckrk2ynv9npo,secure,https://serpapi.com/searches/64586b28e135083e86bd4552/images/1a0d439850472a15d3b6b8f653fc557c86ea9c55c1edb525fce25fc043bac324ca306757f28461729c6ac94c6157d68b.png,"Apr 21, 2023"
3,"Terkuak, Ini Alasan Jokowi Pilih Nama Nusantara untuk Ibu ...",https://ikn.go.id/en/terkuak-ini-alasan-jokowi-pilih-nama-nusantara-untuk-ibu-kota-negara-baru,https://ikn.go.id › terkuak-ini-alasan...,"Terkuak, Ini Alasan Jokowi Pilih Nama Nusantara untuk Ibu Kota Negara Baru. ... Kata nusantara sudah dikenal bahkan sebelum Indonesia merdeka.","['Pilih', 'Indonesia']",https://www.google.com/search?q=About+https://ikn.go.id/terkuak-ini-alasan-jokowi-pilih-nama-nusantara-untuk-ibu-kota-negara-baru&tbm=ilp&ilps=ADJL0iyxIHrruh-uIiTDvze_Y_uqBleNiQ,https://serpapi.com/search.json?engine=google_about_this_result&google_domain=google.com&ilps=ADJL0iyxIHrruh-uIiTDvze_Y_uqBleNiQ&q=About+https%3A%2F%2Fikn.go.id%2Fterkuak-ini-alasan-jokowi-pilih-nama-nusantara-untuk-ibu-kota-negara-baru,https://webcache.googleusercontent.com/search?q=cache:H-HhgtR1DjMJ:https://ikn.go.id/en/terkuak-ini-alasan-jokowi-pilih-nama-nusantara-untuk-ibu-kota-negara-baru&cd=19&hl=en&ct=clnk&gl=us,ikn.go.id,"Nusantara, officially the Capital City of Nusantara, is the future capital of Indonesia, set to be inaugurated on 17 August 2024, coinciding with the Indonesian Independence Day. Nusantara will replace Jakarta as the national capital, a position it has held since independence in 1945.",https://ikn.go.id/en/terkuak-ini-alasan-jokowi-pilih-nama-nusantara-untuk-ibu-kota-negara-baru,secure,https://serpapi.com/searches/64586b28e135083e86bd4552/images/1a0d439850472a15d3b6b8f653fc557ca6d20b8f81596778c2aa5c85b4cebed1adfa5693a6fb012228baeb88f843563f.png,
4,Kemenlu: 34 WNI yang Pilih Tetap Tinggal di Ukraina Aman,https://nasional.kompas.com/read/2022/10/07/14200331/kemenlu-34-wni-yang-pilih-tetap-tinggal-di-ukraina-aman,https://nasional.kompas.com › read,"Direktur Perlindungan Warga Negara Indonesia (WNI) dan BHI Kemenlu Judha Nugraha menyebut, saat ini ada 34 WNI yang tetap memilih tinggal di ...",['Indonesia'],https://www.google.com/search?q=About+https://nasional.kompas.com/read/2022/10/07/14200331/kemenlu-34-wni-yang-pilih-tetap-tinggal-di-ukraina-aman&tbm=ilp&ilps=ADJL0izgjHpweY2dDRrnQr3QsXe298snRQ,https://serpapi.com/search.json?engine=google_about_this_result&google_domain=google.com&ilps=ADJL0izgjHpweY2dDRrnQr3QsXe298snRQ&q=About+https%3A%2F%2Fnasional.kompas.com%2Fread%2F2022%2F10%2F07%2F14200331%2Fkemenlu-34-wni-yang-pilih-tetap-tinggal-di-ukraina-aman,https://webcache.googleusercontent.com/search?q=cache:WezjVwCkOPUJ:https://nasional.kompas.com/read/2022/10/07/14200331/kemenlu-34-wni-yang-pilih-tetap-tinggal-di-ukraina-aman&cd=20&hl=en&ct=clnk&gl=us,kompas.com,"Kompas is an Indonesian national newspaper from Jakarta which was founded on 28 June 1965. The paper is published by PT Kompas Media Nusantara, which is a part of Kompas Gramedia Group. Its head office is located at the Kompas Multimedia Towers, Tanah Abang, Central Jakarta.",https://nasional.kompas.com/read/2022/10/07/14200331/kemenlu-34-wni-yang-pilih-tetap-tinggal-di-ukraina-aman,secure,https://serpapi.com/searches/64586b28e135083e86bd4552/images/1a0d439850472a15d3b6b8f653fc557c6bd512447e2ea46d826082897b9bf012b69375115a2663552ff067fee4e10e40.png,"Oct 7, 2022"
5,Pilih negara atau areamu - Spotify,https://www.spotify.com/id-id/select-your-country-region/,https://www.spotify.com › select-your-country-region,Indonesia (English). ✕ Close. Lewati ke konten. Spotify · Premium · Dukungan · Download · Daftar · Masuk. Menu. Pilih negara atau areamu: ...,"['Indonesia', 'Pilih']",https://www.google.com/search?q=About+https://www.spotify.com/id-id/select-your-country-region/&tbm=ilp&ilps=ADJL0ixDnmeZdrHwr23YXdOYeFJcphbXNw,https://serpapi.com/search.json?engine=google_about_this_result&google_domain=google.com&ilps=ADJL0ixDnmeZdrHwr23YXdOYeFJcphbXNw&q=About+https%3A%2F%2Fwww.spotify.com%2Fid-id%2Fselect-your-country-region%2F,https://webcache.googleusercontent.com/search?q=cache:aftNoCV06iMJ:https://www.spotify.com/id-id/select-your-country-region/&cd=21&hl=en&ct=clnk&gl=us,spotify.com,spotify.com was first indexed by Google more than 10 years ago,https://www.spotify.com/id-id/select-your-country-region/,secure,https://serpapi.com/searches/64586b28e135083e86bd4552/images/1a0d439850472a15d3b6b8f653fc557c11b00b8e878bf5f6206ebd6ba0d8cc9fdfd335abe379b0ae5fcaa20767c0bf75.png,
6,Hak Politik Warga Negara (Sebuah Perbandingan Konstitusi),https://ditjenpp.kemenkumham.go.id/index.php?option=com_content&view=article&id=2941:hak-politik-warga-negara-sebuah-perbandingan-konstitusi&catid=100&Itemid=180,https://ditjenpp.kemenkumham.go.id › ...,Hak pilih juga tercantum dalam International Covenant on Civil and Political Rights (ICCPR) yang telah diratifikasi Indonesia dengan UU No.,"['pilih', 'Indonesia']",https://www.google.com/search?q=About+https://ditjenpp.kemenkumham.go.id/index.php?option%3Dcom_content%26view%3Darticle%26id%3D2941:hak-politik-warga-negara-sebuah-perbandingan-konstitusi%26catid%3D100%26Itemid%3D180&tbm=ilp&ilps=ADJL0ixp5rFh1MrvS74fZFdaxP3mXTdyEw,https://serpapi.com/search.json?engine=google_about_this_result&google_domain=google.com&ilps=ADJL0ixp5rFh1MrvS74fZFdaxP3mXTdyEw&q=About+https%3A%2F%2Fditjenpp.kemenkumham.go.id%2Findex.php%3Foption%3Dcom_content%26view%3Darticle%26id%3D2941%3Ahak-politik-warga-negara-sebuah-perbandingan-konstitusi%26catid%3D100%26Itemid%3D180,https://webcache.googleusercontent.com/search?q=cache:OD-VqbW6uk0J:https://ditjenpp.kemenkumham.go.id/index.php%3Foption%3Dcom_content%26view%3Darticle%26id%3D2941:hak-politik-warga-negara-sebuah-perbandingan-konstitusi%26catid%3D100%26Itemid%3D180&cd=22&hl=en&ct=clnk&gl=us,kemenkumham.go.id,"The Ministry of Law and Human Rights is an Indonesian ministry that administers laws and human rights. It is responsible to the president, and is led by the Minister of Law and Human Rights, Yasonna Laoly, since 27 October 2014. The first minister was Soepomo.",https://ditjenpp.kemenkumham.go.id/index.php?option=com_content&view=article&id=2941:hak-politik-warga-negara-sebuah-perbandingan-konstitusi&catid=100&Itemid=180,secure,https://serpapi.com/searches/64586b28e135083e86bd4552/images/1a0d439850472a15d3b6b8f653fc557ca75c5c8befde00b916cf0f79c7722891d54618601b33198cbdac65ba11e39a5e.png,
7,Pilih Kursi Lebih Awal | Maskapai Garuda Indonesia,https://www.garuda-indonesia.com/id/id/garuda-indonesia-experience/on-ground/seat-selection,https://www.garuda-indonesia.com › ...,Pastikan Anda mendapatkan kursi favorit Anda lebih awal dalam pesawat Garuda Indonesia. ... PILIH KURSI ANDA LEBIH AWAL UNTUK PERJALANAN LEBIH NYAMAN.,"['Indonesia', 'PILIH']",https://www.google.com/search?q=About+https://www.garuda-indonesia.com/id/id/garuda-indonesia-experience/on-ground/seat-selection&tbm=ilp&ilps=ADJL0izQnDSfhNw3rqqyPD-2Gool2kOjeQ,https://serpapi.com/search.json?engine=google_about_this_result&google_domain=google.com&ilps=ADJL0izQnDSfhNw3rqqyPD-2Gool2kOjeQ&q=About+https%3A%2F%2Fwww.garuda-indonesia.com%2Fid%2Fid%2Fgaruda-indonesia-experience%2Fon-ground%2Fseat-selection,https://webcache.googleusercontent.com/search?q=cache:UnskDtXkrnQJ:https://www.garuda-indonesia.com/id/id/garuda-indonesia-experience/on-ground/seat-selection&cd=23&hl=en&ct=clnk&gl=us,Garuda Indonesia,"Garuda Indonesia is the flag carrier of Indonesia, headquartered at Soekarno–Hatta International Airport.",https://www.garuda-indonesia.com/id/id/garuda-indonesia-experience/on-ground/seat-selection,secure,https://serpapi.com/searches/64586b28e135083e86bd4552/images/1a0d439850472a15d3b6b8f653fc557c05c8dd12c03e9cdcd33eb925414c808f361e6fe54e141c5f79055675f4226f65.png,
8,Jokowi's Indonesia And The World - Page 144 - Google Books Result,https://books.google.com/books?id=p2LcDwAAQBAJ&pg=PA144&lpg=PA144&dq=Indonesia+Pilih+Siapa&source=bl&ots=5i0EGClSc-&sig=ACfU3U3rj_IDEMUzqsJQyrt1EFjAXME7ZA&hl=en&sa=X&ved=2ahUKEwjVz5vJ4uT-AhVVUKQEHQwCA4wQ6AF6BAgfEAM,https://books.google.com › books,'Indonesian prison riot leaves five officers and one prisoner dead.' The Guardian. ... 'Ahok Kaget Jokowi Pilih Ma'ruf Amin Jadi Cawapres.' CNN Indonesia.,"['Indonesian', 'Pilih', 'Indonesia']",,,,google.com,,,,,
1,tahapan dan jadwal penyelenggaraan pemilu tahun 2024,https://infopemilu.kpu.go.id/Pemilu/Peserta_pemilu,https://infopemilu.kpu.go.id › Pemilu,Penyusunan Peraturan KPU · Pemutakhiran data Pemilih dan penyusunan daftar Pemilih · Pendafatran dan Verifikasi Peserta Pemilu.,['Pemilu'],https://www.google.com/search?q=About+https://infopemilu.kpu.go.id/Pemilu/Peserta_pemilu&tbm=ilp&ilps=ADJL0iwsPHLVZVkB_cs2zjmWpRr9ik0zbQ,https://serpapi.com/search.json?engine=google_about_this_result&google_domain=google.com&ilps=ADJL0iwsPHLVZVkB_cs2zjmWpRr9ik0zbQ&q=About+https%3A%2F%2Finfopemilu.kpu.go.id%2FPemilu%2FPeserta_pemilu,https://webcache.googleusercontent.com/search?q=cache:dCYvYQGZ2B4J:https://infopemilu.kpu.go.id/Pemilu/Peserta_pemilu&cd=2&hl=en&ct=clnk&gl=us,kpu.go.id,"The General Elections Commission is the body that organises elections in Indonesia. Its responsibilities include deciding which parties can contest elections, organising the voting and announcing the results and seats won in the various branches of the government.",https://infopemilu.kpu.go.id/Pemilu/Peserta_pemilu,secure,https://serpapi.com/searches/64586b2a2c6878dd58daee8c/images/ab05018f01a055f60cb29e1a001bdd82d400f3042c597f2a470ec03fbda067c60f1af473c979b43d9c997d4ff809a817.png,
2,Tahapan dan Jadwal Pemilu 2024 | Indonesia Baik,https://indonesiabaik.id/infografis/tahapan-dan-jadwal-pemilu-2024,https://indonesiabaik.id › infografis,Indonesiabaik.id - Peraturan Komisi Pemilihan Umum (PKPU) untuk penyelenggaraan Pemilu 2024 telah sah diundangkan melalui PKPU Nomor 3 Tahun 2022.,['Pemilu 2024'],https://www.google.com/search?q=About+https://indonesiabaik.id/infografis/tahapan-dan-jadwal-pemilu-2024&tbm=ilp&ilps=ADJL0iwNe0aoL4iH4eraP1J6oOMVLdKTBQ,https://serpapi.com/search.json?engine=google_about_this_result&google_domain=google.com&ilps=ADJL0iwNe0aoL4iH4eraP1J6oOMVLdKTBQ&q=About+https%3A%2F%2Findonesiabaik.id%2Finfografis%2Ftahapan-dan-jadwal-pemilu-2024,https://webcache.googleusercontent.com/search?q=cache:R9gmNxA_UZEJ:https://indonesiabaik.id/infografis/tahapan-dan-jadwal-pemilu-2024&cd=11&hl=en&ct=clnk&gl=us,indonesiabaik.id,indonesiabaik.id was first indexed by Google in January 2016,https://indonesiabaik.id/infografis/tahapan-dan-jadwal-pemilu-2024,secure,https://serpapi.com/searches/64586b2a2c6878dd58daee8c/images/ab05018f01a055f60cb29e1a001bdd82dfeb133a93dfb001cde831978cb2a0af44241a6c44db1aea2db7641e400f2864.png,
3,Pemilihan umum legislatif Indonesia 2024,https://id.wikipedia.org/wiki/Pemilihan_umum_legislatif_Indonesia_2024,https://id.wikipedia.org › wiki › Pe...,,,https://www.google.com/search?q=About+https://id.wikipedia.org/wiki/Pemilihan_umum_legislatif_Indonesia_2024&tbm=ilp&ilps=ADJL0ixgs9bq_Aua6C_8P1_xAkSNLD6Z8Q,https://serpapi.com/search.json?engine=google_about_this_result&google_domain=google.com&ilps=ADJL0ixgs9bq_Aua6C_8P1_xAkSNLD6Z8Q&q=About+https%3A%2F%2Fid.wikipedia.org%2Fwiki%2FPemilihan_umum_legislatif_Indonesia_2024,https://webcache.googleusercontent.com/search?q=cache:6STgYcnf5L4J:https://id.wikipedia.org/wiki/Pemilihan_umum_legislatif_Indonesia_2024&cd=12&hl=en&ct=clnk&gl=us,Wikipedia,"Wikipedia is a multilingual, free, online encyclopedia written and maintained by a community of volunteers, known as Wikipedians, through open collaboration and using a wiki-based editing system called MediaWiki. Wikipedia is the largest and most-read reference work in history.",https://id.wikipedia.org/wiki/Pemilihan_umum_legislatif_Indonesia_2024,secure,https://serpapi.com/searches/64586b2a2c6878dd58daee8c/images/ab05018f01a055f60cb29e1a001bdd82317e2ec145f3911d3836fba85475c89a1e8fccf725f273ee48a37dbce8018172.png,
4,"Sah, Pemilu 14 Februari 2024 Disepakati DPR, Pemerintah ...",https://pekalongankab.bawaslu.go.id/berita/detail/sah-pemilu-14-februari-2024-disepakati-dpr-pemerintah-dan-penyelenggara-pemilu,https://pekalongankab.bawaslu.go.id › ...,"SahabatBawaslu, Bawaslu menghadiri rapat dengar pendapat (RDP) Komisi II DPR RI bersama KPU dan Kementerian Dalam Negeri (Kemendagri) untuk ...",,https://www.google.com/search?q=About+https://pekalongankab.bawaslu.go.id/berita/detail/sah-pemilu-14-februari-2024-disepakati-dpr-pemerintah-dan-penyelenggara-pemilu&tbm=ilp&ilps=ADJL0iycLcLI3XGbAZft-ab8L8OC26rkGg,https://serpapi.com/search.json?engine=google_about_this_result&google_domain=google.com&ilps=ADJL0iycLcLI3XGbAZft-ab8L8OC26rkGg&q=About+https%3A%2F%2Fpekalongankab.bawaslu.go.id%2Fberita%2Fdetail%2Fsah-pemilu-14-februari-2024-disepakati-dpr-pemerintah-dan-penyelenggara-pemilu,https://webcache.googleusercontent.com/search?q=cache:J14CG-H6vbAJ:https://pekalongankab.bawaslu.go.id/berita/detail/sah-pemilu-14-februari-2024-disepakati-dpr-pemerintah-dan-penyelenggara-pemilu&cd=13&hl=en&ct=clnk&gl=us,bawaslu.go.id,The General Election Supervisory Agency is an independent supervisory agency tasked with oversight the administration of general elections throughout Indonesia.,https://pekalongankab.bawaslu.go.id/berita/detail/sah-pemilu-14-februari-2024-disepakati-dpr-pemerintah-dan-penyelenggara-pemilu,secure,https://serpapi.com/searches/64586b2a2c6878dd58daee8c/images/ab05018f01a055f60cb29e1a001bdd82707c48d704f8f4914506747e278eb626769eb0149c4341a64f8c67f8f662d93a.png,"Feb 14, 2024"
5,"Embassy of The Republic of Indonesia, in Washington D.C. ...",https://www.kemlu.go.id/washington/en/pages/pemilihan_umum_2024/5351/etc-menu,https://www.kemlu.go.id › etc-menu,"Sebagai langkah persiapan awal, Panitia Pemilihan Luar Negeri (PPLN) untuk wilayah Washington, D.C. didukung oleh Petugas Pemutakhiran Data Pemilih (Pantarlih) ...","['Pemilihan', 'Pemilih']",https://www.google.com/search?q=About+https://www.kemlu.go.id/washington/en/pages/pemilihan_umum_2024/5351/etc-menu&tbm=ilp&ilps=ADJL0iyFfphTU2LN-xWG7bHs9DlBJ4GyGA,https://serpapi.com/search.json?engine=google_about_this_result&google_domain=google.com&ilps=ADJL0iyFfphTU2LN-xWG7bHs9DlBJ4GyGA&q=About+https%3A%2F%2Fwww.kemlu.go.id%2Fwashington%2Fen%2Fpages%2Fpemilihan_umum_2024%2F5351%2Fetc-menu,https://webcache.googleusercontent.com/search?q=cache:eKBNePF4pMoJ:https://www.kemlu.go.id/washington/en/pages/pemilihan_umum_2024/5351/etc-menu&cd=14&hl=en&ct=clnk&gl=us,kemlu.go.id,"The Ministry of Foreign Affairs of the Republic of Indonesia or commonly known by its abbreviation Kemlu, is an Indonesian government ministry responsible for the country's foreign politics and diplomacy.",https://www.kemlu.go.id/washington/en/pages/pemilihan_umum_2024/5351/etc-menu,secure,https://serpapi.com/searches/64586b2a2c6878dd58daee8c/images/ab05018f01a055f60cb29e1a001bdd8286dcc7b29d948224e0d9bb79c30f58772b19957589680ea9926a75d303ee283c.png,
