position,title,link,displayed_link,snippet,snippet_highlighted_words,about_page_link,about_page_serpapi_link,cached_page_link,source,about_this_result.source.description,about_this_result.source.source_info_link,about_this_result.source.security,about_this_result.source.icon,date
1,tahapan dan jadwal penyelenggaraan pemilu tahun 2024,https://infopemilu.kpu.go.id/Pemilu/Peserta_pemilu,https://infopemilu.kpu.go.id › Pemilu,Penyusunan Peraturan KPU · Pemutakhiran data Pemilih dan penyusunan daftar Pemilih · Pendafatran dan Verifikasi Peserta Pemilu.,['Pemilu'],https://www.google.com/search?q=About+https://infopemilu.kpu.go.id/Pemilu/Peserta_pemilu&tbm=ilp&ilps=ADJL0iwsPHLVZVkB_cs2zjmWpRr9ik0zbQ,https://serpapi.com/search.json?engine=google_about_this_result&google_domain=google.com&ilps=ADJL0iwsPHLVZVkB_cs2zjmWpRr9ik0zbQ&q=About+https%3A%2F%2Finfopemilu.kpu.go.id%2FPemilu%2FPeserta_pemilu,https://webcache.googleusercontent.com/search?q=cache:dCYvYQGZ2B4J:https://infopemilu.kpu.go.id/Pemilu/Peserta_pemilu&cd=6&hl=en&ct=clnk&gl=us,kpu.go.id,"The General Elections Commission is the body that organises elections in Indonesia. Its responsibilities include deciding which parties can contest elections, organising the voting and announcing the results and seats won in the various branches of the government.",https://infopemilu.kpu.go.id/Pemilu/Peserta_pemilu,secure,https://serpapi.com/searches/64586b1af26ac6ae1266b17d/images/cd7c89e97d6bf0a51a657b466cbed190352f1e8e2020da49daa3fa952559c44db25991cb6da99da04847734663969535.png,
2,Tahapan dan Jadwal Pemilu 2024 | Indonesia Baik,https://indonesiabaik.id/infografis/tahapan-dan-jadwal-pemilu-2024,https://indonesiabaik.id › infografis,Indonesiabaik.id - Peraturan Komisi Pemilihan Umum (PKPU) untuk penyelenggaraan Pemilu 2024 telah sah diundangkan melalui PKPU Nomor 3 Tahun 2022.,['Pemilu 2024'],https://www.google.com/search?q=About+https://indonesiabaik.id/infografis/tahapan-dan-jadwal-pemilu-2024&tbm=ilp&ilps=ADJL0iwNe0aoL4iH4eraP1J6oOMVLdKTBQ,https://serpapi.com/search.json?engine=google_about_this_result&google_domain=google.com&ilps=ADJL0iwNe0aoL4iH4eraP1J6oOMVLdKTBQ&q=About+https%3A%2F%2Findonesiabaik.id%2Finfografis%2Ftahapan-dan-jadwal-pemilu-2024,https://webcache.googleusercontent.com/search?q=cache:R9gmNxA_UZEJ:https://indonesiabaik.id/infografis/tahapan-dan-jadwal-pemilu-2024&cd=9&hl=en&ct=clnk&gl=us,indonesiabaik.id,indonesiabaik.id was first indexed by Google in January 2016,https://indonesiabaik.id/infografis/tahapan-dan-jadwal-pemilu-2024,secure,https://serpapi.com/searches/64586b1af26ac6ae1266b17d/images/cd7c89e97d6bf0a51a657b466cbed190139ae48d4b79e39b02470e24432068f6cc9e8ed2e71799bd8283a67c9aefa2ff.png,
3,"Sah, Pemilu 14 Februari 2024 Disepakati DPR, Pemerintah ...",https://pekalongankab.bawaslu.go.id/berita/detail/sah-pemilu-14-februari-2024-disepakati-dpr-pemerintah-dan-penyelenggara-pemilu,https://pekalongankab.bawaslu.go.id › ...,"SahabatBawaslu, Bawaslu menghadiri rapat dengar pendapat (RDP) Komisi II DPR RI bersama KPU dan Kementerian Dalam Negeri (Kemendagri) untuk ...",,https://www.google.com/search?q=About+https://pekalongankab.bawaslu.go.id/berita/detail/sah-pemilu-14-februari-2024-disepakati-dpr-pemerintah-dan-penyelenggara-pemilu&tbm=ilp&ilps=ADJL0iycLcLI3XGbAZft-ab8L8OC26rkGg,https://serpapi.com/search.json?engine=google_about_this_result&google_domain=google.com&ilps=ADJL0iycLcLI3XGbAZft-ab8L8OC26rkGg&q=About+https%3A%2F%2Fpekalongankab.bawaslu.go.id%2Fberita%2Fdetail%2Fsah-pemilu-14-februari-2024-disepakati-dpr-pemerintah-dan-penyelenggara-pemilu,https://webcache.googleusercontent.com/search?q=cache:J14CG-H6vbAJ:https://pekalongankab.bawaslu.go.id/berita/detail/sah-pemilu-14-februari-2024-disepakati-dpr-pemerintah-dan-penyelenggara-pemilu&cd=10&hl=en&ct=clnk&gl=us,bawaslu.go.id,The General Election Supervisory Agency is an independent supervisory agency tasked with oversight the administration of general elections throughout Indonesia.,https://pekalongankab.bawaslu.go.id/berita/detail/sah-pemilu-14-februari-2024-disepakati-dpr-pemerintah-dan-penyelenggara-pemilu,secure,https://serpapi.com/searches/64586b1af26ac6ae1266b17d/images/cd7c89e97d6bf0a51a657b466cbed1904d943a76274e966bfa0c89252a440a3a07d52a68d51121970e19fc9a89d26d91.png,"Feb 14, 2024"
4,"Sambut Pemilu 2024, Berbagai Aspek Perlu Diperhatikan",https://polkam.go.id/sambut-pemilu-2024-berbagai-aspek-perlu-diperhatikan/,https://polkam.go.id › sambut-pemil...,"Hal ini sesuai dengan amanat pada Pasal 434 UU Nomor 7 Tahun 2017 tentang Pemilihan Umum, yang menjelaskan bahwa pemerintah wajib memberikan ...",['Pemilihan Umum'],https://www.google.com/search?q=About+https://polkam.go.id/sambut-pemilu-2024-berbagai-aspek-perlu-diperhatikan/&tbm=ilp&ilps=ADJL0ixjYkcX7G366V0rkcyCAkoBeLa1Jw,https://serpapi.com/search.json?engine=google_about_this_result&google_domain=google.com&ilps=ADJL0ixjYkcX7G366V0rkcyCAkoBeLa1Jw&q=About+https%3A%2F%2Fpolkam.go.id%2Fsambut-pemilu-2024-berbagai-aspek-perlu-diperhatikan%2F,https://webcache.googleusercontent.com/search?q=cache:OfoUXhQctJ8J:https://polkam.go.id/sambut-pemilu-2024-berbagai-aspek-perlu-diperhatikan/&cd=11&hl=en&ct=clnk&gl=us,polkam.go.id,"The Coordinating Ministry for Political, Legal, and Security Affairs is the Indonesian government ministry in charge of the planning and policy co-ordination, as well as synchronisation of policies in the affairs of politics, law, and national security.",https://polkam.go.id/sambut-pemilu-2024-berbagai-aspek-perlu-diperhatikan/,secure,https://serpapi.com/searches/64586b1af26ac6ae1266b17d/images/cd7c89e97d6bf0a51a657b466cbed190ed1cfe718976d46d9de4e66376f49f6659dbab676f31c840457f93c8f8f511a8.png,"Feb 9, 2023"
5,Pemilihan umum legislatif Indonesia 2024,https://id.wikipedia.org/wiki/Pemilihan_umum_legislatif_Indonesia_2024,https://id.wikipedia.org › wiki › Pe...,,,https://www.google.com/search?q=About+https://id.wikipedia.org/wiki/Pemilihan_umum_legislatif_Indonesia_2024&tbm=ilp&ilps=ADJL0ixgs9bq_Aua6C_8P1_xAkSNLD6Z8Q,https://serpapi.com/search.json?engine=google_about_this_result&google_domain=google.com&ilps=ADJL0ixgs9bq_Aua6C_8P1_xAkSNLD6Z8Q&q=About+https%3A%2F%2Fid.wikipedia.org%2Fwiki%2FPemilihan_umum_legislatif_Indonesia_2024,https://webcache.googleusercontent.com/search?q=cache:6STgYcnf5L4J:https://id.wikipedia.org/wiki/Pemilihan_umum_legislatif_Indonesia_2024&cd=12&hl=en&ct=clnk&gl=us,Wikipedia,"Wikipedia is a multilingual, free, online encyclopedia written and maintained by a community of volunteers, known as Wikipedians, through open collaboration and using a wiki-based editing system called MediaWiki. Wikipedia is the largest and most-read reference work in history.",https://id.wikipedia.org/wiki/Pemilihan_umum_legislatif_Indonesia_2024,secure,https://serpapi.com/searches/64586b1af26ac6ae1266b17d/images/cd7c89e97d6bf0a51a657b466cbed190d7175873386ea3e9ba2f8478598d70b4a7a4aeccef580db3c61cf9538bd2cb9a.png,
6,"Hari Ini, Wali Kota Kukuhkan Tim Desk Pemilu 2024",https://ternatekota.go.id/berita/hari-ini-wali-kota-kukuhkan-tim-desk-pemilu-2024,https://ternatekota.go.id › berita › h...,"Rakor digelar di Hotel Sahid Bela dan dihadiri juga oleh Sekretaris Daerah Kota Ternate Dr. Jusuf Sunya, ME, Ketua KPU Kota Ternate M. Zen A.",,https://www.google.com/search?q=About+https://ternatekota.go.id/berita/hari-ini-wali-kota-kukuhkan-tim-desk-pemilu-2024&tbm=ilp&ilps=ADJL0iz0R2Qf27uRdcyUyE_pOd3r8wQYcw,https://serpapi.com/search.json?engine=google_about_this_result&google_domain=google.com&ilps=ADJL0iz0R2Qf27uRdcyUyE_pOd3r8wQYcw&q=About+https%3A%2F%2Fternatekota.go.id%2Fberita%2Fhari-ini-wali-kota-kukuhkan-tim-desk-pemilu-2024,https://webcache.googleusercontent.com/search?q=cache:dkiybTpyTLcJ:https://ternatekota.go.id/berita/hari-ini-wali-kota-kukuhkan-tim-desk-pemilu-2024&cd=13&hl=en&ct=clnk&gl=us,ternatekota.go.id,"Ternate, also known as the City of Ternate, is a city in the Indonesian province of North Maluku and an island in the Maluku Islands. It was the de facto provincial capital of North Maluku before Sofifi on the nearby coast of Halmahera became the capital in 2010.",https://ternatekota.go.id/berita/hari-ini-wali-kota-kukuhkan-tim-desk-pemilu-2024,secure,https://serpapi.com/searches/64586b1af26ac6ae1266b17d/images/cd7c89e97d6bf0a51a657b466cbed1901d80b1b498e32d250cc53c4a953171f335df0e32f0011d4056923c6b68b86b6e.png,"Apr 12, 2023"
7,Berita dan Informasi Pemilu 2024 Terkini dan Terbaru Hari ini,https://www.detik.com/tag/pemilu-2024,https://www.detik.com › tag › pemil...,Suhu politik di Kabupaten Subang mulai menghangat menjelang Pilkada serentak 2024 mendatang. Parpol di Subang mulai siapkan jurus demi merebut kursi Bupati.,['2024'],https://www.google.com/search?q=About+https://www.detik.com/tag/pemilu-2024&tbm=ilp&ilps=ADJL0izsO37r2Lgph62YnJuvjvUqYTS4SQ,https://serpapi.com/search.json?engine=google_about_this_result&google_domain=google.com&ilps=ADJL0izsO37r2Lgph62YnJuvjvUqYTS4SQ&q=About+https%3A%2F%2Fwww.detik.com%2Ftag%2Fpemilu-2024,https://webcache.googleusercontent.com/search?q=cache:aSEw_k5NrPkJ:https://www.detik.com/tag/pemilu-2024&cd=14&hl=en&ct=clnk&gl=us,detik.com,Detikcom is an Indonesian digital media company owned by CT Corp subsidiary Trans Media. Detikcom is an online news portal and publishes breaking news. The portal is consistently ranked among Indonesia's 10 most-visited websites and is among the top 250 in the world.,https://www.detik.com/tag/pemilu-2024,secure,https://serpapi.com/searches/64586b1af26ac6ae1266b17d/images/cd7c89e97d6bf0a51a657b466cbed190c90b6883fd82a2d513430c171be6da328f083d41289af39d62a0da59a1d91e61.png,
8,SPJ PPS Pemilu 2024 - YouTube,https://www.youtube.com/watch?v=2UbRFqP05TU,https://www.youtube.com › watch,"SPJ PPS Pemilu 2024. Watch later. Share. Copy link. Info. Shopping. Tap to unmute. If playback doesn't begin shortly, try restarting your ...",,https://www.google.com/search?q=About+https://www.youtube.com/watch?v%3D2UbRFqP05TU&tbm=ilp&ilps=ADJL0iyxhJNv6HJZzRxqmoopEe0E9X644A,https://serpapi.com/search.json?engine=google_about_this_result&google_domain=google.com&ilps=ADJL0iyxhJNv6HJZzRxqmoopEe0E9X644A&q=About+https%3A%2F%2Fwww.youtube.com%2Fwatch%3Fv%3D2UbRFqP05TU,,YouTube,This result comes from www.youtube.com,https://www.youtube.com/watch?v=2UbRFqP05TU,secure,https://serpapi.com/searches/64586b1af26ac6ae1266b17d/images/cd7c89e97d6bf0a51a657b466cbed19015d70be958da8366fe98132746a6ae042e9b585bd743f514bfc7a1836280f2e8.png,
9,Mendiskusikan Tantangan dan Peran Angkatan Muda di ...,https://ugm.ac.id/id/berita/23646-mendiskusikan-tantangan-dan-peran-angkatan-muda-di-pemilu-2024,https://ugm.ac.id › berita › 23646-...,"Angkatan muda akan turut meramaikan pesta demokrasi Indonesia 2024. Banyaknya persebaran hoaks, disinformasi, dan misinformasi menjadi ...",['2024'],https://www.google.com/search?q=About+https://ugm.ac.id/id/berita/23646-mendiskusikan-tantangan-dan-peran-angkatan-muda-di-pemilu-2024&tbm=ilp&ilps=ADJL0iwi2ojg_nbe_D4ftRIO7Vezex3XoA,https://serpapi.com/search.json?engine=google_about_this_result&google_domain=google.com&ilps=ADJL0iwi2ojg_nbe_D4ftRIO7Vezex3XoA&q=About+https%3A%2F%2Fugm.ac.id%2Fid%2Fberita%2F23646-mendiskusikan-tantangan-dan-peran-angkatan-muda-di-pemilu-2024,https://webcache.googleusercontent.com/search?q=cache:UOv5Q5UbsOYJ:https://ugm.ac.id/id/berita/23646-mendiskusikan-tantangan-dan-peran-angkatan-muda-di-pemilu-2024&cd=16&hl=en&ct=clnk&gl=us,ugm.ac.id,"Gadjah Mada University is a public research university located in Sleman, Special Region of Yogyakarta, Indonesia. Officially founded on 19 December 1949, Gadjah Mada University is one of the oldest and largest institutions of higher education in the country.",https://ugm.ac.id/id/berita/23646-mendiskusikan-tantangan-dan-peran-angkatan-muda-di-pemilu-2024,secure,https://serpapi.com/searches/64586b1af26ac6ae1266b17d/images/cd7c89e97d6bf0a51a657b466cbed1901583303ee057b10934fe9a7187ccbeb32e7d683660eb377d4ae893c0aa5a28f5.png,"Apr 13, 2023"
10,Peraturan KPU No.3 Th 2022 Tentang Tahapan dan Jadwal ...,https://ppid.lampungprov.go.id/detail-dokumen/Peraturan-KPU-No-3-Th-2022-Tentang-Tahapan-dan-Jadwal-Penyelenggaraan-Pemilu-Th-2024,https://ppid.lampungprov.go.id › Pe...,Peraturan KPU No.3 Th 2022 Tentang Tahapan dan Jadwal Penyelenggaraan Pemilihan Umum Tahun 2024.,"['Pemilihan Umum', '2024']",https://www.google.com/search?q=About+https://ppid.lampungprov.go.id/detail-dokumen/Peraturan-KPU-No-3-Th-2022-Tentang-Tahapan-dan-Jadwal-Penyelenggaraan-Pemilu-Th-2024&tbm=ilp&ilps=ADJL0iyrzRBfI6troBNy5ePYBfa2Cfuh2Q,https://serpapi.com/search.json?engine=google_about_this_result&google_domain=google.com&ilps=ADJL0iyrzRBfI6troBNy5ePYBfa2Cfuh2Q&q=About+https%3A%2F%2Fppid.lampungprov.go.id%2Fdetail-dokumen%2FPeraturan-KPU-No-3-Th-2022-Tentang-Tahapan-dan-Jadwal-Penyelenggaraan-Pemilu-Th-2024,https://webcache.googleusercontent.com/search?q=cache:akH6QOuXXmMJ:https://ppid.lampungprov.go.id/detail-dokumen/Peraturan-KPU-No-3-Th-2022-Tentang-Tahapan-dan-Jadwal-Penyelenggaraan-Pemilu-Th-2024&cd=17&hl=en&ct=clnk&gl=us,lampungprov.go.id,"Lampung, officially the Province of Lampung, is a province of Indonesia. It is located on the southern tip of the island of Sumatra. It has a short border with the province of Bengkulu to the northwest, and a longer border with the province of South Sumatra to the north.",https://ppid.lampungprov.go.id/detail-dokumen/Peraturan-KPU-No-3-Th-2022-Tentang-Tahapan-dan-Jadwal-Penyelenggaraan-Pemilu-Th-2024,secure,https://serpapi.com/searches/64586b1af26ac6ae1266b17d/images/cd7c89e97d6bf0a51a657b466cbed19074ccd00df352b71394f9933edcbae0464425cee9c4228337d3939b5612900fd2.png,
1,Pemilihan umum Presiden Indonesia 2024,https://id.wikipedia.org/wiki/Pemilihan_umum_Presiden_Indonesia_2024,https://id.wikipedia.org › wiki › Pe...,Pasangan calon Presiden dan Wakil Presiden diusulkan oleh partai politik atau gabungan partai politik yang memperoleh sedikitnya 20% kursi Dewan Perwakilan ...,,https://www.google.com/search?q=About+https://id.wikipedia.org/wiki/Pemilihan_umum_Presiden_Indonesia_2024&tbm=ilp&ilps=ADJL0iwdD63UDqnFE4XqVeOQ2m25aCi3sw,https://serpapi.com/search.json?engine=google_about_this_result&google_domain=google.com&ilps=ADJL0iwdD63UDqnFE4XqVeOQ2m25aCi3sw&q=About+https%3A%2F%2Fid.wikipedia.org%2Fwiki%2FPemilihan_umum_Presiden_Indonesia_2024,https://webcache.googleusercontent.com/search?q=cache:QDDruJDY37UJ:https://id.wikipedia.org/wiki/Pemilihan_umum_Presiden_Indonesia_2024&cd=3&hl=en&ct=clnk&gl=us,Wikipedia,"Wikipedia is a multilingual, free, online encyclopedia written and maintained by a community of volunteers, known as Wikipedians, through open collaboration and using a wiki-based editing system called MediaWiki. Wikipedia is the largest and most-read reference work in history.",https://id.wikipedia.org/wiki/Pemilihan_umum_Presiden_Indonesia_2024,secure,https://serpapi.com/searches/64586b208cd87859f9a5fb79/images/05e6b41710c6ead1295f3183bd21f91cdf194fbddc44ddee7b938f72423caeae20bf01b8a8b98dfba922eeffd266e411.png,
2,Berita Harian Pilpres 2024,https://www.cnnindonesia.com/tag/pilpres-2024,https://www.cnnindonesia.com › tag,Pemilihan Umum Presiden Indonesia 2024 adalah sebuah proses demokrasi untuk memilih Presiden dan Wakil Presiden Republik Indonesia untuk masa bakti 2024–2029.,"['2024', '2024']",https://www.google.com/search?q=About+https://www.cnnindonesia.com/tag/pilpres-2024&tbm=ilp&ilps=ADJL0ix5aXiYvfEQ1drhLLKZZ197z2Dh6g,https://serpapi.com/search.json?engine=google_about_this_result&google_domain=google.com&ilps=ADJL0ix5aXiYvfEQ1drhLLKZZ197z2Dh6g&q=About+https%3A%2F%2Fwww.cnnindonesia.com%2Ftag%2Fpilpres-2024,https://webcache.googleusercontent.com/search?q=cache:-OnwQIynSUUJ:https://www.cnnindonesia.com/tag/pilpres-2024&cd=4&hl=en&ct=clnk&gl=us,cnnindonesia.com,Cable News Network Indonesia is a 24-hour Indonesian free-to-air television news channel owned by Trans Media in collaboration with Warner Bros. Discovery under CNN license.,https://www.cnnindonesia.com/tag/pilpres-2024,secure,https://serpapi.com/searches/64586b208cd87859f9a5fb79/images/05e6b41710c6ead1295f3183bd21f91c2b43b380cc74f372c01ff833333dee846bca4ad960b46368b32d2d3d854e49cb.png,12 hours ago
3,Berita Pilpres 2024 Terkini dan Terbaru Hari Ini,https://www.sindonews.com/topic/3627/pilpres-2024,https://www.sindonews.com › topic,Berita Pilpres 2024 terkini - Demokrat: SBY Tak Pernah Kumpulkan Parpol Pendukung di Istana Negara untuk Bentuk Koalisi. Sandiaga Uno Puji PKS Berjuang ...,['Pilpres 2024'],https://www.google.com/search?q=About+https://www.sindonews.com/topic/3627/pilpres-2024&tbm=ilp&ilps=ADJL0ixBQZeyr8813JPLDZ6bUT8QqAB6WQ,https://serpapi.com/search.json?engine=google_about_this_result&google_domain=google.com&ilps=ADJL0ixBQZeyr8813JPLDZ6bUT8QqAB6WQ&q=About+https%3A%2F%2Fwww.sindonews.com%2Ftopic%2F3627%2Fpilpres-2024,https://webcache.googleusercontent.com/search?q=cache:NmkxqjmchL8J:https://www.sindonews.com/topic/3627/pilpres-2024&cd=9&hl=en&ct=clnk&gl=us,sindonews.com,sindonews.com was first indexed by Google more than 10 years ago,https://www.sindonews.com/topic/3627/pilpres-2024,secure,https://serpapi.com/searches/64586b208cd87859f9a5fb79/images/05e6b41710c6ead1295f3183bd21f91cd908ed6efc60956abce428255314c3a24973b3b527f836549eb639c83808797c.png,11 hours ago
4,Berita dan Informasi Pilpres 2024 Terkini dan Terbaru Hari ini,https://www.detik.com/tag/pilpres-2024,https://www.detik.com › tag › pilpr...,Sandiaga mengungkap bahwa komunikasinya dengan PKS tetap intens usai memuji PKS.,,https://www.google.com/search?q=About+https://www.detik.com/tag/pilpres-2024&tbm=ilp&ilps=ADJL0izXZVFYlIG8q1hGSnAZ-QqJVzTobw,https://serpapi.com/search.json?engine=google_about_this_result&google_domain=google.com&ilps=ADJL0izXZVFYlIG8q1hGSnAZ-QqJVzTobw&q=About+https%3A%2F%2Fwww.detik.com%2Ftag%2Fpilpres-2024,https://webcache.googleusercontent.com/search?q=cache:kSuJBwwc58UJ:https://www.detik.com/tag/pilpres-2024&cd=10&hl=en&ct=clnk&gl=us,detik.com,Detikcom is an Indonesian digital media company owned by CT Corp subsidiary Trans Media. Detikcom is an online news portal and publishes breaking news. The portal is consistently ranked among Indonesia's 10 most-visited websites and is among the top 250 in the world.,https://www.detik.com/tag/pilpres-2024,secure,https://serpapi.com/searches/64586b208cd87859f9a5fb79/images/05e6b41710c6ead1295f3183bd21f91c3863622449d077565d2c8efb87e665cc8f4d00d39c652d5a8d175a7eea0e51f7.png,11 hours ago
5,Berita Pilpres 2024 Hari Ini - Kabar Terbaru Terkini,https://www.liputan6.com/tag/pilpres-2024,https://www.liputan6.com › tag › pi...,Bakal calon presiden atau capres PDI Perjuangan (PDIP) Ganjar Pranowo mengungkapkan kriteria wajib untuk bakal calon wakil presiden (cawapres) yang akan ...,,https://www.google.com/search?q=About+https://www.liputan6.com/tag/pilpres-2024&tbm=ilp&ilps=ADJL0izw23iECpFVSx7FURRz5ZOI13EGgA,https://serpapi.com/search.json?engine=google_about_this_result&google_domain=google.com&ilps=ADJL0izw23iECpFVSx7FURRz5ZOI13EGgA&q=About+https%3A%2F%2Fwww.liputan6.com%2Ftag%2Fpilpres-2024,https://webcache.googleusercontent.com/search?q=cache:J5p-sjq0uFwJ:https://www.liputan6.com/tag/pilpres-2024&cd=11&hl=en&ct=clnk&gl=us,liputan6.com,"Liputan 6 is an Indonesian television news program that broadcasts on SCTV. Its slogan is Aktual, Tajam, dan Terpercaya.
The first program, Liputan 6 Petang was launched on May 20, 1996, by the first news anchored, Riza Primadi.
Liputan 6 also has an online news portal.",https://www.liputan6.com/tag/pilpres-2024,secure,https://serpapi.com/searches/64586b208cd87859f9a5fb79/images/05e6b41710c6ead1295f3183bd21f91c7e65e87c5e1661918486dd9be0f60547cca3038b9bc33736cfbd21ecacb0c478.png,
6,pilpres 2024,https://www.kompas.id/label/pilpres-2024,https://www.kompas.id › label › pil...,"pilpres 2024 · Deklarasi Relawan Amanat Indonesia · Menyapa Warga Jember, Ganjar: Banyak Hoaks, Jaga Kekompakan · Temui Jusuf Kalla, Cak Imin Bahas Koalisi Besar ...",['pilpres 2024'],https://www.google.com/search?q=About+https://www.kompas.id/label/pilpres-2024&tbm=ilp&ilps=ADJL0izrh7kZczj2VxaP0qRZvWH4SCsUgg,https://serpapi.com/search.json?engine=google_about_this_result&google_domain=google.com&ilps=ADJL0izrh7kZczj2VxaP0qRZvWH4SCsUgg&q=About+https%3A%2F%2Fwww.kompas.id%2Flabel%2Fpilpres-2024,https://webcache.googleusercontent.com/search?q=cache:6Y27p_x1EC0J:https://www.kompas.id/label/pilpres-2024&cd=12&hl=en&ct=clnk&gl=us,kompas.id,"Kompas is an Indonesian national newspaper from Jakarta which was founded on 28 June 1965. The paper is published by PT Kompas Media Nusantara, which is a part of Kompas Gramedia Group. Its head office is located at the Kompas Multimedia Towers, Tanah Abang, Central Jakarta.",https://www.kompas.id/label/pilpres-2024,secure,https://serpapi.com/searches/64586b208cd87859f9a5fb79/images/05e6b41710c6ead1295f3183bd21f91c2aca305d2e0e5fe5b17bb31d8c3dba1fa39755e8699bf8e37954380ca212ae81.png,4 days ago
7,Combating Disinformation: Pilpres 2024 and the Youth,https://stratsea.com/combating-disinformation-pilpres-2024-and-the-youth/,https://stratsea.com › combating-disinformation-pilpre...,Indonesian youths spend much of their time on their phones. Credit: Unsplash/Sanket Mishra. Introduction. The Indonesian politics has once ...,,https://www.google.com/search?q=About+https://stratsea.com/combating-disinformation-pilpres-2024-and-the-youth/&tbm=ilp&ilps=ADJL0iywM6QiiGnUeDlYZ5OC-zGtw0eo0w,https://serpapi.com/search.json?engine=google_about_this_result&google_domain=google.com&ilps=ADJL0iywM6QiiGnUeDlYZ5OC-zGtw0eo0w&q=About+https%3A%2F%2Fstratsea.com%2Fcombating-disinformation-pilpres-2024-and-the-youth%2F,https://webcache.googleusercontent.com/search?q=cache:XKYkTArrRt4J:https://stratsea.com/combating-disinformation-pilpres-2024-and-the-youth/&cd=24&hl=en&ct=clnk&gl=us,Stratsea,stratsea.com was first indexed by Google more than 10 years ago,https://stratsea.com/combating-disinformation-pilpres-2024-and-the-youth/,secure,https://serpapi.com/searches/64586b208cd87859f9a5fb79/images/05e6b41710c6ead1295f3183bd21f91c2a1634d2d334e6186bb92612d9b592b1170ef057ba5b3c309e65bd918675005b.png,"Apr 11, 2023"
1,Pemilihan umum legislatif Indonesia 2024,https://id.wikipedia.org/wiki/Pemilihan_umum_legislatif_Indonesia_2024,https://id.wikipedia.org › wiki › Pe...,,,https://www.google.com/search?q=About+https://id.wikipedia.org/wiki/Pemilihan_umum_legislatif_Indonesia_2024&tbm=ilp&ilps=ADJL0ixgs9bq_Aua6C_8P1_xAkSNLD6Z8Q,https://serpapi.com/search.json?engine=google_about_this_result&google_domain=google.com&ilps=ADJL0ixgs9bq_Aua6C_8P1_xAkSNLD6Z8Q&q=About+https%3A%2F%2Fid.wikipedia.org%2Fwiki%2FPemilihan_umum_legislatif_Indonesia_2024,https://webcache.googleusercontent.com/search?q=cache:6STgYcnf5L4J:https://id.wikipedia.org/wiki/Pemilihan_umum_legislatif_Indonesia_2024&cd=5&hl=en&ct=clnk&gl=us,Wikipedia,"Wikipedia is a multilingual, free, online encyclopedia written and maintained by a community of volunteers, known as Wikipedians, through open collaboration and using a wiki-based editing system called MediaWiki. Wikipedia is the largest and most-read reference work in history.",https://id.wikipedia.org/wiki/Pemilihan_umum_legislatif_Indonesia_2024,secure,https://serpapi.com/searches/64586b2237b24a761da8915e/images/2c01f2720a1110b66100d88e4ee6a5c8c024a2bbfc217f5ca4a420193649500b4ec7a2af71a61c1cbb068cc1db7afd58.png,
2,tahapan dan jadwal penyelenggaraan pemilu tahun 2024,https://infopemilu.kpu.go.id/Pemilu/Peserta_pemilu,https://infopemilu.kpu.go.id › Pemilu,Penyusunan Peraturan KPU · Pemutakhiran data Pemilih dan penyusunan daftar Pemilih · Pendafatran dan Verifikasi Peserta Pemilu.,,https://www.google.com/search?q=About+https://infopemilu.kpu.go.id/Pemilu/Peserta_pemilu&tbm=ilp&ilps=ADJL0iwsPHLVZVkB_cs2zjmWpRr9ik0zbQ,https://serpapi.com/search.json?engine=google_about_this_result&google_domain=google.com&ilps=ADJL0iwsPHLVZVkB_cs2zjmWpRr9ik0zbQ&q=About+https%3A%2F%2Finfopemilu.kpu.go.id%2FPemilu%2FPeserta_pemilu,https://webcache.googleusercontent.com/search?q=cache:dCYvYQGZ2B4J:https://infopemilu.kpu.go.id/Pemilu/Peserta_pemilu&cd=8&hl=en&ct=clnk&gl=us,kpu.go.id,"The General Elections Commission is the body that organises elections in Indonesia. Its responsibilities include deciding which parties can contest elections, organising the voting and announcing the results and seats won in the various branches of the government.",https://infopemilu.kpu.go.id/Pemilu/Peserta_pemilu,secure,https://serpapi.com/searches/64586b2237b24a761da8915e/images/2c01f2720a1110b66100d88e4ee6a5c80290081aecd9429e879ff2d683c3b801a77677d940376a4786e96b6ef33fbf52.png,
