,Date,User,Tweet
843,2022-10-31 08:03:10+00:00,PerumPerhutani,Perhutani Raih Penghargaan Berkat Pengelolaan Hutan Berkelanjutan https://t.co/KaXOhlUxia
844,2022-10-31 07:51:38+00:00,PerumPerhutani,Perhutani Bogor Melaksanakan Sosialisasi Pembayaran Cashless Managemen System Penyadapan Getah Pinus https://t.co/HHlnGmyrCP
845,2022-10-31 07:44:13+00:00,PerumPerhutani,Kawasan Pegunungan Serayu Utara Ditanami Seribu Pohon https://t.co/ymtZFPYHWs
846,2022-10-31 07:39:41+00:00,PerumPerhutani,"Hutan Pinus Kalilo: Daya Tarik, Harga Tiket, Jam Buka, dan Rute https://t.co/sldcw8S1Jh"
847,2022-10-31 07:39:35+00:00,PerumPerhutani,Perhutani Berikan Bantuan Renovasi RUTILAHU Kepada Penyadap Getah Pinus Di Majalengka https://t.co/xiy5TsKss4
848,2022-10-31 07:34:31+00:00,PerumPerhutani,Perhutani Tandatangani Perpanjangan PKS Menara Tower Dengan PT Solusi Menara Indonesia di Kuningan https://t.co/4vhFD4t7LT
849,2022-10-31 07:24:19+00:00,PerumPerhutani,Pesona Curug Tujuh Wisata Perhutani KPH Ciamis Diminati Wisatawan Asing https://t.co/U9ROO7CVKn
850,2022-10-31 07:24:10+00:00,PerumPerhutani,Perhutani Raih Penghargaan Berkat Pengelolaan Hutan Berkelanjutan https://t.co/MzP8nO1Uyj
851,2022-10-31 07:18:27+00:00,PerumPerhutani,Perhutani Kuningan Berikan Santunan Kepada Keluarga Almarhum Arif Mandor Tanam https://t.co/AAvf8BNhoL
852,2022-10-31 06:56:41+00:00,PerumPerhutani,Perhutani Salurkan Bantuan Dana TJSL Kepada Yayasan Pendidikan dan Obyek Wisata Di Indramayu https://t.co/WpliDbk3bd
853,2022-10-31 04:55:51+00:00,PerumPerhutani,Perhutani Sosialisasikan Tanaman Agroforestry Jagung Kepada Pengurus LMDH di Linduk dan Jatipohon https://t.co/AwJF84Vkid
854,2022-10-31 04:45:07+00:00,PerumPerhutani,Perhutani Gelar Penanaman Perdana Tebu ATM Tahun 2022 di Balapulang Bersama Stakeholder https://t.co/zT48QH3faT
855,2022-10-31 04:33:32+00:00,PerumPerhutani,Perhutani Adakan Sosialisasi dan Diskusi Agroforestri Bersama Kejari Sragen https://t.co/VesInZoJwU
856,2022-10-31 04:01:24+00:00,PerumPerhutani,Perhutani Salurkan Bantuan Sembako pada Warga Terdampak Bencana Tanah Longsor https://t.co/IN0I4eJKyz
857,2022-10-31 03:58:33+00:00,PerumPerhutani,Perhutani Berikan Santunan Untuk Mitra Kerja Penyadap di Pekalongan Timur https://t.co/CgB1AvidfD
858,2022-10-31 03:21:19+00:00,PerumPerhutani,Perhutani Kuningan Ajak Fakultas Kehutanan dan Lingkungan UNIKU Gelar Pelatihan Chainsaw dan Angkat Beban https://t.co/nw5y3N8MoD
859,2022-10-31 03:05:30+00:00,PerumPerhutani,"Perhutani Ciamis Peduli, Serahkan Bantuan Sembako Kepada Korban Banjir Di Kecamatan Pamarican https://t.co/E4JvyQ6Qn2"
860,2022-10-31 02:59:05+00:00,PerumPerhutani,"Perhutani Hadiri Penanaman Demplot Budidaya Jagung, Penerapan Teknologi Irigasi Tetes dan Sprinkle yang diadakan oleh PT. Agron Persada Indonesia di Banten https://t.co/LW3gESko1E"
861,2022-10-31 02:36:58+00:00,PerumPerhutani,Perhutani Gandeng Komunitas Trail Lakukan Aksi Tanam Bibit Pohon Bersama https://t.co/jdMZf7sxoV
862,2022-10-28 09:16:56+00:00,PerumPerhutani,Perhutani Bersama Dinas Koperasi Lakukan Pelatihan Bersama “Fasilitasi Kemitraan” https://t.co/osFvzirMMF
863,2022-10-28 08:33:28+00:00,PerumPerhutani,Perhutani Dukung BPKH XI Sosialisasi Penyelesaian Penguasaan Tanah pada Kawasan Hutan oleh Masyarakat https://t.co/Aa37vROYTs
864,2022-10-28 08:10:06+00:00,PerumPerhutani,"Hijaukan Alam, Perhutani Ajak Wisatawan Melakukan Penanaman Pohon di Ranupakis Lumajang https://t.co/iR2NnAkxhF"
865,2022-10-28 07:44:02+00:00,PerumPerhutani,"Perhutani Ajak Wisatawan, Melakukan Penanaman Pohon di Area Wisata Ranupakis Lumajang https://t.co/YTy92SqgjY"
866,2022-10-28 07:40:28+00:00,PerumPerhutani,"Sukses Kelola Hutan Berkelanjutan, Perhutani Raih Penghargaan BUMN Awards 2022 https://t.co/dKArLkmPU4"
867,2022-10-28 07:36:02+00:00,PerumPerhutani,Ternyata Ini Penyebab Perhutani Raih Penghargaan 4th Anniversary BUMN Awards 2022 https://t.co/7tukILCtnr
868,2022-10-28 07:26:43+00:00,PerumPerhutani,Perhutani Kediri Peduli Bencana Trenggalek https://t.co/yvFJC2UkYI
869,2022-10-28 03:54:39+00:00,PerumPerhutani,Perhutani Bersama Dina PU Bahas Penataan Ruang Wilayah Kab. Madiun https://t.co/1HkSDi9rCY
870,2022-10-28 03:26:23+00:00,PerumPerhutani,"Refleksikan Semangat Sumpah Pemuda, Perhutani Bersama Forkopincam Ngimbang Gelar Apel Siaga https://t.co/Kx1GiQRizQ"
871,2022-10-28 02:47:08+00:00,PerumPerhutani,Perhutani Dukung Dishut Jatim Gelar Rakor Penggunaan Kawasan Hutan https://t.co/dAtNPiaSAI
872,2022-10-28 02:29:43+00:00,bumn_jkt_intgrs,"Hello, Sobat BUMN!

@PerumPerhutani melalui Inhutani I lakukan pelepasan ekspor produk industri kayu sebanyak 2 Full Container Load (FCL) bervolume 42,72 m3 ke Australia dan Jepang, bertempat di Pabrik Industri Kayu PT Inhutani I di Gresik.

#IndustriKayuPerhutaniGroup https://t.co/bTj4PM8PjF"
873,2022-10-28 02:28:12+00:00,BUMN_Integritas,"Hello, Sobat BUMN!

@PerumPerhutani melalui Inhutani I lakukan pelepasan ekspor produk industri kayu sebanyak 2 Full Container Load (FCL) bervolume 42,72 m3 ke Australia dan Jepang, bertempat di Pabrik Industri Kayu PT Inhutani I di Gresik.

#IndustriKayuPerhutaniGroup https://t.co/1szD9B0J30"
874,2022-10-28 02:13:19+00:00,PerumPerhutani,"Perhutani Kediri Serahkan Sharing Produksi Kayu Dan Getah Rp. 3,1 Milyar Kepada LMDH https://t.co/8UEC0Bqpzr"
875,2022-10-28 01:43:18+00:00,PerumPerhutani,"Tanggap Bencana, Perhutani Dirikan Posko Bersama Muspicam Bluluk di Lamongan https://t.co/uhhMIGS4U1"
876,2022-10-28 01:19:43+00:00,KoranBUMN,Perhutani Tasikmalaya dan Pertamina Geothermal Energi Tandatangani MOU Pengelolaan Resiko Dan Perlindungan Hutan https://t.co/0fZoDkxr8X @PerumPerhutani @pertamina @KementerianESDM https://t.co/AsjcyLFdzN
877,2022-10-28 01:15:07+00:00,PerumPerhutani,Perhutani Pasuruan Salurkan Bantuan Dana TJSL kepada Pengurus Madrasah Diniyah Annindlomiyah https://t.co/4IWxW72iCL
878,2022-10-28 01:06:33+00:00,PerumPerhutani,Perhutani Raih Penghargaan 4th Anniversary BUMN Awards 2022 https://t.co/8VLrqvL9ny
879,2022-10-28 00:22:23+00:00,PerumPerhutani,"Perhutani Lawu Ds Bersama Tim TRC, BPBD Ponorogo Cepat Atasi Bekas Tanah Longsor di Jalur Wisata Ngebel https://t.co/KtljQaSJLR"
880,2022-10-28 00:12:43+00:00,PerumPerhutani,"KPH Jatirogo Peduli Pendidikan, Salurkan Dana TJSL kepada TK Tunas Rimba https://t.co/rpFKHLxwBi"
881,2022-10-27 22:54:40+00:00,PerumPerhutani,"Sukseskan swasembada gula, Perhutani tanam perdana dengan PTPN X di Lamongan https://t.co/79So89oul3"
882,2022-10-27 13:36:32+00:00,PerumPerhutani,"Perkuat Sinergitas, Perhutani Terima Kunjungan Kerja CDK dan BKSDA di Pamekasan https://t.co/me7tdxE8KP"
883,2022-10-27 13:15:59+00:00,PerumPerhutani,Perhutani Bersama Stakeholders Dukung Percepatan Pembangunan Jalan Pantai Selatan https://t.co/s9w695G0It
884,2022-10-27 12:14:42+00:00,PerumPerhutani,"Perhutani, Polri Sosialisasikan Tata Kelola Hutan https://t.co/TzimmGdrG6"
885,2022-10-27 11:41:35+00:00,PerumPerhutani,Perhutani Tuban Berpartisipasi dalam Apel Siaga Penanggulangan Bencana Alam https://t.co/bVSniJJLEM
886,2022-10-27 10:31:32+00:00,PerumPerhutani,"Perhutani Bersama Forkopimda Jombang, Gelar Apel Siaga Antisipasi Bencana Alam https://t.co/PivzaPxeMx"
887,2022-10-27 09:21:58+00:00,PerumPerhutani,Perhutani Parengan Bersama Stakeholders Sosialisasikan Pupuk bagi Petani Hutan https://t.co/hkWkeqQD1N
888,2022-10-27 08:33:47+00:00,PerumPerhutani,Perhutani Lawu Ds Teken Perpanjangan Kerjasama Kelola Wisata dengan Tiga Lembaga https://t.co/YhcGpRuS1O
889,2022-10-27 07:20:03+00:00,dad_somantri,"Mengenal dan panen Kacang Sacha Inchi bersama LMDH di lahan perhutanan sosial (Kulin KK) desa Banyurip, Jenar @sragenkab 
@Biroisdajateng @dlhkprovjateng @PerumPerhutani @KementerianLHK @ganjarpranowo
""Nggayuh Mukti Sinambi Njogo Alase Lestar""
https://t.co/f300x2SMJ3. https://t.co/W6GWJihC0Z"
890,2022-10-27 06:41:53+00:00,PerumPerhutani,Perhutani Jombang Teken PKS dengan Manajemen PT Bank Syariah Indonesia https://t.co/cEBhxRpmN2
891,2022-10-27 05:18:09+00:00,PerumPerhutani,"Tingkatkan Hubungan dengan Media, Perhutani hadiri HUT Sekilas Media Bersama Forkompida https://t.co/xm2pszwSRT"
892,2022-10-27 03:57:25+00:00,PerumPerhutani,Perhutani Jatirogo Fasilitasi Studi Banding Penyulingan MKP https://t.co/S5vg8eTJ5J
893,2022-10-27 01:53:03+00:00,PerumPerhutani,"Pemkab Trenggalek Terima bagi Hasil Getah Pinus Perhutani Rp1,2 M https://t.co/dXXHnZMH2q"
894,2022-10-27 01:48:08+00:00,PerumPerhutani,CV. Lang Buana Apresiasi dan Sambut Kedatangan Perhutani dalam Program Agroforestry Tebu Mandiri https://t.co/4zpF741VuJ
895,2022-10-27 01:43:55+00:00,PerumPerhutani,Perhutani Bersama Komunitas Motor Trail Adakan Penanaman Pohon di Klaten https://t.co/krXmEUeclX
896,2022-10-27 00:53:52+00:00,PerumPerhutani,Perhutani Dukung Penelitian Tentang Penerapan Keadilan Restoratif Justice Sesuai Perpol No 8 Tahun 2021 Di Polres Temanggung https://t.co/z8tRFVocr8
897,2022-10-27 00:44:09+00:00,PerumPerhutani,Perhutani Adakan Sarasehan Tanggap Bencana Alam Bersama Stakeholder di Karanganyar https://t.co/f5N02I1rqf
898,2022-10-26 10:27:59+00:00,donymaya,Punya rumah berjarak 1 km dari TPK Banjarejo di wilayah @PerumPerhutani kph ngawi yang tahun ini memiliki produksi kayu 41.000 m3 dan kayu tebangan kering 17.000m3 tapi bawa pulang kayu yang gak terjual di 2021.... @BintangEmonSC3 ama @saya_caklontong pasti kalah lucu😂😂😂 https://t.co/hCnCaZ9vu8
899,2022-10-26 10:18:04+00:00,donymaya,Kita masyarakat desa bukanya ga mampu beli kayu bagus hingga hanya mengelola kayu sampah.... Kompetisi dengan pabrikan besar yang ga kuat boss mereka lebih mendapat fasilitas 😄😄saran kak @tokoperhutani @erickthohir @SitiNurbayaLHK @PerumPerhutani @budimandjatmiko https://t.co/Q9On21XBAZ
900,2022-10-26 08:21:23+00:00,PerumPerhutani,Inhutani I Sukseskan Gerakan Revolusi Hijau Di Pulau Laut https://t.co/Fj8DARWPZu
901,2022-10-26 06:31:50+00:00,PerumPerhutani,Inhutani I Lakukan Penyuluhan Lingkungan Kepada Pelajar di Pulau Laut https://t.co/1YowDz4ZlR
902,2022-10-26 02:48:38+00:00,PerumPerhutani,Perhutani Salurkan Bantuan TJSL Ke TK Tunas Rimba II Medang Mantingan https://t.co/ElgYarklK0
903,2022-10-26 02:29:37+00:00,PerumPerhutani,Perhutani Sosialisasikan Tanaman Agroforestry Jagung Kepada Pengurus LMDH di Sambirejo dan Pojok https://t.co/4PT2VQYfJr
904,2022-10-26 00:33:57+00:00,PerumPerhutani,Perhutani Gelar Audit ISO 9001:2015 di Banyumas Barat https://t.co/Uh4WUTvo6G
905,2022-10-26 00:27:33+00:00,PerumPerhutani,Perhutani Bersama Komunitas Motor Trail Adakan Penanaman Bersama Di Kabupaten Klaten https://t.co/FGvFesIV9o
906,2022-10-25 23:25:55+00:00,PerumPerhutani,Kunjungan Menteri Koperasi Dan UKM Ke Kawasan Hutan Perhutani Bogor https://t.co/Nj4nt2sk4E
907,2022-10-25 23:21:19+00:00,PerumPerhutani,Wisata GBM Fasilitasi Upacara Dalam Rangka Hari Santri Nasional https://t.co/66rUgJUJzq
908,2022-10-25 22:59:45+00:00,KoranBUMN,Polda Jawa Barat Gelar Bimbingan Tekhnis Kepada Jajaran Keamanan Perhutani Kuningan https://t.co/RmkhEDeA3I @PerumPerhutani @KemenBUMN https://t.co/RQRNn1OH4S
909,2022-10-25 13:24:22+00:00,ekoepranoto,"Untungnya saya bukan org pinter

Semoga para pemangku kehutanan bisa bijak

@walhinasional 
@PerumPerhutani 
@SitiNurbayaLHK 
@KementerianLHK 
@GakkumKLHK https://t.co/SFkv6Pl5OY"
910,2022-10-25 02:01:17+00:00,PerumPerhutani,Satuan Karya Pramuka Wana Bhakti Binaan Perhutani di Balapulang Ikut Bimtek PPS Pramuka Kwarda Jateng https://t.co/j79U3uSXyK
911,2022-10-25 01:43:14+00:00,PerumPerhutani,Merasakan Nuansa Hutan ‘Lord of the Rings’ di Banyuwangi https://t.co/iwfj1MdrCy
912,2022-10-25 01:26:12+00:00,PerumPerhutani,"Membanggakan, Getah Pinus Perhutani Raih Sertifikat Ekolabel Pertama Indonesia https://t.co/f3zjisTKFk"
913,2022-10-25 01:23:42+00:00,PerumPerhutani,Perhutani Fasilitasi Kegiatan Penshutindo di Kendal https://t.co/xvJk2BqaNF
914,2022-10-25 01:02:46+00:00,PerumPerhutani,Perhutani Adakan Pelatihan Digital Marketing Go Online Mitra UMKM Di Kendal https://t.co/gb47qbs3MB
915,2022-10-24 13:53:52+00:00,PerumPerhutani,Perhutani Ciamis Bersama LMDH Green Forest Dan Pemandu Laksanakan Kegiatan Kebersihan Di Wisata Alam Citumang https://t.co/4QubTtxTbG
916,2022-10-24 13:42:22+00:00,PerumPerhutani,Jajaran Perhutani Bandung Utara Kunjungi Pusdiklatpassus Di Batujajar Bandung Barat https://t.co/VKMc0A6hqA
917,2022-10-24 13:34:34+00:00,PerumPerhutani,Perhutani Terima Kunjungan DanPusdiklatpassus Di Wisata Curug Layung Lembang https://t.co/X1GvSdPhZw
918,2022-10-24 13:27:08+00:00,PerumPerhutani,Perhutani Berikan Dana Bantuan TJSL Untuk Perbaikan Masjid di Bandung https://t.co/Ez1iRyd10G
919,2022-10-24 13:22:08+00:00,PerumPerhutani,Perhutani Cianjur Koordinasi Antisipasi Gukamhut Dengan Polsek Cikalong Kulon https://t.co/fHv5pbEs3H
920,2022-10-24 13:05:31+00:00,PerumPerhutani,Perhutani Dan PT Pertamina Geothermal Energi (PGE) Tandatangani MOU Pengelolaan Resiko Dan Perlindungan Hutan https://t.co/vwK54BbACt
921,2022-10-24 12:57:30+00:00,PerumPerhutani,Perhutani Bandung Selatan Bersama Mitra Tandatangani Perpanjangan PKS Pineus Tilu Riverside Camping https://t.co/nhXd4SKOuw
922,2022-10-24 12:57:17+00:00,PerumPerhutani,Kadivre Jatim Saksikan Serah Terima Fisik Wakilnya https://t.co/7v5vAYYNlj
923,2022-10-24 12:48:05+00:00,PerumPerhutani,Perhutani Bandung Selatan Terima PKL SMKN 1 Pasir Kuda Cianjur https://t.co/E4Pafm3ilO
924,2022-10-24 12:31:35+00:00,PerumPerhutani,Perhutani Adakan Pelatihan Digital Marketing UMKM Go Online Untuk Mitra Binaan di Kuningan https://t.co/A8JlRVI3M2
925,2022-10-24 10:23:19+00:00,PerumPerhutani,KPH Tuban Gelar Pelatihan P3K Bersama Dinas Kesehatan Kabupaten Tuban https://t.co/IiCNbNWMc0
926,2022-10-24 10:02:16+00:00,PerumPerhutani,Perhutani Tuban Gelar Pelatihan Kesamaptaan dan Pembinaan Bidang Hukum https://t.co/I7JAZuidH0
927,2022-10-24 09:07:43+00:00,PerumPerhutani,Perhutani Ikut Apel Siaga Bencana Hidrometeorologi di Ponorogo https://t.co/vg9uYndjzI
928,2022-10-24 08:50:18+00:00,PerumPerhutani,SMART KPH Kediri Menuju Perhutani Baru https://t.co/gYodDCSiwV
929,2022-10-24 08:03:58+00:00,PerumPerhutani,"Pasca Merger, Inhutani I Adakan Restrukturisasi Direktur https://t.co/qgzcsH5r2y"
930,2022-10-24 07:02:57+00:00,PerumPerhutani,Serikat Karyawan dan SP2P Perhutani Berikan Bantuan Untuk Korban Banjir di Kalijeruk Kawunganten https://t.co/6fMI7aOOZg
931,2022-10-24 06:54:28+00:00,PerumPerhutani,Inhutani I Dukung Program Kuliah 3 In 1 Di Universitas Brawijaya https://t.co/hEgoyOG8IV
932,2022-10-24 06:24:48+00:00,PerumPerhutani,Perhutani Gandeng Polres Rembang Berikan Pembinaan Polhut di Kebonharjo https://t.co/UCgav8hCmw
933,2022-10-24 03:20:35+00:00,PerumPerhutani,Perhutani Jadi Tuan Rumah Workshop Portal HC BUMN https://t.co/GBq1dGA3yd
934,2022-10-24 01:52:29+00:00,PerumPerhutani,FSC: Getah Pinus Perhutani Peroleh Sertifikat Ekolabel Pertama Indonesia https://t.co/X1jvtWrd1K
935,2022-10-24 01:42:35+00:00,PerumPerhutani,Bobobox Resmi Buka Bobocabin Pertama di Jawa Tengah https://t.co/DKde27X8f9
936,2022-10-24 01:36:49+00:00,PerumPerhutani,"Sakjose, Agroforestry Tebu di Jombang Sumbang Rp15 Miliar untuk Negara https://t.co/xs3RsU6src"
937,2022-10-23 06:22:10+00:00,donymaya,@erickthohir Keren pak.... Iya pak bantu kami mendapat prioritas untuk pemenuhan bahan baku dari hasil produks kayui @PerumPerhutani ya🙏☺
938,2022-10-21 08:53:19+00:00,PerumPerhutani,Perhutani Bandung Selatan Bersama CV. Palayangan Asriu Dan LMDH Kubang Sari Teken Perjanjian Kerjasama https://t.co/ok0BQG4xlt
939,2022-10-21 07:29:16+00:00,PerumPerhutani,Serikat Karyawan DPD KPH Kuningan Gelar Musda Untuk Masa Bhakti Tahun 2022-2025 https://t.co/XAF6vASC50
940,2022-10-21 07:07:02+00:00,PerumPerhutani,Polda Jawa Barat Gelar Bimbingan Tekhnis Kepada Jajaran Keamanan Perhutani Kuningan https://t.co/qfAHRprAOX
941,2022-10-21 03:59:50+00:00,PerumPerhutani,Wisata Alam KPH Ciamis Situ Mustika Terus Berbenah Hadapi Libur Akhir Tahun https://t.co/1awlXC8fVP
942,2022-10-21 03:33:05+00:00,PerumPerhutani,Mitra Binaan Perhutani Sukabumi Ikuti Pelatihan UMKM Go Online https://t.co/ydyIHGS6FS
943,2022-10-21 03:04:46+00:00,PerumPerhutani,"Pilot Project Jatim, Agroforestry Tebu Perhutani KPH Jombang Hasilkan Rp15 M https://t.co/LVm3zrxMel"
944,2022-10-21 02:56:55+00:00,PerumPerhutani,"Perhutani Jawa Timur Rotasi Jabatan, Kadivre Jabat Vice Presiden di Anak Usaha https://t.co/Ym6Vaf6AP4"
945,2022-10-21 02:47:26+00:00,PerumPerhutani,"Lewat Pengelolaan Sumber Daya Hutan, Perhutani Siap Penuhi Target Net Zero Emission 2060 https://t.co/ZezieLTsFY"
946,2022-10-21 02:39:52+00:00,PerumPerhutani,Perhutani Siap Berkontribusi Aktif Wujudkan Dekarbonisasi di Indonesia https://t.co/jTomz7HCUt
947,2022-10-21 02:27:52+00:00,PerumPerhutani,Perhutani Adakan Pelatihan Mitra Binaan Dalam Kegiatan UMKM Go Online https://t.co/RhRrgmTEdj
948,2022-10-21 02:20:09+00:00,PerumPerhutani,Perhutani Serahkan Bantuan Pembangunan Hetero Space Wilayah Banyumas di Purwokerto https://t.co/lJgZuhy6eI
949,2022-10-21 02:13:31+00:00,PerumPerhutani,Penandatanganan MoU Antara Perhutani Dengan Kejaksaan Negeri Kendal https://t.co/0i9FMYyV0Y
950,2022-10-21 02:07:59+00:00,PerumPerhutani,Perhutani Gandeng Mitra Binaan Ikuti Pelatihan Digital Marketing Go Online https://t.co/wnDqhBEhhu
951,2022-10-21 02:01:17+00:00,PerumPerhutani,Perhutani Salurkan Dana TJSL Rp 135 Juta Untuk 6 TK di Pati https://t.co/cPwKLHxPgH
952,2022-10-21 01:55:26+00:00,PerumPerhutani,TK Tunas Rimba Perhutani Madura Jalani Proses Visitasi Akreditasi https://t.co/lJncHLLu36
953,2022-10-21 01:53:31+00:00,PerumPerhutani,Serikat Karyawan DPD Perhutani Banten Berikan Tali Asih Untuk Karyawan https://t.co/6bBGm0QaRV
954,2022-10-21 01:45:18+00:00,PerumPerhutani,Warga Desa Mekarmulya Dan Perhutani Sambut Musim Tanam Gelar Adat Guar Bumi Di Majalengka https://t.co/e4EiZxsfoy
955,2022-10-21 01:41:50+00:00,PerumPerhutani,Perhutani Dan Stakeholder Adakan Kegiatan Pelatihan UMKM GO ONLINE https://t.co/1laZeIeNKg
956,2022-10-21 01:30:16+00:00,PerumPerhutani,Perhutani Tasikmalaya Bersama Mitra UMKM Mengikuti Pelatihan UMKM GO ONLINE https://t.co/M2WLjYlzsG
957,2022-10-21 01:22:33+00:00,PerumPerhutani,"Dukung Program Pemerintah, Perhutani Saksikan Penyerahan SK Hutan Sosial https://t.co/CFuv5pQbsw"
958,2022-10-21 01:14:47+00:00,PerumPerhutani,Wisata Puncak Bintang Perhutani Bandung Utara Raih Penghargaan Sertifikasi Wisata https://t.co/wZpieALigj
959,2022-10-21 01:13:15+00:00,PerumPerhutani,Perhutani Ajari Siswa SMKK Manokwari Praktek Cara Buat Persemaian Dengan Stek Pucuk Jati https://t.co/80dHV8ZlzK
960,2022-10-21 00:47:16+00:00,PerumPerhutani,Perhutani Bandung Selatan Survey Calon Penerima Bantuan TJSL NON-PUMK https://t.co/KxQYp5H9vl
961,2022-10-21 00:34:10+00:00,PerumPerhutani,Perhutani Divre Janten Lakukan Job Training Persiapan dan Pelaksanaan Tanaman di Sumedang https://t.co/o2XZkuWDIa
962,2022-10-21 00:27:58+00:00,PerumPerhutani,"Kendalikan Gukamhut, Perhutani Bersama Stakeholder Gelar Patroli Gabungan di Sukabumi https://t.co/Jcc24b69cR"
963,2022-10-20 06:51:57+00:00,PerumPerhutani,Kadivre Perhutani Jatim Tandatangani Kesepahaman dengan Universitas Pembagunan Nasional ( UPN ) “Veteran” Surabaya https://t.co/RTnBSPPpRg
964,2022-10-20 06:04:15+00:00,PerumPerhutani,"Jalin Sinergitas, Perhutani Probolinggo Silaturahmi ke Kodim 0821 Lumajang https://t.co/hHQFoZ5o4x"
965,2022-10-20 05:54:55+00:00,PerumPerhutani,Perhutani Ikut Gowes Bareng Ramaikan HUT TNI Ke-77 di Jember https://t.co/V32COAkM6Z
966,2022-10-20 05:11:20+00:00,PerumPerhutani,Perhutani Bersama Dandim 0812 Lamongan Tanam Pohon Bersama https://t.co/mt0xJCfLM0
967,2022-10-20 03:06:48+00:00,PerumPerhutani,Perhutani Malang Teken Perjanjian Kerja Sama dengan Empat Pengelola Wisata https://t.co/q6RVoFf1wP
968,2022-10-20 03:04:40+00:00,PerumPerhutani,Perhutani Terima Kunker Tim Pengelolaan DAS Sengkarang di Pekalongan Timur https://t.co/HcIWluVUVJ
969,2022-10-20 01:58:25+00:00,PerumPerhutani,Perhutani Gandeng Mitra Binaan Ikuti Pelatihan Digital Marketing UMKM Go Online https://t.co/py9pphWgMe
970,2022-10-20 01:54:48+00:00,PerumPerhutani,Perhutani Gelar Pelatihan UMKM Go Online bagi Mitra Binaan di Pekalongan Timur https://t.co/ZeynAUC8y2
971,2022-10-20 01:39:59+00:00,PerumPerhutani,Kadep Produksi dan Ekowisata Janji Berikan Reward kepada Penyadap dan Mandor Berprestasi https://t.co/gL5QyQkcdS
972,2022-10-20 01:18:44+00:00,PerumPerhutani,Perhutani Bersama Pemkab. Jombang Salurkan Dana TJSL Rp. 75 Juta kepada Siswa Berprestasi https://t.co/Sm3KWXfHo4
973,2022-10-20 00:54:49+00:00,PerumPerhutani,Perhutani Fasilitasi Pertemuan Penshutindo Kedu Selatan Di Purworejo https://t.co/jD8RCNliOI
974,2022-10-19 14:40:19+00:00,PerumPerhutani,Sertijab Kadivre Jatim https://t.co/zqGQVoJhXz
975,2022-10-19 04:46:15+00:00,PerumPerhutani,Perhutani dan Mitra Binaannya Semarakan Pameran Solo Great Sale 2022 https://t.co/FYkQWX6KIs
976,2022-10-19 04:24:51+00:00,PerumPerhutani,Perhutani Kerjasama Dengan Polsek dan TNI dalam Kegiatan Keamanan Kawasan Hutan https://t.co/2zr5btslxR
977,2022-10-19 04:23:09+00:00,PerumPerhutani,Strategi Perhutani Wujudkan Netralitas Karbon di Indonesia https://t.co/wCRrE1pwLc
978,2022-10-19 04:19:04+00:00,PerumPerhutani,Perhutani Siap Berkontribusi Aktif Wujudkan Dekarbonisasi di Indonesia https://t.co/PIP1NkkyNP
979,2022-10-19 04:08:25+00:00,PerumPerhutani,Perhutani Berikan Bantuan Drainase Rp 50 Juta Di Kelurahan Karangsari Kendal https://t.co/uos8QkmpFD
980,2022-10-19 03:57:40+00:00,PerumPerhutani,Perhutani Berikan Santunan Rp 36 Juta Untuk Mitra Kerja Penyadap di Pekalongan Timur https://t.co/1nfHLuIVAy
981,2022-10-19 03:50:32+00:00,PerumPerhutani,Perhutani Serahkan Bantuan PUMK Sebesar Rp 250 Juta Kepada 16 Pelaku Usaha di Purwodadi https://t.co/51o0Q4g0Gl
982,2022-10-19 03:27:45+00:00,PerumPerhutani,Perhutani Peringati Maulud Nabi Muhamad SAW di Kedu Selatan https://t.co/oDLgzVpShX
983,2022-10-19 03:16:33+00:00,PerumPerhutani,Perhutani Bersama BPBD Temanggung Patroli Pemantauan Lokasi Rawan Bencana https://t.co/O1QIcJw01Y
984,2022-10-19 02:33:28+00:00,PerumPerhutani,Perhutani Ikuti Workshop Asistensi Pembentukan Tim CSIRT Dari BSSN https://t.co/glYMSlRQgP
985,2022-10-19 01:26:31+00:00,PerumPerhutani,Perhutani Wujudkan Target Net Zero Emission 2060 melalui Perdagangan Karbon https://t.co/456zDQ9IuP
986,2022-10-19 01:22:58+00:00,PerumPerhutani,Perhutani Wujudkan Target Net Zero Emission 2060 melalui Perdagangan Karbon https://t.co/D4TpCr7S5X
987,2022-10-19 01:05:09+00:00,PerumPerhutani,Perhutani Wujudkan Target Net Zero Emission 2060 Lewat Perdagangan Karbon https://t.co/hgyHgNyoCT
988,2022-10-19 00:57:20+00:00,PerumPerhutani,"Penuhi Target Net Zero Emission 2060, Perhutani Tempuh Langkah Ini https://t.co/jMsB1jjtbJ"
989,2022-10-18 12:22:57+00:00,PerumPerhutani,Perhutani Bersama Polres Jombang Bagikan Sembako kepada Masyarakat Sekitar Hutan https://t.co/cJJ8Uwezu4
990,2022-10-18 11:14:36+00:00,PerumPerhutani,Perhutani Mojokerto Bersama Polri Kondisikan Lapangan di BKPH Tapen https://t.co/99lkT7gHhA
991,2022-10-18 09:03:48+00:00,PerumPerhutani,Kementerian LHK Lakukan Verifikasi Teknis Program Perhutanan Sosial KTH Binaan Inhutani V https://t.co/7cnpi6jIOx
992,2022-10-18 09:02:00+00:00,PerumPerhutani,"Tingkatkan Sinergi, Inhutani I Meriahkan HUT 232 Kota Tanjung Selor dan HUT 62 Kabupaten Bulungan https://t.co/RXfdV1y4TS"
993,2022-10-18 06:59:16+00:00,PerumPerhutani,Perhutani Wujudkan Target Net Zero Emission 2060 Melalui Perdagangan Karbon https://t.co/R48n4Tq0Pi
994,2022-10-18 05:15:09+00:00,PerumPerhutani,"Perhutani Peduli, Sumbangkan Sembako Kepada Masyarakat Terdampak Bencana Tanah Longsor https://t.co/SKwnscqFsX"
995,2022-10-18 04:54:39+00:00,PerumPerhutani,Perhutani Salurkan Dana PUMK Kepada Pengusaha UMKM Nilai Rp 90 Juta https://t.co/rMloINgtlc
996,2022-10-18 03:47:38+00:00,PerumPerhutani,"Perhutani Serahkan Sharing Produksi Produksi Rp 4,1 M Kepada LMDH se Kedu https://t.co/ZyNcrBgIqp"
997,2022-10-18 02:27:34+00:00,PerumPerhutani,Perhutani Bersama BRI Adakan Sosialisasi Pembayaran Non Tunai melalui CMS BRI https://t.co/wvfriouo9s
998,2022-10-18 02:09:51+00:00,PerumPerhutani,Perhutani Gandeng TNI untuk Cegah Gukamhut di Lamongan https://t.co/T7l0rWXBOB
999,2022-10-18 01:48:48+00:00,PerumPerhutani,Jalin Sinergritas Perhutani Koordinasi Lintas Sektoral Dengan Polres Temanggung https://t.co/WQMQF9uhi2
1000,2022-10-18 01:42:50+00:00,PerumPerhutani,Perhutani Semarakan Pameran Solo Great Sale 2022 Di Benteng Vastenburg Solo https://t.co/pS5DPQq87N
1001,2022-10-18 01:38:13+00:00,PerumPerhutani,"Rekomendasi Tempat Wisata di Cilacap, Indahnya Hamparan Laut Selatan dari Gunung Selok View Adipala https://t.co/edHDOWKTNZ"
1002,2022-10-18 01:37:00+00:00,PerumPerhutani,Penandatanganan MoU Perhutani Dengan Kejaksaan Negeri Temanggung https://t.co/4LReNlawfk
1003,2022-10-18 01:33:21+00:00,PerumPerhutani,Menikmati Akhir Pekan di Mata Air Grogolan https://t.co/hM52XhU1KB
1004,2022-10-18 01:28:57+00:00,PerumPerhutani,Perhutani Berikan Pinjaman Lunak Melalui TJSL Kepada Pengusaha Kecil Sekitar Wilayah Hutan https://t.co/fqgFRzANJp
1005,2022-10-18 01:16:23+00:00,PerumPerhutani,Perhutani Salurkan Dana PUMK Kepada 15 Mitra Binaan di Gundih https://t.co/7Qh8QfbIE8
1006,2022-10-18 01:02:06+00:00,PerumPerhutani,Perhutani Berikan Bantuan TJSL Senilai Rp 311 Juta Untuk Kelompok Masyarakat Sekitar Hutan Di Wilayah Kabupaten Wonogiri https://t.co/7AtQC2qnEA
1007,2022-10-18 00:55:59+00:00,PerumPerhutani,Perhutani Fasilitasi Mitra Binaannya Ikut Pameran BUMN-UMKM Solo Great Sale 2022 Di Surakarta https://t.co/B1pkKpjZHP
1008,2022-10-18 00:49:26+00:00,PerumPerhutani,Perhutani Bersama Pemerintahan Desa Teken PKS Pemanfaatan Lahan Tanah Pekarangan Di Lurangung Kuningan https://t.co/b8FSZlsSSo
1009,2022-10-18 00:22:48+00:00,PerumPerhutani,"Jalin Sinergitas, Perhutani Lakukan Kunjungan Ke Kantor PWI Kabupaten Sukabumi https://t.co/r6I4TsUqhl"
1010,2022-10-18 00:19:44+00:00,PerumPerhutani,"Bangun Sinergitas, Perhutani Bandung Utara Sambangi Bupati Subang https://t.co/xBQKFhXxUm"
