,Date,User,Tweet
0,2023-02-10 01:42:22+00:00,donymaya,"Video nya baru jadi ☺☺
Senangnya bisa berkumpul bersama orang-orang baik. 
@PerumPerhutani @DitjenPPKL @yonarmed12kost1 https://t.co/ajm1HClCJg"
1,2023-02-09 05:15:37+00:00,subisaja,@kompascom Semangat Bu @SumarniGrobogan Pak @Moh_Sumarsono @PPID_Perhutani @PerumPerhutani @ProKlim_KLHK @diskominfo_grob @InfoPWD @KK_Purwodadi @dishutbunBTG
2,2023-02-06 11:29:29+00:00,martin_rachmant,"@KementerianLHK @PerumPerhutani @PPID_Perhutani @jokowi @ListyoSigitP @msoekarnoputri @puanmaharani_ri @AzwarAnas_A3 @KotaGenteng @infobwi @SN_Banyuwangi @InformasiBWI 
https://t.co/BWDzPFTMuh"
3,2023-02-01 06:14:59+00:00,PerumPerhutani,Perhutani dan BPBD Kabupaten Subang Tandatangani MoU dan Perjanjian Kerjasama https://t.co/vc0Ww1XoOz
4,2023-02-01 06:14:43+00:00,PerumPerhutani,"Melalui Program TJSL, Perhutani Resmikan Jembatan Kali Cipanas Di Indramayu https://t.co/4EBZ8SeRwW"
5,2023-02-01 06:14:26+00:00,PerumPerhutani,Perhutani Bandung Selatan Lepas Praktek Kerja lapangan (PKL) Siswa SMKN 1 Pasir Kuda Cianjur https://t.co/RCkv7lnYyH
6,2023-02-01 06:14:11+00:00,PerumPerhutani,"Perkuat Sinergitas dan Kelembagaan, Perhutani dan Kelompok Tani Hutan Laksanakan Pertemuan di Ciamis https://t.co/EAcn5Dc6r6"
7,2023-02-01 06:12:03+00:00,PerumPerhutani,Perhutani Jalin Koordinasi Harmonis Dengan BPBD Banjarnegara https://t.co/yxlkB5ng71
8,2023-02-01 03:54:27+00:00,PerumPerhutani,Inhutani I Laksanakan Kegiatan Leader Talks AKHLAK “Loyal” https://t.co/XMdLYo1H06
9,2023-02-01 01:57:38+00:00,PerumPerhutani,"Perhutani Sebut Hutan Lindung Boleh Dimanfaatkan Investor, Tapi Ada Aturannya https://t.co/DwduPA9HAR"
10,2023-02-01 01:18:59+00:00,PerumPerhutani,Perhutani Jalin Sinergi Bersama PWI Kabupaten Blora https://t.co/lnd5kkHOzV
11,2023-02-01 01:08:57+00:00,PerumPerhutani,Perhutani Lakukan Kegiatan Donor Darah Dalam Rangka Bulan K3 Nasional di Balapulang https://t.co/sYFF0qECCw
12,2023-02-01 01:00:40+00:00,PerumPerhutani,"Peringati Bulan K3, Perhutani Gelar Kegiatan Donor Darah di Rembang https://t.co/2d2Z2D23nV"
13,2023-02-01 00:54:50+00:00,PerumPerhutani,Perhutani Gandeng Disnakertrans Purworejo Kampanye K3 dan PHBS https://t.co/uPziIu1dHO
14,2023-02-01 00:46:42+00:00,PerumPerhutani,"Peringati Bulan K3, Perhutani Gelar Donor Darah di Pekalongan Barat https://t.co/7lw3yfRuOW"
15,2023-02-01 00:02:47+00:00,PerumPerhutani,Perhutani Terima Kunjungan BPDAS Solo Guna Koordinasi Pengelolaan Kawasan Hutan di Magetan https://t.co/fH1RpZmUq5
16,2023-01-31 11:17:57+00:00,PerumPerhutani,Menteri BUMN Lakukan Pergantian Direksi Perum Perhutani https://t.co/r2K2ZjFqnX
17,2023-01-31 09:07:53+00:00,PerumPerhutani,"Perhutani, Biro Kesra Jatim dan Stakeholders terkait Gelar Sarasehan di Wisata Mangrove Lembung https://t.co/qZU93UVLLx"
18,2023-01-31 07:44:55+00:00,PerumPerhutani,Perhutani Bersama LMDH Teken Perpanjangan PKS Wisata Religi di Pamekasan https://t.co/vaOA3M6aLR
19,2023-01-31 07:29:04+00:00,PerumPerhutani,Perhutani Bersama LMDH Tapen Gelar Pelatihan Pembuatan Pupuk Organik Ramah Lingkungan https://t.co/8ZBHTmzvoj
20,2023-01-31 03:48:52+00:00,PerumPerhutani,"Event Pertama Tahun 2023, Kawah Putih Perhutani Hadirkan Pentas Seni Barongsai Tonggak https://t.co/6Yl52J7yTo"
21,2023-01-31 02:41:21+00:00,PerumPerhutani,Perhutani Bersama Gubernur Jawa Tengah Tanam Jagung Dukung Ketahanan Pangan https://t.co/JQcVBkZMzo
22,2023-01-31 02:18:26+00:00,bondolclekitet,"izin dipantau komandan
@SitiNurbayaLHK 
@KementerianLHK 
@GakkumKLHK 
@PerumPerhutani https://t.co/mVOlCJcHIk"
23,2023-01-31 02:08:44+00:00,PerumPerhutani,Perhutani Madiun Menerima Kunjungan Lapangan Mahasiswa Universitas Gadjah Mada di Ponorogo https://t.co/qgl742PKAa
24,2023-01-31 01:27:53+00:00,PerumPerhutani,Perhutani Sosialisasikan Penerapan SNI 8911 Tahun 2020 dan PUHH Bersama LMDH di Balapulang https://t.co/VNcuW6y8uB
25,2023-01-31 01:14:23+00:00,PerumPerhutani,Wisata Bumi Perkemahan Glagah Arum Dikelola Pramuka https://t.co/7ldvOOK5il
26,2023-01-31 00:23:00+00:00,PerumPerhutani,Perhutani Bondowoso Terima Penghargaan Zero Accident Award 2022 Tingkat Provinsi Jatim dari Gubernur https://t.co/qUuXK2IEUh
27,2023-01-30 23:49:22+00:00,PerumPerhutani,Perhutani Lakukan Monev Kepada LMDH yang Melakukan PKS di Bangkalan https://t.co/UgDOKeWysy
28,2023-01-30 23:22:22+00:00,PerumPerhutani,"Tingkatkan Koordinasi dengan Pemerintah Daerah, Perhutani Lakukan Kunker ke Bupati Ponorogo https://t.co/3OnGhEr4KM"
29,2023-01-30 09:44:14+00:00,PerumPerhutani,PeFI Bersama Tim Peneliti UGM Kaji Tanaman Kayu Putih yang Menguning di Madiun https://t.co/b2Ep3aSrr3
30,2023-01-30 09:12:22+00:00,PerumPerhutani,Perhutani Bersama LMDH Bertekad Sukseskan Program Kemiteraan Kehutanan di Banyuwangi https://t.co/GYIZKsEJvN
31,2023-01-30 07:35:12+00:00,PerumPerhutani,"Perhutani Gandeng Pemdes, Sosialisasikan Program Kerja kepada Masyarakat Desa Hutan di Banyuwangi https://t.co/RQ2qrvjvgA"
32,2023-01-30 07:18:54+00:00,PerumPerhutani,Perhutani Bersama Lembaga Terkait Sukseskan Prgram Kemiteraan Kehutanan di Banyuwangi https://t.co/PZauTvriza
33,2023-01-30 07:17:56+00:00,PerumPerhutani,"Peringati Hari K3 Nasional, Perhutani Bandung Selatan bersama PMI Kota Bandung Adakan Kegiatan Donor Darah https://t.co/HUOLl6zlT4"
34,2023-01-30 07:17:31+00:00,PerumPerhutani,"Demi Memajukan Dunia Pendidikan, Perhutani Bersinergi Dengan Fakultas Ekonomi dan Bisnis UNIKU Kabupaten Kuningan https://t.co/CfKjWMn0f0"
35,2023-01-30 07:16:36+00:00,PerumPerhutani,Perhutani Lakukan Pemantapan Pembahasan Rencana Kerjasama Wisata Alam Forest Walk Dengan PT. Kampung Makmur Di Sumedang https://t.co/dzqBrbMejO
36,2023-01-30 07:15:28+00:00,PerumPerhutani,Perhutani Bersama Pemdes Lakukan Perbaikan Jalan di Kuningan https://t.co/pQWXCn7a2A
37,2023-01-30 07:12:19+00:00,PerumPerhutani,Paska Libur Sekolah Objek Wisata Kebon Pinus Diserbu Pengunjung https://t.co/IzcfA01KRq
38,2023-01-30 06:53:43+00:00,bondolclekitet,@PerumPerhutani Ass wr wb
39,2023-01-30 06:51:26+00:00,PerumPerhutani,"Jaga Sinergitas, Perhutani Gowes Bareng Forkompimcam Sale https://t.co/WxR0RV7sKM"
40,2023-01-30 06:43:40+00:00,bondolclekitet,@PerumPerhutani Selamat siang
41,2023-01-30 06:29:22+00:00,PerumPerhutani,Perhutani Bersama YKP3JS Serahkan Bantuan Beasiswa Bagi Pelajar Berprestasi di Cepu https://t.co/hICEan0hN6
42,2023-01-30 06:24:42+00:00,PerumPerhutani,Perhutani Bersama LMDH Tandatangani PKS Agroforestry di Balapulang https://t.co/jNXheqRmMs
43,2023-01-30 06:24:04+00:00,PerumPerhutani,Perhutani Bersama LMDH Realisasikan Kerjasama Budidaya Tanaman Sengon di Banyuwangi https://t.co/RV5oFPqVS6
44,2023-01-30 03:55:17+00:00,PerumPerhutani,Perhutani Lakukan Penguatan Kelembagaan terhadap LMDH di Lamongan https://t.co/pjNYqlpsE5
45,2023-01-30 03:03:42+00:00,PerumPerhutani,Perhutani Parengan Rangkul Pelaku Usaha Kuliner Resmi Launching Cafe DJodrodjo dan Santuni Anak Yatim https://t.co/qgrEAAJCTm
46,2023-01-30 02:52:39+00:00,PerumPerhutani,Perhutani KPH Banten Bersama Sekar berikan Santunan Untuk Keluarga Karyawan Meninggal Dunia https://t.co/WOVfHax4jF
47,2023-01-30 02:52:16+00:00,PerumPerhutani,Perhutani KPH Cianjur bersama PT. Djarum Jajaki Kerjasama Bidang Ekowisata https://t.co/h5pbjS2E8b
48,2023-01-30 02:51:53+00:00,PerumPerhutani,Perhutani Bersama Pemdes Dan LMDH Bahu Membahu Bangun Gapura Wisata Situ Wulukut https://t.co/nAcO6EqVMX
49,2023-01-30 02:51:33+00:00,PerumPerhutani,Perhutani Terima Praktek Kerja Lapangan dan Magang Mahasiswa Fakultas Kehutanan Uniku Kabupaten Kuningan https://t.co/gs2SjPdR0p
50,2023-01-30 01:01:18+00:00,PerumPerhutani,Perhutani Bersama Dinas Pertanian Gandeng Investor Untuk Hijaukan Kembali Pegunungan Kendeng Utara https://t.co/oNSQvHffKj
51,2023-01-30 00:41:18+00:00,PerumPerhutani,Wisata Pantai Logending Perhutani Sajikan Panorama Pantai dan Hijaunya Hutan Jati https://t.co/374Knvnm87
52,2023-01-27 11:31:40+00:00,PerumPerhutani,Perhutani Madiun Terima Kunjungan Lapangan Executive Director JIFPRO di Madiun https://t.co/Hg4Ca8ygrP
53,2023-01-27 09:38:58+00:00,PerumPerhutani,Perhutani Bondowoso Bersama Lembaga Kesehatan Lakukan Cek Kesehatan Berkala bagi Karyawan https://t.co/26wlyTo3Iu
54,2023-01-27 08:41:38+00:00,PerumPerhutani,Perhutani Lawu Ds Terima Kunjungan Studi Banding Gapoktanhut dan LMDH dari Ngawi https://t.co/0U0QNHsH53
55,2023-01-27 07:13:23+00:00,PerumPerhutani,Perhutani Ngawi Terima Kunjungan Lapangan Mahasiswa Universitas Lambung Mangkurat https://t.co/rS9iCAZuxT
56,2023-01-27 06:52:51+00:00,PerumPerhutani,Perhutani Madura Sosialisasikan Program Kerja kepada LMDH Khususnya Penggarap Lahan di Bawah Tegakan di Sumenep https://t.co/J3tB3GA0rs
57,2023-01-27 06:21:31+00:00,PerumPerhutani,Perhutani Tandatangani Perjanjian Kerjasama Bidang Hukum Bersama Kejaksaan Negeri Tegal https://t.co/UiW4IhS1fi
58,2023-01-27 06:06:28+00:00,PerumPerhutani,Perhutani Lakukan Aksi Donor Darah di Blora https://t.co/UiKeVS1MJb
59,2023-01-27 05:57:56+00:00,PerumPerhutani,Pesona Alam Yang Menawan di Puncak Gunung Telomoyo https://t.co/a0RTlFR68X
60,2023-01-26 07:51:51+00:00,PerumPerhutani,"Memulai Pekerjaan di Tahun 2023, Perhutani Jombang Gelar Out Bond dan Santuni Anak Yatim https://t.co/PChbgCoQqf"
61,2023-01-26 06:28:41+00:00,PerumPerhutani,Perhutani Ngawi Gelar Aksi Donor Darah Bersama PMI https://t.co/9lkGcI3xaN
62,2023-01-26 05:46:09+00:00,KakekHalal,"Gub @Ganjarpranowo menghadiri penanaman jagung di Petak 49 Hutan Produksi Jragung, Desa Candirejo, Kab. Semarang (24/1).

Kegiatan yang diinisiasi oleh Satgas Pangan @poldajateng_, @PerumPerhutani &amp; kelompok petani tersebut menjadi langkah meningkatkan produksi komoditas pangan. https://t.co/slFV0Xlpdk"
63,2023-01-26 04:02:46+00:00,PerumPerhutani,Aksi Donor Darah Mewarnai Peringatan Bulan K3 Nasional di Perhutani Lawu DS https://t.co/fkVysFGdNj
64,2023-01-26 03:34:10+00:00,PerumPerhutani,"Dukung Program Ketahanan Pangan Nasional, Perhutani Bersama Kodim 0812 Lamongan Tanam Jagung Bersama https://t.co/siUFAayKxG"
65,2023-01-26 02:08:31+00:00,humasjateng,"Gub @Ganjarpranowo menghadiri penanaman jagung di Petak 49 Hutan Produksi Jragung, Desa Candirejo, Kab. Semarang (24/1).

Kegiatan yang diinisiasi oleh Satgas Pangan @poldajateng_, @PerumPerhutani &amp; kelompok petani tersebut menjadi langkah meningkatkan produksi komoditas pangan. https://t.co/dtvyUxb91c"
66,2023-01-26 01:39:12+00:00,PerumPerhutani,Perhutani Bimbing 5 Mahasiswa Fakultas Kehutanan UGM Praktek SILIN https://t.co/6Jc0xDhy0n
67,2023-01-26 01:34:15+00:00,PerumPerhutani,"Pererat Sinergitas, Perhutani Koordinasi Bersama Dandim 0708 Purworejo dan Pinca BRI Purworejo https://t.co/YEZlVYOgJy"
68,2023-01-26 01:27:13+00:00,PerumPerhutani,"Perhutani Kerjasama Dengan Laboratorium Patra Medica, Cek Kesehatan di Cepu https://t.co/3yfVN0DyIj"
69,2023-01-26 01:22:09+00:00,PerumPerhutani,Perhutani Tandatangani Mou Bersama Kejari Tegal https://t.co/DXFMCzzsnN
70,2023-01-26 00:32:45+00:00,PerumPerhutani,"Jaga Kelestarian Hutan, Perhutani Bersama Stakeholders Lakukan Penanaman Bersama di Lamongan https://t.co/BhA7739et6"
71,2023-01-26 00:07:01+00:00,PerumPerhutani,"Tumbuhkan Kepedulian Sosial, Perhutani Bersama Forkopimcam Bluluk Santuni Anak Yatim di Lamongan https://t.co/j3OZAAm2ZZ"
72,2023-01-25 23:48:20+00:00,PerumPerhutani,Perhutani Hadiri Penyusunan Program Kerja Musrenbangdes di Lamongan https://t.co/en8vZZkYlU
73,2023-01-25 23:29:10+00:00,PerumPerhutani,Perhutani Tingkatkan Koordinasi dengan Lembaga Kepolisian Tekan Angka Gukamhut https://t.co/XPuSKo4ML6
74,2023-01-25 10:13:37+00:00,PerumPerhutani,"Dukung Genggong Go Green ke- IV, Perhutani Bersama Ponpes Genggong dan Stakeholders Tanam 1000 Pohon https://t.co/U9y6CMl0w6"
75,2023-01-25 10:00:38+00:00,PerumPerhutani,Perhutani lakukan Koordinasi Keamanan dan Perlindungan Hutan dengan Polda Jabar https://t.co/EQVP7ULq0z
76,2023-01-25 10:00:01+00:00,PerumPerhutani,Perhutani Janten bersama Kajati Jabar tandatangani MOU di Bidang Hukum Perdata dan Tata Usaha Negara https://t.co/z08nlx1gQJ
77,2023-01-25 09:44:41+00:00,PerumPerhutani,Perhutani Koordinasikan dengan Camat Sambeng Guna Tingkatkan Indexs Pendapatan Masyarakat Sekitar Hutan di Lamongan https://t.co/RX3HjSRqIp
78,2023-01-25 07:05:46+00:00,PerumPerhutani,"Solidaritas Perhutani dan TNI/Polri, Bagikan Paket Sembako kepada Masyarakat Desa Hutan https://t.co/fhLGAUzGFc"
79,2023-01-25 03:43:54+00:00,PerumPerhutani,Perhutani Berikan Santunan Meninggal Dunia Kepada Ahli Waris https://t.co/eT5CGrty9A
80,2023-01-25 03:42:54+00:00,PerumPerhutani,Peringati Hari Sejuta Pohon Perhutani Tasikmalaya Melaksanakan Penanaman Bersama SMAN 1 Cikatomas https://t.co/RUunObwpuo
81,2023-01-25 03:41:57+00:00,PerumPerhutani,Perhutani bersama LMDH Laksanakan Kegiatan Job Training dan Cutting Test di Sumedang https://t.co/wl7GtNBFHD
82,2023-01-25 03:40:56+00:00,PerumPerhutani,Perhutani Melaksanakan Penandatanganan Nota Kesepahaman Dengan BPBD Kabupaten Bogor https://t.co/nrF8cO8ssn
83,2023-01-25 03:08:02+00:00,PerumPerhutani,Perhutani Sosialisasikan Program Kerja Bidang Agroforestry kepada Petani Hutan di Lamongan https://t.co/iC9HU8QsiX
84,2023-01-25 02:35:59+00:00,PerumPerhutani,"Jalin Sinergi dengan Pemdes, Perhutani, Kapolres dan Kodim 0821 Lumajang Ajak Masyarakat Rawat Hutan untuk Kesejahteraan https://t.co/Sk7t1Iom19"
85,2023-01-25 02:03:12+00:00,fatyakresnawan,@catchthesunsets @infobandung @xplorerancaupas @BDGPodcast @ilovebdg @PerumPerhutani @infobdg 🙏🏻👍🏻🙏🏻👍🏻
86,2023-01-25 01:34:00+00:00,PerumPerhutani,Perhutani Sosialisasikan Penerapan SNI 8911 dan TUHH Bersama Forkompincam Purwojati https://t.co/CBzOVT5ZkW
87,2023-01-25 01:20:26+00:00,catchthesunsets,@fatyakresnawan @infobandung @xplorerancaupas @BDGPodcast @ilovebdg @PerumPerhutani @infobdg Thankyouu fat!
88,2023-01-25 00:05:19+00:00,PerumPerhutani,Perhutani Bondowoso Teken PKS Bidang Sarana/Prasarana Pendidikan Informal https://t.co/db6BQuOpZB
89,2023-01-24 23:34:23+00:00,PerumPerhutani,Perhutani Bersama KPMM Tanam Mangrove dalam rangka Peringatan Hari Satu Juta Pohon Se-Dunia di Pamekasan https://t.co/FQXOSzi7KJ
90,2023-01-24 13:08:47+00:00,PerumPerhutani,Perhutani Lakukan Koordinasi dan Evaluasi kepada LMDH untuk Pencapaian Keberhasilan Tanaman di Sumenep https://t.co/4gxhkoAUzW
91,2023-01-24 12:46:30+00:00,PerumPerhutani,"Sosialisasikan Program Kerja kepada Masyarakat Desa Hutan, Perhutani Gandeng Forkopimcam Sambeng Lamongan https://t.co/OopqSLzq3w"
92,2023-01-24 11:25:42+00:00,PerumPerhutani,"Bersepeda dan Menanam, Perhutani Dukung Genggong Go Green Carnival ke-IV di Probolinggo https://t.co/RhTu93WhhW"
93,2023-01-24 10:24:27+00:00,PerumPerhutani,Perhutani Ngawi Kerjasamakan Asset Tanah DK Bersama Mantan Bupati untuk Bisnis Waralaba https://t.co/iYk6uZn5tK
94,2023-01-24 09:33:57+00:00,PerumPerhutani,"Peringati Harlah Sekar ke-18, DPD Sekar Perhutani Saradan Gelar Doa dan Santuni Anak Yatim https://t.co/0mna9G7Ujj"
95,2023-01-24 09:04:40+00:00,PerumPerhutani,Perhutani Tingkatkan Koordinasi Keamanan dengan Lembaga Kepolisian di Level Tapak https://t.co/pJaT77yL6U
96,2023-01-24 07:59:31+00:00,PerumPerhutani,Perhutani Bimbing Mahasiswa UGM Yogyakarta Dalam Program Magang Mandiri https://t.co/GmLbm8Co4n
97,2023-01-24 07:56:25+00:00,PerumPerhutani,Perhutani Bersama Stakeholder Gelar Puncak Maraton Konservasi di Gunung Prau https://t.co/f3JXhXjByK
98,2023-01-24 07:52:29+00:00,PerumPerhutani,"Perhutani, Bupati Kendal Bersama Komunitas Pecinta Alam 1001 Pendaki Tanam 1.300 Bibit Pohon di Lereng Gunung Ungaran https://t.co/oz7v1ccaxs"
99,2023-01-24 06:18:06+00:00,fatyakresnawan,@catchthesunsets @infobandung @xplorerancaupas @BDGPodcast @ilovebdg @PerumPerhutani @infobdg
100,2023-01-24 02:20:09+00:00,tanusukarta,"@PerumPerhutani maaf bertanya, apakah program perhutanan sosial untuk wilayah Desa Cimulya, Kecamatan Cimahi, Kabupaten Kuningan, Jawa Barat, sudah SK-nya, terima kasih."
101,2023-01-24 02:08:08+00:00,PerumPerhutani,Perhutani Bersama Yayasan Jati Sejahtera Bagikan Beasiswa di Mantingan https://t.co/2DGKnybAPE
102,2023-01-24 01:50:42+00:00,PerumPerhutani,YKP3JS Serahkan Beasiswa di Randublatung https://t.co/maeFknapom
103,2023-01-24 01:42:19+00:00,PerumPerhutani,Perum Perhutani Optimis Dapat Berkontribusi di Era “Metaverse” https://t.co/y7dLDwqlRc
104,2023-01-24 01:42:13+00:00,PerumPerhutani,Mahasiswa UGM Ikuti Penanaman Bersama di Purwokerto https://t.co/JTBOrqI8j3
105,2023-01-24 01:34:00+00:00,PerumPerhutani,Rasakan Melihat Virtual Forest ala Perhutani di Indonesia Metaverse Show 2023 https://t.co/bhbAHU9g7h
106,2023-01-24 01:20:41+00:00,PerumPerhutani,Perhutani Optimistis Bisa Berkontribusi di Era Metaverse https://t.co/QUHD7J879e
107,2023-01-24 01:13:08+00:00,PerumPerhutani,Perhutani Hadirkan Virtual Forest https://t.co/F7rL1jzXZH
108,2023-01-24 01:10:04+00:00,PerumPerhutani,"Peringati Bulan K3 Nasional, Perhutani Gandeng PMI Grobogan Gelar Kegiatan Donor Darah https://t.co/e0SVRJCnHj"
109,2023-01-24 01:05:21+00:00,PerumPerhutani,"Kenalkan Hutan, Perhutani Ajak Murid TK Tunas Rimba Purworejo Tanam Bersama https://t.co/8wNWpsCWYN"
110,2023-01-24 00:52:44+00:00,PerumPerhutani,Perhutani Dukung Agroforestry Desa Sentra Durian di Prumben Purworejo https://t.co/G29qk6f2hG
111,2023-01-24 00:36:58+00:00,PerumPerhutani,"Perkuat Sinergitas, Perhutani Koordinasi Dengan BPN Kabupaten Wonosobo https://t.co/5LrrKzP3YS"
112,2023-01-20 22:58:22+00:00,sevtiandini,"Selamat Pagi, Mau tanya,kalau kemarin sampai saat ini belum ada notif email ataupun web fhci BUMN , berarti gak lolos atau bagaimana? Mohon responnya 🙏🏻 @fhcibumn @KemenBUMN @PerumPerhutani"
113,2023-01-20 09:45:43+00:00,PerumPerhutani,Perhutani Bondowoso Bersama LMDH Rengganis dan Forkopimcam Kembangkan Wisata Religi https://t.co/dEz60Wc2Md
114,2023-01-20 04:24:33+00:00,PerumPerhutani,Perhutani Raih Penghargaan dalam Kick Off Bussiness Matching Pasar Digital UMKM 2023 https://t.co/DwUukUXorT
115,2023-01-20 03:08:31+00:00,PerumPerhutani,Memulai Pekerjaan di Tahun 2023 Divre Jatim Gelar Penanaman dan Santuni Anak Yatim https://t.co/QMpN88DMea
116,2023-01-20 00:37:57+00:00,PerumPerhutani,"Cegah Bencana, Perhutani Bersama BPBD Kabupaten Pekalongan Gelar Penyuluhan https://t.co/U29mDTjZVI"
117,2023-01-20 00:29:28+00:00,PerumPerhutani,"Dukung Upaya Pemerintah Tingkatkan Kesejahteraan, Perhutani Jalin Kerjasama Dengan MDH di Banjarnegara https://t.co/21W2Be4pdl"
118,2023-01-20 00:20:08+00:00,PerumPerhutani,Perhutani Terima Praktik Lapangan Mahasiswa Fakultas Kehutanan UGM di Randublatung https://t.co/m9vIQ5vcfk
119,2023-01-19 14:19:09+00:00,PerumPerhutani,Perhutani Hadirkan Virtual Forest di Indonesia Metaverse Show 2023 https://t.co/7FT8j3cRaB
120,2023-01-19 07:08:25+00:00,PerumPerhutani,Inhutani V Pantau Kualitas Air Permukaan di Kawasan Hutan Bangka https://t.co/JbqOkJCk3S
121,2023-01-18 06:03:18+00:00,PerumPerhutani,Perhutani Adakan Sosialisasi Perjanjian Kerjasama di Sidareja https://t.co/2Je7y1pBas
122,2023-01-18 05:55:26+00:00,PerumPerhutani,Perhutani Jadi Tempat Praktik Silvilkultur Intensif (SILIN) Mahasiswa UGM https://t.co/blaiSjhtxb
123,2023-01-18 05:42:52+00:00,PerumPerhutani,"Perhutani Berbagi Peran Dengan MDH, Kerjasama Tanaman Durian di Kebumen https://t.co/yHV9iZh2lQ"
124,2023-01-18 03:09:45+00:00,PerumPerhutani,Inhutani I Raih Penghargaan The Best Performance dari Perhutani https://t.co/Ia2to3hTFX
125,2023-01-18 01:53:02+00:00,PerumPerhutani,Perhutani Perkuat Bisnis Bidang Biomassa dan NBS Tahun Ini https://t.co/wxXkFduScq
126,2023-01-18 01:44:58+00:00,PerumPerhutani,Perhutani Perkuat Bisnis Biomassa dan NBS Tahun Ini https://t.co/QJCh2rUFut
127,2023-01-18 01:40:30+00:00,PerumPerhutani,Dari Sini Puluhan Ribu Bibit Pohon Jati di Priangan Timur Berasal https://t.co/HN0gzxMMBS
128,2023-01-18 01:24:35+00:00,PerumPerhutani,Perhutani Ungkap Rencana Bisnis 2023 https://t.co/4Tq7ZT8Trc
129,2023-01-18 01:20:26+00:00,PerumPerhutani,Perhutani akan Perkuat Bisnis Biomassa https://t.co/xWh8i35zIi
130,2023-01-18 01:16:17+00:00,PerumPerhutani,"Harlah Ke-18, Sekar Perhutani DPD KPH Surakarta Tanam Kayu Putih di Wonogiri https://t.co/ZnJzlLsP90"
131,2023-01-17 08:23:43+00:00,PerumPerhutani,"Peringati Harlah Ke-18, Sekar Perhutani DPD KPH Bandung Utara Santuni Anak Yatim Dan Pemberian Bibit Secara Simbolis Kepada LMDH Sanggabuana https://t.co/0TVazMQb1g"
132,2023-01-17 08:11:11+00:00,PerumPerhutani,"Peringati Hari Lahir Sekar Ke 18, Sekar DPD Perhutani Banten Berikan Bantuan Beasiswa Berprestasi dan Santunan Anak Yatim https://t.co/xeAz1q1qbD"
133,2023-01-17 08:10:47+00:00,PerumPerhutani,Perhutani Bersama SIGAP Lakukan Diklatsarnas Kebencanaan ke 2 di Garut https://t.co/4nEJw7GfM8
134,2023-01-17 08:10:30+00:00,PerumPerhutani,"Harlah Ke 18, Sekar Bersama Wisata Kamojdang Filage Lakukan Penanaman di Garut https://t.co/dUGNG6YFlu"
135,2023-01-17 08:10:06+00:00,PerumPerhutani,Perhutani Tutup Masa PKL Siswa SMKN 3 Garut https://t.co/uh340dLk05
136,2023-01-17 08:09:17+00:00,PerumPerhutani,IIK-Perhutani Berikan Bantuan Mushaf Al-Qur’an Kepada Yayasan Miftahul Ma’arif Di Indramayu https://t.co/C744xj5spm
137,2023-01-17 07:06:58+00:00,PerumPerhutani,Perhutani Bersama YKP3JS Jawa Tengah Serahkan Bantuan Dana Pendidikan Kepada Pelajar Berprestasi di Balapulang https://t.co/sCeuaZb4ve
138,2023-01-17 06:46:28+00:00,PerumPerhutani,Perhutani Bersama Stickpala Gelar Konsevasi Maraton 2023 di Wonosobo https://t.co/q9AGLbJd5m
139,2023-01-17 06:08:24+00:00,PerumPerhutani,Perkuat Sinergitas dan Kebersamaan Perhutani Bersama Stakeholders Gelar Diskusi Bangun Banyuwangi Lebih Baik https://t.co/aULnqNPs8x
140,2023-01-17 03:11:43+00:00,PerumPerhutani,"Bangun Sinergitas, Perhutani Bersama PLN Sepakat Sukseskan Program Listrik Desa di Banyuwangi https://t.co/2h8URBGy8K"
141,2023-01-17 02:08:34+00:00,PerumPerhutani,Perhutani Kediri Mengawali Pekerjaan di Tahun 2023 dengan Doa dan Santuni Anak Yatim https://t.co/WMjylaiQuY
142,2023-01-17 01:10:49+00:00,PerumPerhutani,Perhutani Divre Jatim Teken PKS dengan 5 Supervisor Tebu di Surabaya https://t.co/3yIFDo9kVI
143,2023-01-17 00:49:46+00:00,PerumPerhutani,"Bangun Sinergitas, Perhutani dan TN Alas Purwo Sepakat Kolaborasi Pengelolaan Hutan Bersama di Banyuwangi https://t.co/P6OtbdXrxP"
144,2023-01-16 23:48:12+00:00,PerumPerhutani,Perhutani Ngawi Lakukan Doa Bersama dan Santuni Warga Sekitar Hutan https://t.co/l7dzchhzrT
145,2023-01-16 23:31:38+00:00,PerumPerhutani,"Harlah Sekar ke-18, DPD Sekar Pasuruan Tanam Pohon dan Santuni Anak Yatim dan Lansia https://t.co/MkLqGD9AjN"
146,2023-01-16 23:04:08+00:00,PerumPerhutani,"Perkuat Sinersitas, Perhutani Bersama Pemkab. Banyuwangi Satukan Visi Penggunaan Kawasan Hutan di Banyuwangi https://t.co/Yby2iw65TH"
147,2023-01-16 22:36:06+00:00,PerumPerhutani,Perhutani Bersama MSP Mojokerto Berikan Edukasi kepada Petani Hutan di Mojokerto https://t.co/LlpSOHAPvy
148,2023-01-16 10:32:22+00:00,PerumPerhutani,Sekar DPD Majalengka dan Perhutani Berikan Sembako Kepada Masyarakat Dalam Rangka Harlah Sekar Ke-18 https://t.co/FsQmQ4SwQI
149,2023-01-16 10:26:57+00:00,PerumPerhutani,Perhutani Serahkan Bantuan Program TJSL Untuk Pengelola Wisata Panembongan di Kuningan https://t.co/Cky0pnUuJh
150,2023-01-16 10:26:20+00:00,PerumPerhutani,Peringati Harlah Ke -18 DPD Sekar Perhutani Kuningan Berikan Santunan Anak Yatim https://t.co/NqR8GL7iWi
151,2023-01-16 10:25:48+00:00,PerumPerhutani,Perhutani Bandung Selatan Raih Tiga Penghargaan untuk Kinerja Tahun 2022 https://t.co/NxNEgyKcAG
152,2023-01-16 10:25:27+00:00,PerumPerhutani,Perhutani Tandatangani Perpanjangan PKS Wisata Curug Cijalu Bersama Mitra CV Gilang Kencana Di Subang https://t.co/robl57PMtR
153,2023-01-16 09:34:21+00:00,PerumPerhutani,Perhutani Bersama Forkopimda Tingkat II Bondowoso Lakukan Tinjauan Lapangan https://t.co/6xidVcWUlg
154,2023-01-16 06:54:55+00:00,PerumPerhutani,"Sawangan Adventure, Wisata Alam Petualangan Perhutani di Kedu Selatan https://t.co/HC42FdfDwv"
155,2023-01-16 06:28:06+00:00,PerumPerhutani,"Perhutani Bersama Pecinta Alam Celeng Keluyuran, Jalin Sinergi di Gunung Andong https://t.co/SNSE1fq7Ac"
156,2023-01-16 03:55:41+00:00,PerumPerhutani,"Sejahterakan Masyarakat Hutan, Perhutani Teken PKS Kuliner Sejati dengan LMDH https://t.co/TxrVR7Fhh5"
157,2023-01-16 02:06:42+00:00,PerumPerhutani,"Jalin Sinergitas, Perhutani Olah Raga Bersama Instansi Terkait di Blora https://t.co/Jg3Swm6SEW"
158,2023-01-13 09:30:01+00:00,PerumPerhutani,Serikat Karyawan Perhutani Kedu Selatan Peringati Hari Jadi Ke 18 Dengan Berbagi Sembako Kepada Panti Asuhan di Purworejo https://t.co/BvxBB0P6nU
159,2023-01-13 09:24:30+00:00,PerumPerhutani,Perkuat Kerjasama Antar Stakeholders Perhutani Gelar Ngopi Bareng Bersama di Banyuwangi https://t.co/32praeSXan
160,2023-01-13 08:49:06+00:00,PerumPerhutani,"Perkuat Bisnis Biomassa dan NBS, Perhutani Gelar Kick Off RKAP 2023 https://t.co/ER8gmtH0M8"
161,2023-01-13 03:49:29+00:00,PerumPerhutani,Harlah Sekar ke-18 DPD Sekar Perhutani Jombang Lakukan Aksi Terpuji Santuni Anak Yatim dan bagikan Bibit Tanaman https://t.co/Uc1drMjXbf
162,2023-01-13 03:21:58+00:00,PerumPerhutani,"Harlah ke-18, Sekar Perhutani DPD Ngawi Berikan Santunan Yatim Piatu dan Lansia https://t.co/Mw2YbPLlA6"
163,2023-01-13 02:33:49+00:00,PerumPerhutani,Peringati Harlah Sekar Ke-18 DPD Sekar Perhutani KPH Madura Diwarnai Beragam Aksi https://t.co/zXTEoSWB9v
164,2023-01-13 01:56:49+00:00,PerumPerhutani,Perhutani Bersama Muspicam Sambeng Gelar Diskusi Interaktif di Lamongan https://t.co/gIvyctYY1Z
165,2023-01-13 01:26:56+00:00,PerumPerhutani,"Sejahterakan Masyarakat Hutan, Perhutani Teken Budidaya Tanaman Balsa dengan KTH Sejati https://t.co/iwjJE4E558"
166,2023-01-12 09:50:28+00:00,ekshijaulestari,"@erickthohir @mohmahfudmd Pak, coba cek ke @PerumPerhutani , ada banyak korban PHK anak perusahaanya yg belum dibayar hak2nya dari tahun 2016. Jangankan pesangon,gaji yg seharusnya dibayarkan saja masih jadi utang perusahaan. Gmn pak solusinya?? @jasatirta_2 @jokowi"
